[I 2025-07-23 21:15:47,580] Trial 98 finished with value: 480.63896799087524 and parameters: {'n_steps': 128, 'batch_size': 128, 'learning_rate': 0.0004121348392663153, 'n_epochs': 14, 'gamma': 0.9187516647893181, 'clip_range': 0.30038984098263194, 'ent_coef': 1.0483344602645906e-07, 'vf_coef': 0.1225819831163926, 'max_grad_norm': 2.6059330651942814, 'gae_lambda': 0.8501175766033685, 'layer_size': 46, 'n_layers': 1, 'activation_fn': 'elu'}. Best is trial 75 with value: 496.4908022880554.
Tuning PPO:  96%|████████████████████████████████████████████████████████████████████████████████████████████████████████████████████████████████████████████████▉      | 48/50 [2:06:43<07:39, 229.85s/it, best_val=496.5]
[I 2025-07-23 21:17:52,599] Trial 99 finished with value: 378.5159454345703 and parameters: {'n_steps': 128, 'batch_size': 128, 'learning_rate': 0.00027343567726139414, 'n_epochs': 15, 'gamma': 0.9525764009919897, 'clip_range': 0.29443633674413205, 'ent_coef': 0.001535739349616875, 'vf_coef': 0.1635947501612707, 'max_grad_norm': 2.6363004910540573, 'gae_lambda': 0.8520203122486587, 'layer_size': 153, 'n_layers': 1, 'activation_fn': 'elu'}. Best is trial 75 with value: 496.4908022880554.
Tuning PPO:  98%|███████████████████████████████████████████████████████████████████████████████████████████████████████████████████████████████████████████████████▉   | 49/50 [2:08:48<03:18, 198.70s/it, best_val=496.5]
[I 2025-07-23 21:19:00,312] Trial 97 finished with value: 411.8495178222656 and parameters: {'n_steps': 64, 'batch_size': 64, 'learning_rate': 0.0002731714391487623, 'n_epochs': 14, 'gamma': 0.9518766622324027, 'clip_range': 0.25578050745521996, 'ent_coef': 0.09224708925733542, 'vf_coef': 0.15169448668704788, 'max_grad_norm': 2.587607871990064, 'gae_lambda': 0.8513046599160032, 'layer_size': 148, 'n_layers': 4, 'activation_fn': 'elu'}. Best is trial 75 with value: 496.4908022880554.
Tuning PPO: 100%|███████████████████████████████████████████████████████████████████████████████████████████████████████████████████████████████████████████████████████| 50/50 [2:09:56<00:00, 159.67s/it, best_val=496.5]
Tuning PPO: 100%|███████████████████████████████████████████████████████████████████████████████████████████████████████████████████████████████████████████████████████| 50/50 [2:09:56<00:00, 155.93s/it, best_val=496.5] 
Best reward: 496.49
  n_steps: 64
  batch_size: 64
  learning_rate: 0.000296150311190066
  n_epochs: 12
  gamma: 0.9677399132023956
  clip_range: 0.2377298467476699
  ent_coef: 7.275162305166893e-05
  vf_coef: 0.4921035770453935
  max_grad_norm: 0.4403350142092357
  gae_lambda: 0.8192968355690624
  layer_size: 122
  n_layers: 1
  activation_fn: leaky_relu