(myenv) PS C:\Users\benva\OneDrive\Documents\MATLAB\full_wrap\ip_jax> python .\ip_jax_hp_smooth.py
Tuning PPO on JAX env with SB3...
[I 2025-07-23 16:43:24,481] A new study created in RDB with name: jax_ppo_tuning
Tuning PPO:   0%|                                                                                                                                                                                   | 0/50 [00:00<?, ?it/s]Pruning trial 2: batch_size=512 incompatible with n_steps=256
[I 2025-07-23 16:43:25,024] Trial 2 pruned. 
Tuning PPO:   2%|███▏                                                                                                                                                           | 1/50 [00:00<00:26,  1.86it/s, best_val=–]
C:\Users\benva\OneDrive\Documents\MATLAB\myenv\Lib\site-packages\stable_baselines3\common\on_policy_algorithm.py:150: UserWarning: You are trying to run PPO on the GPU, but it is primarily intended to run on the CPU when not using a CNN policy (you are using ActorCriticPolicy which should be a MlpPolicy). See https://github.com/DLR-RM/stable-baselines3/issues/1245 for more info. You can pass `device='cpu'` or `export CUDA_VISIBLE_DEVICES=` to force using the CPU.Note: The model will train, but the GPU utilization will be poor and the training might take longer than on CPU.
  warnings.warn(
Pruning trial 1: Optuna judged it underperforming at step 40000 with reward 68.00
[I 2025-07-23 16:49:44,407] Trial 1 pruned. 
Tuning PPO:   4%|██████▏                                                                                                                                                     | 2/50 [06:19<2:58:42, 223.39s/it, best_val=–]
Pruning trial 3: Optuna judged it underperforming at step 80000 with reward 348.01
[I 2025-07-23 17:00:13,304] Trial 3 pruned. 
Tuning PPO:   6%|█████████▎                                                                                                                                                  | 3/50 [16:48<5:20:01, 408.55s/it, best_val=–]
[I 2025-07-23 17:00:22,074] Trial 0 finished with value: 412.27392196655273 and parameters: {'n_steps': 1024, 'batch_size': 512, 'learning_rate': 0.0004346164665694044, 'n_epochs': 9, 'gamma': 0.9249026659385937, 'clip_range': 0.12380922241439632, 'ent_coef': 0.00046157854746805535, 'vf_coef': 0.9859415963058652, 'max_grad_norm': 3.4584850400341534, 'gae_lambda': 0.935065513469221, 'layer_size': 332, 'n_layers': 3, 'activation_fn': 'leaky_relu'}. Best is trial 0 with value: 412.27392196655273.
Tuning PPO:   8%|████████████▏                                                                                                                                           | 4/50 [16:57<3:12:13, 250.72s/it, best_val=412.3]
Pruning trial 7: batch_size=256 incompatible with n_steps=128
[I 2025-07-23 17:00:22,126] Trial 7 pruned. 
Tuning PPO:  10%|███████████████▏                                                                                                                                        | 5/50 [16:57<3:08:02, 250.72s/it, best_val=412.3]
Pruning trial 5: Optuna judged it underperforming at step 40000 with reward 247.39
[I 2025-07-23 17:00:32,524] Trial 5 pruned. 
Tuning PPO:  12%|██████████████████▏                                                                                                                                     | 6/50 [17:08<1:28:26, 120.59s/it, best_val=412.3]
[I 2025-07-23 17:04:16,416] Trial 4 finished with value: 313.245662689209 and parameters: {'n_steps': 64, 'batch_size': 64, 'learning_rate': 0.00041714806983254486, 'n_epochs': 12, 'gamma': 0.9543003980154758, 'clip_range': 0.2583562179373245, 'ent_coef': 4.6420322706432356e-05, 'vf_coef': 0.2970207354278512, 'max_grad_norm': 0.6464250830193541, 'gae_lambda': 0.8248577664307052, 'layer_size': 146, 'n_layers': 1, 'activation_fn': 'leaky_relu'}. Best is trial 0 with value: 412.27392196655273.
Tuning PPO:  14%|█████████████████████▎                                                                                                                                  | 7/50 [20:51<1:46:45, 148.96s/it, best_val=412.3]
Pruning trial 8: Optuna judged it underperforming at step 40000 with reward 304.27
[I 2025-07-23 17:10:39,136] Trial 8 pruned. 
Tuning PPO:  16%|████████████████████████▎                                                                                                                               | 8/50 [27:14<2:30:22, 214.83s/it, best_val=412.3]
Pruning trial 10: Optuna judged it underperforming at step 40000 with reward 146.15
[I 2025-07-23 17:12:19,206] Trial 10 pruned. 
Tuning PPO:  18%|███████████████████████████▎                                                                                                                            | 9/50 [28:54<2:04:17, 181.89s/it, best_val=412.3]
Pruning trial 6: Optuna judged it underperforming at step 40000 with reward 143.92
[I 2025-07-23 17:14:12,821] Trial 6 pruned. 
Tuning PPO:  20%|██████████████████████████████▏                                                                                                                        | 10/50 [30:48<1:48:01, 162.04s/it, best_val=412.3]
Tuning PPO:  22%|█████████████████████████████████▏                                                                                                                     | 11/50 [35:28<2:07:50, 196.68s/it, best_val=412.3]
Pruning trial 12: Optuna judged it underperforming at step 40000 with reward 31.50
[I 2025-07-23 17:20:29,429] Trial 12 pruned.
Tuning PPO:  24%|████████████████████████████████████▏                                                                                                                  | 12/50 [37:04<1:45:49, 167.10s/it, best_val=412.3]
[I 2025-07-23 17:22:33,651] Trial 9 finished with value: 410.1415672302246 and parameters: {'n_steps': 128, 'batch_size': 128, 'learning_rate': 0.000337641954027778, 'n_epochs': 4, 'gamma': 0.9204102029426879, 'clip_range': 0.25099604544648746, 'ent_coef': 0.02211928449504647, 'vf_coef': 0.7053843520425263, 'max_grad_norm': 2.7096357843338663, 'gae_lambda': 0.9467518707607916, 'layer_size': 292, 'n_layers': 4, 'activation_fn': 'tanh'}. Best is trial 0 with value: 412.27392196655273.
Tuning PPO:  26%|███████████████████████████████████████▎                                                                                                               | 13/50 [39:09<1:35:11, 154.37s/it, best_val=412.3]
Pruning trial 11: Optuna judged it underperforming at step 80000 with reward 411.92
[I 2025-07-23 17:33:20,413] Trial 11 pruned.
Tuning PPO:  28%|██████████████████████████████████████████▎                                                                                                            | 14/50 [49:55<3:00:35, 300.97s/it, best_val=412.3]
Pruning trial 16: Optuna judged it underperforming at step 80000 with reward 345.89
[I 2025-07-23 17:37:27,374] Trial 16 pruned.
Tuning PPO:  30%|█████████████████████████████████████████████▎                                                                                                         | 15/50 [54:02<2:46:09, 284.86s/it, best_val=412.3]
[I 2025-07-23 17:39:53,835] Trial 17 pruned.
Tuning PPO:  36%|██████████████████████████████████████████████████████▎                                                                                                | 18/50 [56:29<1:20:18, 150.56s/it, best_val=412.3]
Pruning trial 20: reward 17.08 below threshold 20 at 20000 steps
[I 2025-07-23 17:40:10,530] Trial 20 pruned.
Tuning PPO:  38%|██████████████████████████████████████████████████████████▏                                                                                              | 19/50 [56:46<59:43, 115.61s/it, best_val=412.3]
[I 2025-07-23 17:42:02,658] Trial 15 finished with value: 48.19565010070801 and parameters: {'n_steps': 64, 'batch_size': 64, 'learning_rate': 0.0003648992226709558, 'n_epochs': 13, 'gamma': 0.9442647922143269, 'clip_range': 0.32245849263627774, 'ent_coef': 0.0008144199932479141, 'vf_coef': 0.2039811757943006, 'max_grad_norm': 4.510043219574641, 'gae_lambda': 0.802915966024505, 'layer_size': 196, 'n_layers': 1, 'activation_fn': 'leaky_relu'}. Best is trial 0 with value: 412.27392196655273.
Tuning PPO:  40%|█████████████████████████████████████████████████████████████▏                                                                                           | 20/50 [58:38<57:19, 114.66s/it, best_val=412.3]
Pruning trial 19: Optuna judged it underperforming at step 40000 with reward 57.37
[I 2025-07-23 17:42:26,826] Trial 19 pruned.
Tuning PPO:  42%|████████████████████████████████████████████████████████████████▋                                                                                         | 21/50 [59:02<43:11, 89.36s/it, best_val=412.3]
Pruning trial 21: reward 18.91 below threshold 20 at 20000 steps
[I 2025-07-23 17:42:29,933] Trial 21 pruned.
Tuning PPO:  44%|███████████████████████████████████████████████████████████████████▊                                                                                      | 22/50 [59:05<30:12, 64.74s/it, best_val=412.3]
Pruning trial 22: Optuna judged it underperforming at step 40000 with reward 64.30
[I 2025-07-23 17:46:37,393] Trial 22 pruned.
Tuning PPO:  46%|█████████████████████████████████████████████████████████████████████▍                                                                                 | 23/50 [1:03:12<52:56, 117.66s/it, best_val=412.3]
Pruning trial 25: Optuna judged it underperforming at step 40000 with reward 286.04
[I 2025-07-23 17:49:07,053] Trial 25 pruned.
Tuning PPO:  48%|████████████████████████████████████████████████████████████████████████▍                                                                              | 24/50 [1:05:42<55:02, 127.03s/it, best_val=412.3]
Pruning trial 27: batch_size=256 incompatible with n_steps=64
[I 2025-07-23 17:49:07,122] Trial 27 pruned.
Tuning PPO:  50%|███████████████████████████████████████████████████████████████████████████▌                                                                           | 25/50 [1:05:42<52:55, 127.03s/it, best_val=412.3]
Pruning trial 24: Optuna judged it underperforming at step 40000 with reward 276.97
[I 2025-07-23 17:49:20,076] Trial 24 pruned.
Tuning PPO:  52%|███████████████████████████████████████████████████████████████████████████████                                                                         | 26/50 [1:05:55<28:51, 72.14s/it, best_val=412.3]
Pruning trial 23: Optuna judged it underperforming at step 80000 with reward 192.93
[I 2025-07-23 17:55:16,198] Trial 23 pruned.
Tuning PPO:  54%|█████████████████████████████████████████████████████████████████████████████████▌                                                                     | 27/50 [1:11:51<54:22, 141.85s/it, best_val=412.3]
Pruning trial 29: Optuna judged it underperforming at step 40000 with reward 246.72
[I 2025-07-23 17:59:33,870] Trial 29 pruned.
Tuning PPO:  56%|███████████████████████████████████████████████████████████████████████████████████▍                                                                 | 28/50 [1:16:09<1:03:02, 171.92s/it, best_val=412.3]
[I 2025-07-23 18:02:19,457] Trial 26 finished with value: 349.93195724487305 and parameters: {'n_steps': 64, 'batch_size': 64, 'learning_rate': 0.0005092648051939325, 'n_epochs': 11, 'gamma': 0.9590513151812373, 'clip_range': 0.10318982289953227, 'ent_coef': 8.681590052039878e-05, 'vf_coef': 0.3607139974244744, 'max_grad_norm': 4.121208320385034, 'gae_lambda': 0.8943169768487003, 'layer_size': 39, 'n_layers': 1, 'activation_fn': 'leaky_relu'}. Best is trial 0 with value: 412.27392196655273.
Tuning PPO:  58%|███████████████████████████████████████████████████████████████████████████████████████████████████████████████▉                                                                                 | 29/50 [1:18:54<59:34, 170.20s/it, best_val=412.3] 
Pruning trial 32: batch_size=512 incompatible with n_steps=128
[I 2025-07-23 18:02:19,521] Trial 32 pruned.
Tuning PPO:  60%|███████████████████████████████████████████████████████████████████████████████████████████████████████████████████▊                                                                             | 30/50 [1:18:55<56:44, 170.20s/it, best_val=412.3] 
Pruning trial 28: Optuna judged it underperforming at step 80000 with reward 141.02
[I 2025-07-23 18:06:55,205] Trial 28 pruned.
Tuning PPO:  62%|███████████████████████████████████████████████████████████████████████████████████████████████████████████████████████▋                                                                         | 31/50 [1:23:30<49:26, 156.11s/it, best_val=412.3] 
Pruning trial 31: Optuna judged it underperforming at step 40000 with reward 244.07
[I 2025-07-23 18:07:14,903] Trial 31 pruned.
Tuning PPO:  64%|███████████████████████████████████████████████████████████████████████████████████████████████████████████████████████████▌                                                                     | 32/50 [1:23:50<37:06, 123.72s/it, best_val=412.3] 
Pruning trial 33: Optuna judged it underperforming at step 40000 with reward 104.78
[I 2025-07-23 18:09:07,279] Trial 33 pruned.
Tuning PPO:  66%|███████████████████████████████████████████████████████████████████████████████████████████████████████████████████████████████▍                                                                 | 33/50 [1:25:42<34:14, 120.84s/it, best_val=412.3] 
Pruning trial 35: reward 26.25 below threshold 50 at 30000 steps
[I 2025-07-23 18:11:05,083] Trial 35 pruned. 
Tuning PPO:  68%|███████████████████████████████████████████████████████████████████████████████████████████████████████████████████████████████████▏                                                             | 34/50 [1:27:40<32:00, 120.04s/it, best_val=412.3]
Pruning trial 37: Optuna judged it underperforming at step 40000 with reward 284.69
[I 2025-07-23 18:17:31,186] Trial 37 pruned. 
Tuning PPO:  70%|███████████████████████████████████████████████████████████████████████████████████████████████████████████████████████████████████████                                                          | 35/50 [1:34:06<48:18, 193.24s/it, best_val=412.3]
Pruning trial 30: Optuna judged it underperforming at step 80000 with reward 296.03
[I 2025-07-23 18:18:47,431] Trial 30 pruned. 
Tuning PPO:  72%|██████████████████████████████████████████████████████████████████████████████████████████████████████████████████████████████████████████▉                                                      | 36/50 [1:35:22<37:23, 160.23s/it, best_val=412.3]
Pruning trial 39: reward 32.60 below threshold 50 at 30000 steps
[I 2025-07-23 18:24:49,235] Trial 39 pruned. 
Tuning PPO:  74%|██████████████████████████████████████████████████████████████████████████████████████████████████████████████████████████████████████████████▊                                                  | 37/50 [1:41:24<47:15, 218.14s/it, best_val=412.3] 
Pruning trial 40: batch_size=256 incompatible with n_steps=64
[I 2025-07-23 18:24:49,321] Trial 40 pruned. 
Tuning PPO:  76%|██████████████████████████████████████████████████████████████████████████████████████████████████████████████████████████████████████████████████▋                                              | 38/50 [1:41:24<43:37, 218.14s/it, best_val=412.3]
[I 2025-07-23 18:26:57,683] Trial 34 finished with value: 492.6889662742615 and parameters: {'n_steps': 64, 'batch_size': 64, 'learning_rate': 0.0003356654063725427, 'n_epochs': 14, 'gamma': 0.9765771775679903, 'clip_range': 0.17113565216434562, 'ent_coef': 6.632959723693223e-05, 'vf_coef': 0.507947843340862, 'max_grad_norm': 2.685288749220153, 'gae_lambda': 0.8492233428272092, 'layer_size': 40, 'n_layers': 1, 'activation_fn': 'leaky_relu'}. Best is trial 34 with value: 492.6889662742615.
Tuning PPO:  78%|██████████████████████████████████████████████████████████████████████████████████████████████████████████████████████████████████████████████████████▌                                          | 39/50 [1:43:33<27:16, 148.76s/it, best_val=492.7]
[I 2025-07-23 18:33:56,189] Trial 36 finished with value: 295.2400245666504 and parameters: {'n_steps': 64, 'batch_size': 64, 'learning_rate': 0.0005045533962894017, 'n_epochs': 20, 'gamma': 0.982518829530779, 'clip_range': 0.1224609443255617, 'ent_coef': 3.725865912627126e-05, 'vf_coef': 0.24597307956798092, 'max_grad_norm': 1.5953206442550436, 'gae_lambda': 0.8702521874249468, 'layer_size': 38, 'n_layers': 1, 'activation_fn': 'leaky_relu'}. Best is trial 34 with value: 492.6889662742615.
Tuning PPO:  80%|██████████████████████████████████████████████████████████████████████████████████████████████████████████████████████████████████████████████████████████▍                                      | 40/50 [1:50:31<35:44, 214.46s/it, best_val=492.7]
Pruning trial 42: Optuna judged it underperforming at step 40000 with reward 290.67
[I 2025-07-23 18:36:38,003] Trial 42 pruned. 
Tuning PPO:  82%|██████████████████████████████████████████████████████████████████████████████████████████████████████████████████████████████████████████████████████████████▎                                  | 41/50 [1:53:13<30:07, 200.87s/it, best_val=492.7] 
[I 2025-07-23 18:38:46,569] Trial 38 finished with value: 491.590943813324 and parameters: {'n_steps': 1024, 'batch_size': 64, 'learning_rate': 0.0007748069893509607, 'n_epochs': 8, 'gamma': 0.9740529926028079, 'clip_range': 0.2980237043366144, 'ent_coef': 0.0012929515062295868, 'vf_coef': 0.11216747759439549, 'max_grad_norm': 2.9071063299029483, 'gae_lambda': 0.8767951345465863, 'layer_size': 76, 'n_layers': 1, 'activation_fn': 'relu'}. Best is trial 34 with value: 492.6889662742615.
Tuning PPO:  84%|██████████████████████████████████████████████████████████████████████████████████████████████████████████████████████████████████████████████████████████████████                               | 42/50 [1:55:22<24:11, 181.39s/it, best_val=492.7]
Pruning trial 43: Optuna judged it underperforming at step 40000 with reward 69.42
[I 2025-07-23 18:40:47,767] Trial 43 pruned. 
Tuning PPO:  86%|█████████████████████████████████████████████████████████████████████████████████████████████████████████████████████████████████████████████████████████████████████▉                           | 43/50 [1:57:23<19:12, 164.66s/it, best_val=492.7] 
[I 2025-07-23 18:45:18,646] Trial 41 finished with value: 412.741641998291 and parameters: {'n_steps': 128, 'batch_size': 128, 'learning_rate': 0.000831633567717988, 'n_epochs': 8, 'gamma': 0.9607878774296806, 'clip_range': 0.3025481757616888, 'ent_coef': 0.03698610355577312, 'vf_coef': 0.40244805583833065, 'max_grad_norm': 4.3130035512581655, 'gae_lambda': 0.949156027154129, 'layer_size': 282, 'n_layers': 4, 'activation_fn': 'tanh'}. Best is trial 34 with value: 492.6889662742615.
Tuning PPO:  88%|█████████████████████████████████████████████████████████████████████████████████████████████████████████████████████████████████████████████████████████████████████████▊                       | 44/50 [2:01:54<19:29, 194.85s/it, best_val=492.7]
Pruning trial 44: Optuna judged it underperforming at step 80000 with reward 307.99
[I 2025-07-23 18:50:06,256] Trial 44 pruned.
Tuning PPO:  90%|█████████████████████████████████████████████████████████████████████████████████████████████████████████████████████████████████████████████████████████████████████████████▋                   | 45/50 [2:06:41<18:28, 221.63s/it, best_val=492.7]
Pruning trial 47: Optuna judged it underperforming at step 40000 with reward 138.55
[I 2025-07-23 18:52:01,851] Trial 47 pruned.
Tuning PPO:  92%|█████████████████████████████████████████████████████████████████████████████████████████████████████████████████████████████████████████████████████████████████████████████████▌               | 46/50 [2:08:37<12:42, 190.67s/it, best_val=492.7]
Pruning trial 46: Optuna judged it underperforming at step 80000 with reward 237.38
[I 2025-07-23 18:54:14,480] Trial 46 pruned.
Tuning PPO:  94%|█████████████████████████████████████████████████████████████████████████████████████████████████████████████████████████████████████████████████████████████████████████████████████▍           | 47/50 [2:10:50<08:40, 173.58s/it, best_val=492.7]
[I 2025-07-23 18:54:39,453] Trial 45 finished with value: 408.4199447631836 and parameters: {'n_steps': 1024, 'batch_size': 64, 'learning_rate': 0.0008487124894157902, 'n_epochs': 9, 'gamma': 0.9964475195257093, 'clip_range': 0.3034383262880933, 'ent_coef': 0.002054891513897636, 'vf_coef': 0.14420092996297146, 'max_grad_norm': 1.9659391639546082, 'gae_lambda': 0.8488525783101588, 'layer_size': 72, 'n_layers': 1, 'activation_fn': 'relu'}. Best is trial 34 with value: 492.6889662742615.
Tuning PPO:  96%|█████████████████████████████████████████████████████████████████████████████████████████████████████████████████████████████████████████████████████████████████████████████████████████▎       | 48/50 [2:11:14<04:19, 129.59s/it, best_val=492.7]
Pruning trial 48: Optuna judged it underperforming at step 40000 with reward 104.23
[I 2025-07-23 18:55:52,589] Trial 48 pruned.
Tuning PPO:  98%|█████████████████████████████████████████████████████████████████████████████████████████████████████████████████████████████████████████████████████████████████████████████████████████████▏   | 49/50 [2:12:28<01:52, 112.81s/it, best_val=492.7]
Pruning trial 49: Optuna judged it underperforming at step 80000 with reward 347.99
