[I 2025-06-15 04:06:29,582] Trial 23 finished with value: 9.72234054005305 and parameters: {'learning_rate': 0.0002703238384206801, 'gamma': 0.9173504231219921, 'n_steps': 17, 'ent_coef': 0.002165816847842787, 'vf_coef': 0.440915954665951, 'max_grad_norm': 1.4599815800002798, 'rms_prop_eps': 0.00017117853015207203, 'use_rms_prop': True, 'n_layers': 3, 'layer_size': 152, 'activation_fn': 'elu'}. Best is trial 12 with value: 488.2008334333924.
Tuning A2C:  44%|█████████████████████████████████████████████████████████████████████▌                                                                                        | 22/50 [4:09:50<5:26:35, 699.83s/it, best_value=488.20]Starting MATLAB engine...
Using device: cuda
Deleted temporary model file: C:\Users\benva\AppData\Local\Temp\PendCart_202bd271.slx
Deleted: C:\Users\benva\OneDrive\Documents\MATLAB\full_wrap\PendCart_202bd271.slxc
[I 2025-06-15 04:07:48,917] Trial 21 finished with value: 480.8519903946045 and parameters: {'learning_rate': 0.0004598280319922455, 'gamma': 0.9187578556965191, 'n_steps': 14, 'ent_coef': 0.0029495616674856126, 'vf_coef': 0.703489330423744, 'max_grad_norm': 1.9668195300346512, 'rms_prop_eps': 5.8790717648763255e-05, 'use_rms_prop': True, 'n_layers': 3, 'layer_size': 242, 'activation_fn': 'tanh'}. Best is trial 12 with value: 488.2008334333924.
Tuning A2C:  46%|████████████████████████████████████████████████████████████████████████▋                                                                                     | 23/50 [4:11:09<3:51:07, 513.63s/it, best_value=488.20]Starting MATLAB engine...
Using device: cuda
Deleted temporary model file: C:\Users\benva\AppData\Local\Temp\PendCart_f1292b0e.slx
Deleted: C:\Users\benva\OneDrive\Documents\MATLAB\full_wrap\PendCart_f1292b0e.slxc
[I 2025-06-15 04:08:36,585] Trial 22 finished with value: 399.2329524743578 and parameters: {'learning_rate': 0.0004100783530264021, 'gamma': 0.9125344056650433, 'n_steps': 16, 'ent_coef': 1.3323667099025985e-07, 'vf_coef': 0.5744718301807967, 'max_grad_norm': 2.2261660989888816, 'rms_prop_eps': 6.488840321486867e-05, 'use_rms_prop': True, 'n_layers': 3, 'layer_size': 240, 'activation_fn': 'tanh'}. Best is trial 12 with value: 488.2008334333924.
Tuning A2C:  48%|███████████████████████████████████████████████████████████████████████████▊                                                                                  | 24/50 [4:11:57<2:41:59, 373.81s/it, best_value=488.20]Starting MATLAB engine...
Using device: cuda
Deleted temporary model file: C:\Users\benva\AppData\Local\Temp\PendCart_72b915c4.slx
Deleted: C:\Users\benva\OneDrive\Documents\MATLAB\full_wrap\PendCart_72b915c4.slxc
[I 2025-06-15 04:46:34,027] Trial 26 finished with value: 18.123998815335472 and parameters: {'learning_rate': 0.00059128139800966, 'gamma': 0.916982680854745, 'n_steps': 18, 'ent_coef': 0.00019136520604446782, 'vf_coef': 0.7324923708699891, 'max_grad_norm': 2.204739334155522, 'rms_prop_eps': 5.294374747809315e-05, 'use_rms_prop': True, 'n_layers': 3, 'layer_size': 248, 'activation_fn': 'tanh'}. Best is trial 12 with value: 488.2008334333924.
Tuning A2C:  50%|███████████████████████████████████████████████████████████████████████████████                                                                               | 25/50 [4:49:54<6:33:44, 944.98s/it, best_value=488.20]Starting MATLAB engine...
Using device: cuda
Deleted temporary model file: C:\Users\benva\AppData\Local\Temp\PendCart_55b381a3.slx
Deleted: C:\Users\benva\OneDrive\Documents\MATLAB\full_wrap\PendCart_55b381a3.slxc
[I 2025-06-15 04:50:18,617] Trial 24 finished with value: 368.3764721790553 and parameters: {'learning_rate': 0.0002962872494367978, 'gamma': 0.9159436117893808, 'n_steps': 16, 'ent_coef': 0.003820925272423986, 'vf_coef': 0.7150996813247399, 'max_grad_norm': 1.3865248841833528, 'rms_prop_eps': 0.00013567500717043875, 'use_rms_prop': True, 'n_layers': 3, 'layer_size': 243, 'activation_fn': 'tanh'}. Best is trial 12 with value: 488.2008334333924.
Tuning A2C:  52%|██████████████████████████████████████████████████████████████████████████████████▏                                                                           | 26/50 [4:53:39<4:51:32, 728.84s/it, best_value=488.20]Starting MATLAB engine...
Deleted temporary model file: C:\Users\benva\AppData\Local\Temp\PendCart_5348b2b4.slx
Deleted: C:\Users\benva\OneDrive\Documents\MATLAB\full_wrap\PendCart_5348b2b4.slxc
[I 2025-06-15 04:50:19,191] Trial 25 finished with value: 394.16013885665257 and parameters: {'learning_rate': 0.00055723983338831, 'gamma': 0.916336582997381, 'n_steps': 17, 'ent_coef': 0.007008036121115663, 'vf_coef': 0.6991847899236454, 'max_grad_norm': 2.289224550138391, 'rms_prop_eps': 5.787699096408581e-05, 'use_rms_prop': True, 'n_layers': 3, 'layer_size': 254, 'activation_fn': 'tanh'}. Best is trial 12 with value: 488.2008334333924.
Tuning A2C:  54%|█████████████████████████████████████████████████████████████████████████████████████▎                                                                        | 27/50 [4:53:40<3:15:37, 510.35s/it, best_value=488.20]Starting MATLAB engine...
Using device: cuda
Using device: cuda
Deleted temporary model file: C:\Users\benva\AppData\Local\Temp\PendCart_36df107e.slx
Deleted: C:\Users\benva\OneDrive\Documents\MATLAB\full_wrap\PendCart_36df107e.slxc
[I 2025-06-15 04:54:59,058] Trial 27 finished with value: 494.8679123832855 and parameters: {'learning_rate': 0.0005609313874353129, 'gamma': 0.9271100087931456, 'n_steps': 16, 'ent_coef': 0.00027892387987561745, 'vf_coef': 0.7229760725706151, 'max_grad_norm': 2.3188343262079782, 'rms_prop_eps': 0.00028937290303221105, 'use_rms_prop': True, 'n_layers': 3, 'layer_size': 251, 'activation_fn': 'tanh'}. Best is trial 27 with value: 494.8679123832855.
Tuning A2C:  56%|████████████████████████████████████████████████████████████████████████████████████████▍                                                                     | 28/50 [4:58:19<2:41:46, 441.20s/it, best_value=494.87]Starting MATLAB engine...
Using device: cuda
Deleted temporary model file: C:\Users\benva\AppData\Local\Temp\PendCart_6b168f13.slx
Deleted: C:\Users\benva\OneDrive\Documents\MATLAB\full_wrap\PendCart_6b168f13.slxc
[I 2025-06-15 05:25:51,068] Trial 28 finished with value: 8.145074765820256 and parameters: {'learning_rate': 0.0002825463508292844, 'gamma': 0.9250156296286733, 'n_steps': 13, 'ent_coef': 0.005229648162029578, 'vf_coef': 0.6886854059103346, 'max_grad_norm': 2.375708344016027, 'rms_prop_eps': 0.00024098182777911546, 'use_rms_prop': True, 'n_layers': 2, 'layer_size': 228, 'activation_fn': 'tanh'}. Best is trial 27 with value: 494.8679123832855.
Tuning A2C:  58%|███████████████████████████████████████████████████████████████████████████████████████████▋                                                                  | 29/50 [5:29:11<5:02:33, 864.46s/it, best_value=494.87]Starting MATLAB engine...
Using device: cuda
Deleted temporary model file: C:\Users\benva\AppData\Local\Temp\PendCart_3a913964.slx
Deleted: C:\Users\benva\OneDrive\Documents\MATLAB\full_wrap\PendCart_3a913964.slxc
[I 2025-06-15 05:29:46,557] Trial 30 finished with value: 13.313949412570414 and parameters: {'learning_rate': 0.00020691107621570863, 'gamma': 0.9279159853812015, 'n_steps': 33, 'ent_coef': 0.0009720581114723446, 'vf_coef': 0.6439897341459726, 'max_grad_norm': 2.493161948203323, 'rms_prop_eps': 0.0002687555278980807, 'use_rms_prop': True, 'n_layers': 2, 'layer_size': 223, 'activation_fn': 'tanh'}. Best is trial 27 with value: 494.8679123832855.
Tuning A2C:  60%|██████████████████████████████████████████████████████████████████████████████████████████████▊                                                               | 30/50 [5:33:07<3:45:15, 675.76s/it, best_value=494.87]Starting MATLAB engine...
Deleted temporary model file: C:\Users\benva\AppData\Local\Temp\PendCart_207b2fd1.slx
Deleted: C:\Users\benva\OneDrive\Documents\MATLAB\full_wrap\PendCart_207b2fd1.slxc
[I 2025-06-15 05:29:55,765] Trial 29 finished with value: 11.273360299010008 and parameters: {'learning_rate': 0.00021568571588520213, 'gamma': 0.9251425326249322, 'n_steps': 28, 'ent_coef': 0.0011289572716533765, 'vf_coef': 0.653232474229832, 'max_grad_norm': 0.3363426615273526, 'rms_prop_eps': 0.00024532002657014934, 'use_rms_prop': True, 'n_layers': 2, 'layer_size': 224, 'activation_fn': 'tanh'}. Best is trial 27 with value: 494.8679123832855.
Tuning A2C:  62%|█████████████████████████████████████████████████████████████████████████████████████████████████▉                                                            | 31/50 [5:33:16<2:30:40, 475.79s/it, best_value=494.87]Starting MATLAB engine...
Using device: cuda
Using device: cuda
Deleted temporary model file: C:\Users\benva\AppData\Local\Temp\PendCart_c9e1ea5f.slx
Deleted: C:\Users\benva\OneDrive\Documents\MATLAB\full_wrap\PendCart_c9e1ea5f.slxc
[I 2025-06-15 05:34:26,972] Trial 31 finished with value: 79.88352190652822 and parameters: {'learning_rate': 0.0006288305207107775, 'gamma': 0.9257000276087677, 'n_steps': 28, 'ent_coef': 0.0002560365184379282, 'vf_coef': 0.642472312729214, 'max_grad_norm': 2.4977261902146326, 'rms_prop_eps': 0.00027788135956372114, 'use_rms_prop': True, 'n_layers': 2, 'layer_size': 221, 'activation_fn': 'tanh'}. Best is trial 27 with value: 494.8679123832855.
Tuning A2C:  64%|█████████████████████████████████████████████████████████████████████████████████████████████████████                                                         | 32/50 [5:37:47<2:04:19, 414.42s/it, best_value=494.87]Starting MATLAB engine...
Using device: cuda
Deleted temporary model file: C:\Users\benva\AppData\Local\Temp\PendCart_9ef9e832.slx
Deleted: C:\Users\benva\OneDrive\Documents\MATLAB\full_wrap\PendCart_9ef9e832.slxc
[I 2025-06-15 06:05:36,381] Trial 32 finished with value: 11.388214621706043 and parameters: {'learning_rate': 0.0005919895168160082, 'gamma': 0.9452913981504972, 'n_steps': 141, 'ent_coef': 0.00017234112679641414, 'vf_coef': 0.7832811020619477, 'max_grad_norm': 3.4776371149836436, 'rms_prop_eps': 0.00032293019274843524, 'use_rms_prop': True, 'n_layers': 2, 'layer_size': 203, 'activation_fn': 'tanh'}. Best is trial 27 with value: 494.8679123832855.
Tuning A2C:  66%|████████████████████████████████████████████████████████████████████████████████████████████████████████▎                                                     | 33/50 [6:08:57<4:01:05, 850.92s/it, best_value=494.87]Starting MATLAB engine...
Using device: cuda
Deleted temporary model file: C:\Users\benva\AppData\Local\Temp\PendCart_b828fcb0.slx
Deleted: C:\Users\benva\OneDrive\Documents\MATLAB\full_wrap\PendCart_b828fcb0.slxc
[I 2025-06-15 06:14:38,468] Trial 34 finished with value: 401.52308028147945 and parameters: {'learning_rate': 0.000605758689239309, 'gamma': 0.9416822961971215, 'n_steps': 12, 'ent_coef': 0.0001273269180031667, 'vf_coef': 0.45425881073701074, 'max_grad_norm': 1.6627542694457673, 'rms_prop_eps': 3.3346156137904996e-05, 'use_rms_prop': True, 'n_layers': 3, 'layer_size': 202, 'activation_fn': 'tanh'}. Best is trial 27 with value: 494.8679123832855.
Tuning A2C:  68%|███████████████████████████████████████████████████████████████████████████████████████████████████████████▍                                                  | 34/50 [6:17:59<3:22:12, 758.27s/it, best_value=494.87]Starting MATLAB engine...
Deleted temporary model file: C:\Users\benva\AppData\Local\Temp\PendCart_ad0c6e1d.slx
Deleted: C:\Users\benva\OneDrive\Documents\MATLAB\full_wrap\PendCart_ad0c6e1d.slxc
[I 2025-06-15 06:14:41,113] Trial 33 finished with value: 399.6689569729801 and parameters: {'learning_rate': 0.0005450086135739403, 'gamma': 0.9440264087146253, 'n_steps': 12, 'ent_coef': 0.00030107817768154274, 'vf_coef': 0.763441709614225, 'max_grad_norm': 1.6333341527579244, 'rms_prop_eps': 3.4395826726954465e-05, 'use_rms_prop': True, 'n_layers': 3, 'layer_size': 197, 'activation_fn': 'tanh'}. Best is trial 27 with value: 494.8679123832855.
Tuning A2C:  70%|██████████████████████████████████████████████████████████████████████████████████████████████████████████████▌                                               | 35/50 [6:18:01<2:12:53, 531.58s/it, best_value=494.87]Starting MATLAB engine...
Using device: cuda
Using device: cuda
Deleted temporary model file: C:\Users\benva\AppData\Local\Temp\PendCart_17a2bb9f.slx
Deleted: C:\Users\benva\OneDrive\Documents\MATLAB\full_wrap\PendCart_17a2bb9f.slxc
[I 2025-06-15 06:21:32,005] Trial 35 finished with value: 27.236382003274475 and parameters: {'learning_rate': 0.0006743970910271876, 'gamma': 0.944641698741579, 'n_steps': 1960, 'ent_coef': 0.020314575308087644, 'vf_coef': 0.7981569387702422, 'max_grad_norm': 1.6626219852747384, 'rms_prop_eps': 3.487927259097932e-05, 'use_rms_prop': True, 'n_layers': 3, 'layer_size': 201, 'activation_fn': 'tanh'}. Best is trial 27 with value: 494.8679123832855.
Tuning A2C:  72%|█████████████████████████████████████████████████████████████████████████████████████████████████████████████████▊                                            | 36/50 [6:24:52<1:55:35, 495.37s/it, best_value=494.87]Starting MATLAB engine...
Using device: cuda
Deleted temporary model file: C:\Users\benva\AppData\Local\Temp\PendCart_54c3f64f.slx
Deleted: C:\Users\benva\OneDrive\Documents\MATLAB\full_wrap\PendCart_54c3f64f.slxc
[I 2025-06-15 06:44:49,037] Trial 36 finished with value: 116.84291915216143 and parameters: {'learning_rate': 0.0006919953764262836, 'gamma': 0.9381283320650109, 'n_steps': 12, 'ent_coef': 0.026689087954555393, 'vf_coef': 0.7731636237625066, 'max_grad_norm': 1.6122789486740299, 'rms_prop_eps': 3.658730352272644e-05, 'use_rms_prop': True, 'n_layers': 3, 'layer_size': 254, 'activation_fn': 'tanh'}. Best is trial 27 with value: 494.8679123832855.
Tuning A2C:  74%|████████████████████████████████████████████████████████████████████████████████████████████████████████████████████▉                                         | 37/50 [6:48:09<2:45:56, 765.87s/it, best_value=494.87]Starting MATLAB engine...
Using device: cuda
Deleted temporary model file: C:\Users\benva\AppData\Local\Temp\PendCart_16cd5782.slx
Deleted: C:\Users\benva\OneDrive\Documents\MATLAB\full_wrap\PendCart_16cd5782.slxc
[I 2025-06-15 06:54:18,569] Trial 38 finished with value: 18.678689983117074 and parameters: {'learning_rate': 0.0001657712723136102, 'gamma': 0.9112759688893116, 'n_steps': 56, 'ent_coef': 1.1792613222456282e-05, 'vf_coef': 0.39088241733942053, 'max_grad_norm': 1.2116869769737213, 'rms_prop_eps': 9.81579251402721e-05, 'use_rms_prop': True, 'n_layers': 3, 'layer_size': 256, 'activation_fn': 'tanh'}. Best is trial 27 with value: 494.8679123832855.
Tuning A2C:  76%|████████████████████████████████████████████████████████████████████████████████████████████████████████████████████████                                      | 38/50 [6:57:39<2:21:23, 706.97s/it, best_value=494.87]Starting MATLAB engine...
Using device: cuda
Deleted temporary model file: C:\Users\benva\AppData\Local\Temp\PendCart_abd0fdb2.slx
Deleted: C:\Users\benva\OneDrive\Documents\MATLAB\full_wrap\PendCart_abd0fdb2.slxc
[I 2025-06-15 06:58:13,088] Trial 37 finished with value: 9.228664421490206 and parameters: {'learning_rate': 0.0001629777072077558, 'gamma': 0.9560753706632827, 'n_steps': 1814, 'ent_coef': 0.015341617011186798, 'vf_coef': 0.9802282202666892, 'max_grad_norm': 2.961031485112407, 'rms_prop_eps': 9.36851013092328e-05, 'use_rms_prop': True, 'n_layers': 3, 'layer_size': 236, 'activation_fn': 'relu'}. Best is trial 27 with value: 494.8679123832855.
Tuning A2C:  78%|███████████████████████████████████████████████████████████████████████████████████████████████████████████████████████████▏                                  | 39/50 [7:01:33<1:43:37, 565.23s/it, best_value=494.87]Starting MATLAB engine...
Using device: cuda
Deleted temporary model file: C:\Users\benva\AppData\Local\Temp\PendCart_7d00f84b.slx
Deleted: C:\Users\benva\OneDrive\Documents\MATLAB\full_wrap\PendCart_7d00f84b.slxc
[I 2025-06-15 07:01:34,193] Trial 39 finished with value: 21.62575086423285 and parameters: {'learning_rate': 0.0001582563589161433, 'gamma': 0.9573219941481755, 'n_steps': 49, 'ent_coef': 1.589961544571807e-05, 'vf_coef': 0.3800817732559439, 'max_grad_norm': 2.6939850076984166, 'rms_prop_eps': 8.473996924756522e-06, 'use_rms_prop': True, 'n_layers': 3, 'layer_size': 234, 'activation_fn': 'relu'}. Best is trial 27 with value: 494.8679123832855.
Tuning A2C:  80%|██████████████████████████████████████████████████████████████████████████████████████████████████████████████████████████████▍                               | 40/50 [7:04:55<1:15:59, 456.00s/it, best_value=494.87]Starting MATLAB engine...
Using device: cuda
Deleted temporary model file: C:\Users\benva\AppData\Local\Temp\PendCart_f7e2054b.slx
Deleted: C:\Users\benva\OneDrive\Documents\MATLAB\full_wrap\PendCart_f7e2054b.slxc
[I 2025-06-15 07:25:04,670] Trial 40 finished with value: 19.182203506541462 and parameters: {'learning_rate': 0.00013736775412489678, 'gamma': 0.9641269547552943, 'n_steps': 48, 'ent_coef': 5.461435906107192e-06, 'vf_coef': 0.20838056828514073, 'max_grad_norm': 1.2079789190871146, 'rms_prop_eps': 9.331444025059941e-05, 'use_rms_prop': True, 'n_layers': 3, 'layer_size': 231, 'activation_fn': 'relu'}. Best is trial 27 with value: 494.8679123832855.
Tuning A2C:  82%|█████████████████████████████████████████████████████████████████████████████████████████████████████████████████████████████████▌                            | 41/50 [7:28:25<1:51:21, 742.34s/it, best_value=494.87]Starting MATLAB engine...
Using device: cuda
Deleted temporary model file: C:\Users\benva\AppData\Local\Temp\PendCart_856153c9.slx
Deleted: C:\Users\benva\OneDrive\Documents\MATLAB\full_wrap\PendCart_856153c9.slxc
[I 2025-06-15 07:34:31,751] Trial 41 finished with value: 14.403910804133341 and parameters: {'learning_rate': 0.00033910679331062237, 'gamma': 0.9537515561854584, 'n_steps': 47, 'ent_coef': 6.705383168180761e-05, 'vf_coef': 0.9385168740673457, 'max_grad_norm': 2.846748831944682, 'rms_prop_eps': 0.0007890048007510725, 'use_rms_prop': True, 'n_layers': 3, 'layer_size': 237, 'activation_fn': 'relu'}. Best is trial 27 with value: 494.8679123832855.
Tuning A2C:  84%|████████████████████████████████████████████████████████████████████████████████████████████████████████████████████████████████████▋                         | 42/50 [7:37:52<1:31:58, 689.76s/it, best_value=494.87]Starting MATLAB engine...
Using device: cuda
Deleted temporary model file: C:\Users\benva\AppData\Local\Temp\PendCart_1c7d64cc.slx
Deleted: C:\Users\benva\OneDrive\Documents\MATLAB\full_wrap\PendCart_1c7d64cc.slxc
[I 2025-06-15 07:41:22,049] Trial 43 finished with value: 15.825472956871167 and parameters: {'learning_rate': 0.00034637862021445173, 'gamma': 0.9326091052173546, 'n_steps': 22, 'ent_coef': 3.899846585957476e-05, 'vf_coef': 0.21978694496702722, 'max_grad_norm': 2.006739131581763, 'rms_prop_eps': 0.000663570081202636, 'use_rms_prop': False, 'n_layers': 3, 'layer_size': 211, 'activation_fn': 'elu'}. Best is trial 27 with value: 494.8679123832855.
Tuning A2C:  86%|███████████████████████████████████████████████████████████████████████████████████████████████████████████████████████████████████████▉                      | 43/50 [7:44:42<1:10:41, 605.92s/it, best_value=494.87]Starting MATLAB engine...
Using device: cuda
Deleted temporary model file: C:\Users\benva\AppData\Local\Temp\PendCart_cfe29b6d.slx
Deleted: C:\Users\benva\OneDrive\Documents\MATLAB\full_wrap\PendCart_cfe29b6d.slxc
[I 2025-06-15 07:42:45,494] Trial 42 finished with value: 272.01641746885036 and parameters: {'learning_rate': 0.00035169657744441734, 'gamma': 0.9630927255026789, 'n_steps': 22, 'ent_coef': 6.600025543138224e-05, 'vf_coef': 0.21671672108154078, 'max_grad_norm': 0.591282801633167, 'rms_prop_eps': 9.921656497106318e-06, 'use_rms_prop': True, 'n_layers': 3, 'layer_size': 212, 'activation_fn': 'elu'}. Best is trial 27 with value: 494.8679123832855.
Tuning A2C:  88%|████████████████████████████████████████████████████████████████████████████████████████████████████████████████████████████████████████████▊                   | 44/50 [7:46:06<44:55, 449.18s/it, best_value=494.87]Starting MATLAB engine...
Using device: cuda
Deleted temporary model file: C:\Users\benva\AppData\Local\Temp\PendCart_318b85fd.slx
Deleted: C:\Users\benva\OneDrive\Documents\MATLAB\full_wrap\PendCart_318b85fd.slxc
[I 2025-06-15 08:05:20,341] Trial 44 finished with value: 20.48575499513592 and parameters: {'learning_rate': 0.00034317020565451903, 'gamma': 0.9374424481142927, 'n_steps': 22, 'ent_coef': 5.7638773680368556e-05, 'vf_coef': 0.49087497125741697, 'max_grad_norm': 2.0919647656996725, 'rms_prop_eps': 0.0007058353305119489, 'use_rms_prop': True, 'n_layers': 3, 'layer_size': 211, 'activation_fn': 'elu'}. Best is trial 27 with value: 494.8679123832855.
Tuning A2C:  90%|██████████████████████████████████████████████████████████████████████████████████████████████████████████████████████████████████████████████▏               | 45/50 [8:08:41<1:00:04, 720.88s/it, best_value=494.87]Starting MATLAB engine...
Using device: cuda
Deleted temporary model file: C:\Users\benva\AppData\Local\Temp\PendCart_465a58dd.slx
Deleted: C:\Users\benva\OneDrive\Documents\MATLAB\full_wrap\PendCart_465a58dd.slxc
