[I 2025-06-15 08:14:20,495] Trial 45 finished with value: 13.773705248204195 and parameters: {'learning_rate': 0.000416562693027406, 'gamma': 0.9337389223182146, 'n_steps': 23, 'ent_coef': 8.290765793516047e-05, 'vf_coef': 0.5020595868953286, 'max_grad_norm': 1.9461156650781175, 'rms_prop_eps': 0.0004476993553392617, 'use_rms_prop': True, 'n_layers': 3, 'layer_size': 209, 'activation_fn': 'elu'}. Best is trial 27 with value: 494.8679123832855.
Tuning A2C:  92%|███████████████████████████████████████████████████████████████████████████████████████████████████████████████████████████████████████████████████▏            | 46/50 [8:17:41<44:26, 666.66s/it, best_value=494.87]Starting MATLAB engine...
Using device: cuda
Deleted temporary model file: C:\Users\benva\AppData\Local\Temp\PendCart_b58a0c48.slx
Deleted: C:\Users\benva\OneDrive\Documents\MATLAB\full_wrap\PendCart_b58a0c48.slxc
[I 2025-06-15 08:24:52,195] Trial 46 finished with value: 304.0182121520672 and parameters: {'learning_rate': 0.0004296428111136474, 'gamma': 0.9212385861915735, 'n_steps': 11, 'ent_coef': 0.00012632345328023693, 'vf_coef': 0.49943711040248784, 'max_grad_norm': 0.5456991961666935, 'rms_prop_eps': 4.789208999391549e-05, 'use_rms_prop': True, 'n_layers': 3, 'layer_size': 173, 'activation_fn': 'tanh'}. Best is trial 27 with value: 494.8679123832855.
Tuning A2C:  94%|██████████████████████████████████████████████████████████████████████████████████████████████████████████████████████████████████████████████████████▍         | 47/50 [8:28:13<32:48, 656.17s/it, best_value=494.87]Deleted temporary model file: C:\Users\benva\AppData\Local\Temp\PendCart_458f30b5.slx
Deleted: C:\Users\benva\OneDrive\Documents\MATLAB\full_wrap\PendCart_458f30b5.slxc
[I 2025-06-15 08:27:38,621] Trial 47 finished with value: 400.0031373421078 and parameters: {'learning_rate': 0.000423433789409786, 'gamma': 0.9220767838584891, 'n_steps': 11, 'ent_coef': 0.00012930777059221938, 'vf_coef': 0.45976002780300756, 'max_grad_norm': 2.1345160179850593, 'rms_prop_eps': 2.462968159045282e-05, 'use_rms_prop': True, 'n_layers': 3, 'layer_size': 187, 'activation_fn': 'tanh'}. Best is trial 27 with value: 494.8679123832855.
Tuning A2C:  96%|█████████████████████████████████████████████████████████████████████████████████████████████████████████████████████████████████████████████████████████▌      | 48/50 [8:30:59<16:58, 509.25s/it, best_value=494.87]Deleted temporary model file: C:\Users\benva\AppData\Local\Temp\PendCart_78b2fc3d.slx
Deleted: C:\Users\benva\OneDrive\Documents\MATLAB\full_wrap\PendCart_78b2fc3d.slxc
[I 2025-06-15 08:43:41,482] Trial 48 finished with value: 175.6833821897872 and parameters: {'learning_rate': 0.00047328208615389635, 'gamma': 0.9219444471492345, 'n_steps': 11, 'ent_coef': 0.00112813796261563, 'vf_coef': 0.5122499723056047, 'max_grad_norm': 1.8187868929810906, 'rms_prop_eps': 4.546128300697073e-05, 'use_rms_prop': False, 'n_layers': 3, 'layer_size': 172, 'activation_fn': 'tanh'}. Best is trial 27 with value: 494.8679123832855.
Tuning A2C:  98%|████████████████████████████████████████████████████████████████████████████████████████████████████████████████████████████████████████████████████████████▊   | 49/50 [8:47:02<10:45, 645.33s/it, best_value=494.87]Deleted temporary model file: C:\Users\benva\AppData\Local\Temp\PendCart_75f02673.slx
Deleted: C:\Users\benva\OneDrive\Documents\MATLAB\full_wrap\PendCart_75f02673.slxc
[I 2025-06-15 08:48:32,213] Trial 49 finished with value: 13.74004034623771 and parameters: {'learning_rate': 8.703481078755926e-05, 'gamma': 0.9218033971405594, 'n_steps': 11, 'ent_coef': 0.0012590122707713286, 'vf_coef': 0.2936004182548671, 'max_grad_norm': 3.2488651740188295, 'rms_prop_eps': 2.401764935600467e-05, 'use_rms_prop': False, 'n_layers': 3, 'layer_size': 186, 'activation_fn': 'tanh'}. Best is trial 27 with value: 494.8679123832855.
Tuning A2C: 100%|████████████████████████████████████████████████████████████████████████████████████████████████████████████████████████████████████████████████████████████████| 50/50 [8:51:53<00:00, 638.26s/it, best_value=494.87] 

Best parameters for a2c:
Best value: 494.8679123832855
  learning_rate: 0.0005609313874353129
  gamma: 0.9271100087931456
  n_steps: 16
  ent_coef: 0.00027892387987561745
  vf_coef: 0.7229760725706151
  max_grad_norm: 2.3188343262079782
  rms_prop_eps: 0.00028937290303221105
  use_rms_prop: True
  n_layers: 3
  layer_size: 251
  activation_fn: tanh
  net_arch: [251, 251, 251]
  activation_fn: tanh