PS C:\Users\benva\OneDrive\Documents\MATLAB> myenv\Scripts\Activate.ps1
(myenv) PS C:\Users\benva\OneDrive\Documents\MATLAB> cd .\full_wrap\
(myenv) PS C:\Users\benva\OneDrive\Documents\MATLAB\full_wrap> python .\hyperparameter_tuning.py
Starting hyperparameter tuning...

==================================================
Tuning hyperparameters for A2C...
==================================================


Tuning A2C with 4 parallel workers
[I 2025-06-14 23:56:39,120] A new study created in memory with name: no-name-25f7d988-73d2-446b-89ad-6f4f2c547082
Tuning A2C:   0%|                                                                                                                                                                                               | 0/50 [00:00<?, ?it/s]Starting MATLAB engine...
Starting MATLAB engine...
Starting MATLAB engine...
Starting MATLAB engine...
Using device: cudaUsing device: cuda

C:\Users\benva\OneDrive\Documents\MATLAB\myenv\Lib\site-packages\stable_baselines3\common\vec_env\patch_gym.py:49: UserWarning: You provided an OpenAI Gym environment. We strongly recommend transitioning to Gymnasium environments. Stable-Baselines3 is automatically wrapping your environments in a compatibility layer, which could potentially cause issues.
  warnings.warn(
Using device: cuda
Using device: cuda
C:\Users\benva\OneDrive\Documents\MATLAB\myenv\Lib\site-packages\stable_baselines3\common\vec_env\patch_gym.py:49: UserWarning: You provided an OpenAI Gym environment. We strongly recommend transitioning to Gymnasium environments. Stable-Baselines3 is automatically wrapping your environments in a compatibility layer, which could potentially cause issues.
  warnings.warn(
C:\Users\benva\OneDrive\Documents\MATLAB\myenv\Lib\site-packages\stable_baselines3\common\on_policy_algorithm.py:150: UserWarning: You are trying to run A2C on the GPU, but it is primarily intended to run on the CPU when not using a CNN policy (you are using ActorCriticPolicy which should be a MlpPolicy). See https://github.com/DLR-RM/stable-baselines3/issues/1245 for more info. You can pass `device='cpu'` or `export CUDA_VISIBLE_DEVICES=` to force using the CPU.Note: The model will train, but the GPU utilization will be poor and the training might take longer than on CPU.
  warnings.warn(
Deleted temporary model file: C:\Users\benva\AppData\Local\Temp\PendCart_f7fe8c85.slx
Deleted: C:\Users\benva\OneDrive\Documents\MATLAB\full_wrap\PendCart_f7fe8c85.slxc
[I 2025-06-15 00:36:47,383] Trial 3 finished with value: 13.920837686087712 and parameters: {'learning_rate': 6.936735299901672e-05, 'gamma': 0.9877386611642968, 'n_steps': 36, 'ent_coef': 4.565811486863299e-05, 'vf_coef': 0.8210084264031846, 'max_grad_norm': 2.9426787964207817, 'rms_prop_eps': 0.0007953612495977652, 'use_rms_prop': False, 'n_layers': 2, 'layer_size': 202, 'activation_fn': 'leaky_relu'}. Best is trial 3 with value: 13.920837686087712.
Tuning A2C:   2%|███▏                                                                                                                                                            | 1/50 [40:08<32:46:44, 2408.26s/it, best_value=13.92]Starting MATLAB engine...
Deleted temporary model file: C:\Users\benva\AppData\Local\Temp\PendCart_d32d50e9.slx
Deleted: C:\Users\benva\OneDrive\Documents\MATLAB\full_wrap\PendCart_d32d50e9.slxc
[I 2025-06-15 00:37:14,429] Trial 0 finished with value: 10.598694575157367 and parameters: {'learning_rate': 0.00011887743120217926, 'gamma': 0.9373927792811468, 'n_steps': 201, 'ent_coef': 7.885869526865685e-07, 'vf_coef': 0.901510088613725, 'max_grad_norm': 0.39915265842016334, 'rms_prop_eps': 2.0862292989276406e-06, 'use_rms_prop': False, 'n_layers': 3, 'layer_size': 109, 'activation_fn': 'tanh'}. Best is trial 3 with value: 13.920837686087712.
Tuning A2C:   4%|██████▍                                                                                                                                                         | 2/50 [40:35<13:26:02, 1007.55s/it, best_value=13.92]Starting MATLAB engine...
Deleted temporary model file: C:\Users\benva\AppData\Local\Temp\PendCart_0a46ed11.slx
Deleted: C:\Users\benva\OneDrive\Documents\MATLAB\full_wrap\PendCart_0a46ed11.slxc
[I 2025-06-15 00:37:17,314] Trial 2 finished with value: 17.674983636803393 and parameters: {'learning_rate': 0.00019642632388951057, 'gamma': 0.9761140618698322, 'n_steps': 54, 'ent_coef': 0.01842603647360943, 'vf_coef': 0.11297674513728335, 'max_grad_norm': 1.0475785714040877, 'rms_prop_eps': 0.0004575988001907306, 'use_rms_prop': False, 'n_layers': 2, 'layer_size': 152, 'activation_fn': 'leaky_relu'}. Best is trial 2 with value: 17.674983636803393.
Tuning A2C:   6%|█████████▋                                                                                                                                                        | 3/50 [40:38<7:09:53, 548.80s/it, best_value=17.67]Starting MATLAB engine...
Using device: cuda
Using device: cuda
Using device: cuda
Deleted temporary model file: C:\Users\benva\AppData\Local\Temp\PendCart_a818f246.slx
Deleted: C:\Users\benva\OneDrive\Documents\MATLAB\full_wrap\PendCart_a818f246.slxc
[I 2025-06-15 00:40:12,929] Trial 1 finished with value: 13.099664976263222 and parameters: {'learning_rate': 0.0001606443517585115, 'gamma': 0.9870918988589277, 'n_steps': 975, 'ent_coef': 0.012336256334005593, 'vf_coef': 0.9124257666491921, 'max_grad_norm': 2.7398316399328073, 'rms_prop_eps': 1.1857279813995013e-06, 'use_rms_prop': False, 'n_layers': 1, 'layer_size': 213, 'activation_fn': 'relu'}. Best is trial 2 with value: 17.674983636803393.
Tuning A2C:   8%|████████████▉                                                                                                                                                     | 4/50 [43:33<5:07:47, 401.47s/it, best_value=17.67]Starting MATLAB engine...
Using device: cuda
Deleted temporary model file: C:\Users\benva\AppData\Local\Temp\PendCart_9fd778ec.slx
Deleted: C:\Users\benva\OneDrive\Documents\MATLAB\full_wrap\PendCart_9fd778ec.slxc
[I 2025-06-15 01:17:21,629] Trial 4 finished with value: 14.948053931657892 and parameters: {'learning_rate': 6.052843016121533e-05, 'gamma': 0.9933295936624935, 'n_steps': 36, 'ent_coef': 3.879065394222131e-06, 'vf_coef': 0.3320064726271793, 'max_grad_norm': 2.709188179677903, 'rms_prop_eps': 0.00012544842485891428, 'use_rms_prop': False, 'n_layers': 1, 'layer_size': 181, 'activation_fn': 'elu'}. Best is trial 2 with value: 17.674983636803393.
Tuning A2C:  10%|███████████████▊                                                                                                                                              | 5/50 [1:20:42<13:15:17, 1060.38s/it, best_value=17.67]Starting MATLAB engine...
Using device: cuda
Deleted temporary model file: C:\Users\benva\AppData\Local\Temp\PendCart_f85c8c16.slx
Deleted: C:\Users\benva\OneDrive\Documents\MATLAB\full_wrap\PendCart_f85c8c16.slxc
[I 2025-06-15 01:18:15,691] Trial 6 finished with value: 16.92797281456081 and parameters: {'learning_rate': 0.000428914443976189, 'gamma': 0.9985365885056975, 'n_steps': 232, 'ent_coef': 0.00913525595720595, 'vf_coef': 0.9532834128069257, 'max_grad_norm': 3.330623985742731, 'rms_prop_eps': 0.0005783563989438723, 'use_rms_prop': False, 'n_layers': 1, 'layer_size': 69, 'activation_fn': 'leaky_relu'}. Best is trial 2 with value: 17.674983636803393.
Tuning A2C:  12%|███████████████████▏                                                                                                                                            | 6/50 [1:21:36<8:46:42, 718.23s/it, best_value=17.67]Starting MATLAB engine...
Using device: cuda
Deleted temporary model file: C:\Users\benva\AppData\Local\Temp\PendCart_6085f37f.slx
Deleted: C:\Users\benva\OneDrive\Documents\MATLAB\full_wrap\PendCart_6085f37f.slxc
[I 2025-06-15 01:18:41,108] Trial 5 finished with value: 12.188595282859172 and parameters: {'learning_rate': 0.00011383534167741581, 'gamma': 0.995386982988973, 'n_steps': 397, 'ent_coef': 0.0004709511995321164, 'vf_coef': 0.5026113644490372, 'max_grad_norm': 3.930727775571841, 'rms_prop_eps': 3.6742151726849874e-06, 'use_rms_prop': False, 'n_layers': 1, 'layer_size': 217, 'activation_fn': 'elu'}. Best is trial 2 with value: 17.674983636803393.
Tuning A2C:  14%|██████████████████████▍                                                                                                                                         | 7/50 [1:22:01<5:52:24, 491.73s/it, best_value=17.67]Starting MATLAB engine...
Using device: cuda
Deleted temporary model file: C:\Users\benva\AppData\Local\Temp\PendCart_916281a0.slx
Deleted: C:\Users\benva\OneDrive\Documents\MATLAB\full_wrap\PendCart_916281a0.slxc
[I 2025-06-15 01:20:47,655] Trial 7 finished with value: 14.65371063335132 and parameters: {'learning_rate': 7.031784191835979e-05, 'gamma': 0.9521948034083071, 'n_steps': 920, 'ent_coef': 5.2707120318502e-05, 'vf_coef': 0.323803291788859, 'max_grad_norm': 2.026619232869885, 'rms_prop_eps': 1.0072137728255946e-06, 'use_rms_prop': False, 'n_layers': 2, 'layer_size': 105, 'activation_fn': 'relu'}. Best is trial 2 with value: 17.674983636803393.
Tuning A2C:  16%|█████████████████████████▌                                                                                                                                      | 8/50 [1:24:08<4:22:50, 375.48s/it, best_value=17.67]Starting MATLAB engine...
Using device: cuda
Deleted temporary model file: C:\Users\benva\AppData\Local\Temp\PendCart_1d4d54d1.slx
Deleted: C:\Users\benva\OneDrive\Documents\MATLAB\full_wrap\PendCart_1d4d54d1.slxc
[I 2025-06-15 01:58:34,674] Trial 9 finished with value: 17.608566621033276 and parameters: {'learning_rate': 0.00036263302384284085, 'gamma': 0.9294566052653931, 'n_steps': 297, 'ent_coef': 0.0005933554636592957, 'vf_coef': 0.8643527524535934, 'max_grad_norm': 0.9106175284238645, 'rms_prop_eps': 3.994640349906749e-06, 'use_rms_prop': False, 'n_layers': 1, 'layer_size': 76, 'activation_fn': 'leaky_relu'}. Best is trial 2 with value: 17.674983636803393.        
Tuning A2C:  18%|████████████████████████████▌                                                                                                                                  | 9/50 [2:01:55<11:00:38, 966.80s/it, best_value=17.67]Starting MATLAB engine...
Deleted temporary model file: C:\Users\benva\AppData\Local\Temp\PendCart_2d71c56b.slx
Deleted: C:\Users\benva\OneDrive\Documents\MATLAB\full_wrap\PendCart_2d71c56b.slxc
[I 2025-06-15 01:58:55,597] Trial 8 finished with value: 16.753853835010585 and parameters: {'learning_rate': 1.2717033305961015e-05, 'gamma': 0.9463734744757201, 'n_steps': 609, 'ent_coef': 0.0005697272950000524, 'vf_coef': 0.8466729720953388, 'max_grad_norm': 3.805188248272964, 'rms_prop_eps': 4.202454113769032e-06, 'use_rms_prop': False, 'n_layers': 1, 'layer_size': 173, 'activation_fn': 'tanh'}. Best is trial 2 with value: 17.674983636803393.
Tuning A2C:  20%|███████████████████████████████▊                                                                                                                               | 10/50 [2:02:16<7:29:51, 674.79s/it, best_value=17.67]Starting MATLAB engine...
Using device: cuda
Deleted temporary model file: C:\Users\benva\AppData\Local\Temp\PendCart_52798fcc.slx
Deleted: C:\Users\benva\OneDrive\Documents\MATLAB\full_wrap\PendCart_52798fcc.slxc
[I 2025-06-15 01:59:03,257] Trial 10 finished with value: 14.294737154697449 and parameters: {'learning_rate': 3.8627340017132405e-05, 'gamma': 0.9742414106719124, 'n_steps': 267, 'ent_coef': 0.0034050179101183437, 'vf_coef': 0.24777412542516364, 'max_grad_norm': 2.997988897775079, 'rms_prop_eps': 3.244012858334903e-05, 'use_rms_prop': False, 'n_layers': 2, 'layer_size': 118, 'activation_fn': 'leaky_relu'}. Best is trial 2 with value: 17.674983636803393.      
Tuning A2C:  22%|██████████████████████████████████▉                                                                                                                            | 11/50 [2:02:24<5:05:53, 470.61s/it, best_value=17.67]Starting MATLAB engine...
Using device: cuda
Using device: cuda
Deleted temporary model file: C:\Users\benva\AppData\Local\Temp\PendCart_c9dc7a6f.slx
Deleted: C:\Users\benva\OneDrive\Documents\MATLAB\full_wrap\PendCart_c9dc7a6f.slxc
[I 2025-06-15 02:00:49,545] Trial 11 finished with value: 12.672595125792608 and parameters: {'learning_rate': 3.873856955642373e-05, 'gamma': 0.9351724166095283, 'n_steps': 24, 'ent_coef': 1.6396054325235696e-05, 'vf_coef': 0.8748097930669096, 'max_grad_norm': 4.443439363345921, 'rms_prop_eps': 2.6520888912622385e-06, 'use_rms_prop': True, 'n_layers': 3, 'layer_size': 184, 'activation_fn': 'relu'}. Best is trial 2 with value: 17.674983636803393.
Tuning A2C:  24%|██████████████████████████████████████▏                                                                                                                        | 12/50 [2:04:10<3:47:51, 359.78s/it, best_value=17.67]Starting MATLAB engine...
Using device: cuda
Deleted temporary model file: C:\Users\benva\AppData\Local\Temp\PendCart_d8ac4b98.slx
Deleted: C:\Users\benva\OneDrive\Documents\MATLAB\full_wrap\PendCart_d8ac4b98.slxc
[I 2025-06-15 02:38:42,716] Trial 13 finished with value: 18.44244049964376 and parameters: {'learning_rate': 0.0009076837080902511, 'gamma': 0.9174945415554274, 'n_steps': 77, 'ent_coef': 0.08616680423709705, 'vf_coef': 0.12192009473488688, 'max_grad_norm': 1.003261583923584, 'rms_prop_eps': 1.630765661247509e-05, 'use_rms_prop': True, 'n_layers': 3, 'layer_size': 43, 'activation_fn': 'leaky_relu'}. Best is trial 13 with value: 18.44244049964376.
Tuning A2C:  26%|█████████████████████████████████████████▎                                                                                                                     | 13/50 [2:42:03<9:39:18, 939.41s/it, best_value=18.44]Starting MATLAB engine...
Deleted temporary model file: C:\Users\benva\AppData\Local\Temp\PendCart_1980f293.slx
Deleted: C:\Users\benva\OneDrive\Documents\MATLAB\full_wrap\PendCart_1980f293.slxc
[I 2025-06-15 02:38:51,712] Trial 14 finished with value: 23.857279079730155 and parameters: {'learning_rate': 0.000802190743297162, 'gamma': 0.9058821975808069, 'n_steps': 8, 'ent_coef': 0.03576958042260284, 'vf_coef': 0.12138221174876462, 'max_grad_norm': 0.8226484792542035, 'rms_prop_eps': 1.8210428715149725e-05, 'use_rms_prop': True, 'n_layers': 3, 'layer_size': 33, 'activation_fn': 'leaky_relu'}. Best is trial 14 with value: 23.857279079730155.
Tuning A2C:  28%|████████████████████████████████████████████▌                                                                                                                  | 14/50 [2:42:12<6:35:01, 658.38s/it, best_value=23.86]Starting MATLAB engine...
Using device: cuda
Using device: cuda
Deleted temporary model file: C:\Users\benva\AppData\Local\Temp\PendCart_8ff8aca9.slx
Deleted: C:\Users\benva\OneDrive\Documents\MATLAB\full_wrap\PendCart_8ff8aca9.slxc
[I 2025-06-15 02:40:32,051] Trial 15 finished with value: 18.006245356531984 and parameters: {'learning_rate': 0.0009168609956011561, 'gamma': 0.904851741191709, 'n_steps': 76, 'ent_coef': 0.09161519192465764, 'vf_coef': 0.11671837618765864, 'max_grad_norm': 0.8810627998370971, 'rms_prop_eps': 1.4744680642978909e-05, 'use_rms_prop': True, 'n_layers': 2, 'layer_size': 39, 'activation_fn': 'leaky_relu'}. Best is trial 14 with value: 23.857279079730155.
Tuning A2C:  30%|███████████████████████████████████████████████▋                                                                                                               | 15/50 [2:43:52<4:45:55, 490.17s/it, best_value=23.86]Starting MATLAB engine...
Using device: cuda
Deleted temporary model file: C:\Users\benva\AppData\Local\Temp\PendCart_3f5c4ab3.slx
Deleted: C:\Users\benva\OneDrive\Documents\MATLAB\full_wrap\PendCart_3f5c4ab3.slxc
[I 2025-06-15 02:47:10,081] Trial 12 finished with value: 488.2008334333924 and parameters: {'learning_rate': 0.0009939502262786876, 'gamma': 0.9016105141949395, 'n_steps': 12, 'ent_coef': 0.08850584741160139, 'vf_coef': 0.10311454910772455, 'max_grad_norm': 1.6407338484205714, 'rms_prop_eps': 3.5742028095684224e-05, 'use_rms_prop': True, 'n_layers': 3, 'layer_size': 250, 'activation_fn': 'leaky_relu'}. Best is trial 12 with value: 488.2008334333924.
Tuning A2C:  32%|██████████████████████████████████████████████████▌                                                                                                           | 16/50 [2:50:30<4:22:02, 462.44s/it, best_value=488.20]Starting MATLAB engine...
Using device: cuda
Deleted temporary model file: C:\Users\benva\AppData\Local\Temp\PendCart_c8a9e3e7.slx
Deleted: C:\Users\benva\OneDrive\Documents\MATLAB\full_wrap\PendCart_c8a9e3e7.slxc
[I 2025-06-15 03:19:45,513] Trial 16 finished with value: 100.87744423519958 and parameters: {'learning_rate': 0.0009495229527055655, 'gamma': 0.9009390113534246, 'n_steps': 8, 'ent_coef': 0.0715683310103409, 'vf_coef': 0.10483279696347081, 'max_grad_norm': 1.729866178835671, 'rms_prop_eps': 1.3898443214985248e-05, 'use_rms_prop': True, 'n_layers': 3, 'layer_size': 39, 'activation_fn': 'leaky_relu'}. Best is trial 12 with value: 488.2008334333924.
Tuning A2C:  34%|█████████████████████████████████████████████████████▋                                                                                                        | 17/50 [3:23:06<8:21:15, 911.38s/it, best_value=488.20]Starting MATLAB engine...
Using device: cuda
Deleted temporary model file: C:\Users\benva\AppData\Local\Temp\PendCart_ccccc63c.slx
Deleted: C:\Users\benva\OneDrive\Documents\MATLAB\full_wrap\PendCart_ccccc63c.slxc
[I 2025-06-15 03:21:43,841] Trial 18 finished with value: 210.5492121505065 and parameters: {'learning_rate': 0.00090148820230601, 'gamma': 0.900624686288895, 'n_steps': 8, 'ent_coef': 0.09937119296944533, 'vf_coef': 0.5618864385883839, 'max_grad_norm': 1.8555213138187951, 'rms_prop_eps': 1.9059406655710995e-05, 'use_rms_prop': True, 'n_layers': 3, 'layer_size': 62, 'activation_fn': 'leaky_relu'}. Best is trial 12 with value: 488.2008334333924.
Tuning A2C:  36%|████████████████████████████████████████████████████████▉                                                                                                     | 18/50 [3:25:04<5:58:58, 673.08s/it, best_value=488.20]Starting MATLAB engine...
Using device: cuda
Deleted temporary model file: C:\Users\benva\AppData\Local\Temp\PendCart_56ea4288.slx
Deleted: C:\Users\benva\OneDrive\Documents\MATLAB\full_wrap\PendCart_56ea4288.slxc
[I 2025-06-15 03:24:17,706] Trial 17 finished with value: 384.3780423665397 and parameters: {'learning_rate': 0.0009864637748840076, 'gamma': 0.9042637531664701, 'n_steps': 8, 'ent_coef': 0.06658419391225946, 'vf_coef': 0.15074195047657252, 'max_grad_norm': 1.4822153506764306, 'rms_prop_eps': 1.8167398197108913e-05, 'use_rms_prop': True, 'n_layers': 3, 'layer_size': 35, 'activation_fn': 'leaky_relu'}. Best is trial 12 with value: 488.2008334333924.
Tuning A2C:  38%|████████████████████████████████████████████████████████████                                                                                                  | 19/50 [3:27:38<4:27:11, 517.13s/it, best_value=488.20]Starting MATLAB engine...
Using device: cuda
Deleted temporary model file: C:\Users\benva\AppData\Local\Temp\PendCart_b50f60f7.slx
Deleted: C:\Users\benva\OneDrive\Documents\MATLAB\full_wrap\PendCart_b50f60f7.slxc
[I 2025-06-15 03:27:39,820] Trial 19 finished with value: 158.72301949708338 and parameters: {'learning_rate': 0.0004696608277753603, 'gamma': 0.9005509849825559, 'n_steps': 9, 'ent_coef': 0.0021045967868931147, 'vf_coef': 0.5797135589449463, 'max_grad_norm': 1.9499138170176296, 'rms_prop_eps': 7.064171689263205e-05, 'use_rms_prop': True, 'n_layers': 3, 'layer_size': 243, 'activation_fn': 'leaky_relu'}. Best is trial 12 with value: 488.2008334333924.
Tuning A2C:  40%|███████████████████████████████████████████████████████████████▏                                                                                              | 20/50 [3:31:00<3:31:16, 422.55s/it, best_value=488.20]Starting MATLAB engine...
Using device: cuda
Deleted temporary model file: C:\Users\benva\AppData\Local\Temp\PendCart_5393c291.slx
Deleted: C:\Users\benva\OneDrive\Documents\MATLAB\full_wrap\PendCart_5393c291.slxc
[I 2025-06-15 04:05:51,601] Trial 20 finished with value: 478.00799663567915 and parameters: {'learning_rate': 0.0003771618897949107, 'gamma': 0.9171440812284734, 'n_steps': 8, 'ent_coef': 0.0025600026578957214, 'vf_coef': 0.5468431519168624, 'max_grad_norm': 1.9739519254567992, 'rms_prop_eps': 8.503139531780987e-05, 'use_rms_prop': True, 'n_layers': 3, 'layer_size': 242, 'activation_fn': 'tanh'}. Best is trial 12 with value: 488.2008334333924.
Tuning A2C:  42%|██████████████████████████████████████████████████████████████████▎                                                                                           | 21/50 [4:09:12<7:55:25, 983.64s/it, best_value=488.20]Starting MATLAB engine...
Using device: cuda
Deleted temporary model file: C:\Users\benva\AppData\Local\Temp\PendCart_71b2862f.slx
Deleted: C:\Users\benva\OneDrive\Documents\MATLAB\full_wrap\PendCart_71b2862f.slxc
