[I 2025-07-05 21:56:44,202] Trial 35 pruned. 
Tuning PPO:  62%|████████████████████████████████████████████████████████████████████████████████████████████████████████████████████▌                                                                       | 31/50 [54:11:25<52:12:25, 9891.87s/it, best_val=497.9]Starting MATLAB engine...
[PPO] Using device: cuda
Deleted temporary model file: C:\Users\benva\AppData\Local\Temp\PendCart_a1b8a04e.slx
Deleted: C:\Users\benva\OneDrive\Documents\MATLAB\full_wrap\PendCart_a1b8a04e.slxc
[I 2025-07-06 01:15:43,585] Trial 29 finished with value: 492.9924441643192 and parameters: {'n_steps': 256, 'batch_size': 64, 'learning_rate': 0.00020921007773977475, 'n_epochs': 12, 'gamma': 0.973916055091555, 'clip_range': 0.33250192185454064, 'ent_coef': 1.054070635541296e-08, 'vf_coef': 0.8013402307840085, 'max_grad_norm': 1.7314788803848933, 'gae_lambda': 0.965324279181112, 'n_layers': 3, 'layer_size': 120, 'activation_fn': 'tanh'}. Best is trial 3 with value: 497.9433970634521.
Tuning PPO:  64%|███████████████████████████████████████████████████████████████████████████████████████████████████████████████████████▋                                                                   | 32/50 [57:30:24<52:31:50, 10506.14s/it, best_val=497.9]Starting MATLAB engine...
[PPO] Using device: cuda
Deleted temporary model file: C:\Users\benva\AppData\Local\Temp\PendCart_4cf5518d.slx
Deleted: C:\Users\benva\OneDrive\Documents\MATLAB\full_wrap\PendCart_4cf5518d.slxc
[I 2025-07-06 02:21:52,150] Trial 33 finished with value: 381.4518726495082 and parameters: {'n_steps': 256, 'batch_size': 32, 'learning_rate': 0.0007664112447523621, 'n_epochs': 4, 'gamma': 0.9715559922870967, 'clip_range': 0.1528762526157214, 'ent_coef': 0.04127269122701644, 'vf_coef': 0.7704462039517431, 'max_grad_norm': 4.305639712096438, 'gae_lambda': 0.8602401437577786, 'n_layers': 3, 'layer_size': 128, 'activation_fn': 'tanh'}. Best is trial 3 with value: 497.9433970634521.
Tuning PPO:  66%|████████████████████████████████████████████████████████████████████████████████████████████████████████████████████████████                                                                | 33/50 [58:36:33<40:21:02, 8544.85s/it, best_val=497.9]Starting MATLAB engine...
[PPO] Using device: cuda
Deleted temporary model file: C:\Users\benva\AppData\Local\Temp\PendCart_6da3dce5.slx
Deleted: C:\Users\benva\OneDrive\Documents\MATLAB\full_wrap\PendCart_6da3dce5.slxc
[I 2025-07-06 02:24:30,604] Trial 30 finished with value: 434.3702763037579 and parameters: {'n_steps': 256, 'batch_size': 64, 'learning_rate': 0.0002005782770274963, 'n_epochs': 12, 'gamma': 0.972724548487803, 'clip_range': 0.3415766853393904, 'ent_coef': 1.6787301230129713e-08, 'vf_coef': 0.830127428917786, 'max_grad_norm': 0.45302631006861516, 'gae_lambda': 0.9661622474521756, 'n_layers': 3, 'layer_size': 122, 'activation_fn': 'tanh'}. Best is trial 3 with value: 497.9433970634521.
Tuning PPO:  68%|███████████████████████████████████████████████████████████████████████████████████████████████████████████████████████████████▊                                                            | 34/50 [58:39:11<26:47:42, 6028.92s/it, best_val=497.9]Starting MATLAB engine...
[PPO] Using device: cuda
Deleted temporary model file: C:\Users\benva\AppData\Local\Temp\PendCart_b59d9443.slx
Deleted: C:\Users\benva\OneDrive\Documents\MATLAB\full_wrap\PendCart_b59d9443.slxc
[I 2025-07-06 03:15:39,590] Trial 31 finished with value: 498.17554663009855 and parameters: {'n_steps': 256, 'batch_size': 64, 'learning_rate': 0.0008713461063969535, 'n_epochs': 6, 'gamma': 0.9712855407850021, 'clip_range': 0.214787640685994, 'ent_coef': 0.08475074762856749, 'vf_coef': 0.8033012425766726, 'max_grad_norm': 0.3108620374755726, 'gae_lambda': 0.8563106168425115, 'n_layers': 3, 'layer_size': 128, 'activation_fn': 'tanh'}. Best is trial 31 with value: 498.17554663009855.
Tuning PPO:  70%|███████████████████████████████████████████████████████████████████████████████████████████████████████████████████████████████████▌                                                        | 35/50 [59:30:20<21:25:14, 5140.93s/it, best_val=498.2]Starting MATLAB engine...
[PPO] Using device: cuda
[PPO|Trial 39] ✘ Pruned by Halving at 20000 (reward 192.4)
Deleted temporary model file: C:\Users\benva\AppData\Local\Temp\PendCart_dbf0008a.slx
Deleted: C:\Users\benva\OneDrive\Documents\MATLAB\full_wrap\PendCart_dbf0008a.slxc
[I 2025-07-06 05:05:55,312] Trial 39 pruned. 
Tuning PPO:  72%|███████████████████████████████████████████████████████████████████████████████████████████████████████████████████████████████████████▎                                                    | 36/50 [61:20:36<21:42:47, 5583.37s/it, best_val=498.2]Starting MATLAB engine...
[PPO] Using device: cuda
Deleted temporary model file: C:\Users\benva\AppData\Local\Temp\PendCart_6db84440.slx
[I 2025-07-06 05:06:53,102] Trial 41 pruned. 
Tuning PPO:  74%|███████████████████████████████████████████████████████████████████████████████████████████████████████████████████████████████████████████                                                 | 37/50 [61:21:33<14:10:33, 3925.69s/it, best_val=498.2]Starting MATLAB engine...
[PPO] Using device: cuda
Deleted: C:\Users\benva\OneDrive\Documents\MATLAB\full_wrap\PendCart_ef9a1d83.slxc
[I 2025-07-06 06:13:26,831] Trial 34 finished with value: 418.4618398108693 and parameters: {'n_steps': 256, 'batch_size': 32, 'learning_rate': 0.0007674630242869708, 'n_epochs': 6, 'gamma': 0.9722804695103076, 'clip_range': 0.1538683664092955, 'ent_coef': 0.049597431079342905, 'vf_coef': 0.24867287215572537, 'max_grad_norm': 4.270333620775322, 'gae_lambda': 0.8671910248367474, 'n_layers': 3, 'layer_size': 129, 'activation_fn': 'tanh'}. Best is trial 31 with value: 498.17554663009855.
Tuning PPO:  76%|██████████████████████████████████████████████████████████████████████████████████████████████████████████████████████████████████████████████▉                                             | 38/50 [62:28:07<13:09:13, 3946.11s/it, best_val=498.2]Starting MATLAB engine...
[PPO] Using device: cuda
Deleted temporary model file: C:\Users\benva\AppData\Local\Temp\PendCart_9c5398e7.slx
[I 2025-07-06 06:14:04,082] Trial 43 pruned.
Tuning PPO:  78%|███████████████████████████████████████████████████████████████████████████████████████████████████████████████████████████████████████████████████▍                                         | 39/50 [62:28:44<8:28:27, 2773.44s/it, best_val=498.2]Starting MATLAB engine...
[PPO] Using device: cuda
[PPO|Trial 44] ✘ Pruned by Halving at 20000 (reward 75.9)
Deleted temporary model file: C:\Users\benva\AppData\Local\Temp\PendCart_6138e86a.slx
Deleted: C:\Users\benva\OneDrive\Documents\MATLAB\full_wrap\PendCart_6138e86a.slxc
[I 2025-07-06 08:47:49,629] Trial 44 pruned.
Tuning PPO:  80%|██████████████████████████████████████████████████████████████████████████████████████████████████████████████████████████████████████████████████████▍                                     | 40/50 [65:02:30<13:04:50, 4709.08s/it, best_val=498.2]Starting MATLAB engine...
[PPO] Using device: cuda
[PPO|Trial 45] ✘ Pruned by Halving at 20000 (reward 198.4)
Deleted temporary model file: C:\Users\benva\AppData\Local\Temp\PendCart_dd21678f.slx
Deleted: C:\Users\benva\OneDrive\Documents\MATLAB\full_wrap\PendCart_dd21678f.slxc
[I 2025-07-06 11:31:30,004] Trial 45 pruned.
Tuning PPO:  82%|██████████████████████████████████████████████████████████████████████████████████████████████████████████████████████████████████████████████████████████▏                                 | 41/50 [67:46:10<15:36:22, 6242.47s/it, best_val=498.2]Starting MATLAB engine...
[PPO] Using device: cuda
Deleted temporary model file: C:\Users\benva\AppData\Local\Temp\PendCart_f09e31d0.slx
Deleted: C:\Users\benva\OneDrive\Documents\MATLAB\full_wrap\PendCart_f09e31d0.slxc
[I 2025-07-06 12:36:51,660] Trial 36 finished with value: 229.83799561641362 and parameters: {'n_steps': 256, 'batch_size': 64, 'learning_rate': 0.00022600346315055918, 'n_epochs': 4, 'gamma': 0.9673553589339258, 'clip_range': 0.38990282927046155, 'ent_coef': 1.9439540495647565e-05, 'vf_coef': 0.4592912948249079, 'max_grad_norm': 4.280125017763282, 'gae_lambda': 0.9466286274549952, 'n_layers': 3, 'layer_size': 298, 'activation_fn': 'relu'}. Best is trial 31 with value: 498.17554663009855.
Tuning PPO:  84%|█████████████████████████████████████████████████████████████████████████████████████████████████████████████████████████████████████████████████████████████▉                              | 42/50 [68:51:32<12:19:29, 5546.23s/it, best_val=498.2]Starting MATLAB engine...
[PPO] Using device: cuda
[PPO|Trial 40] ✘ Pruned by Halving at 40000 (reward 150.8)
Deleted temporary model file: C:\Users\benva\AppData\Local\Temp\PendCart_de1c2cf3.slx
Deleted: C:\Users\benva\OneDrive\Documents\MATLAB\full_wrap\PendCart_de1c2cf3.slxc
[I 2025-07-06 12:59:19,737] Trial 40 pruned.
Tuning PPO:  86%|██████████████████████████████████████████████████████████████████████████████████████████████████████████████████████████████████████████████████████████████████▌                          | 43/50 [69:14:00<8:20:07, 4286.78s/it, best_val=498.2]Starting MATLAB engine...
[PPO] Using device: cuda
[PPO|Trial 42] ✘ Pruned by Halving at 40000 (reward 269.5)
Deleted temporary model file: C:\Users\benva\AppData\Local\Temp\PendCart_dc280464.slx
Deleted: C:\Users\benva\OneDrive\Documents\MATLAB\full_wrap\PendCart_dc280464.slxc
[I 2025-07-06 14:50:43,583] Trial 42 pruned.
Tuning PPO:  88%|██████████████████████████████████████████████████████████████████████████████████████████████████████████████████████████████████████████████████████████████████████▎                      | 44/50 [71:05:24<8:20:35, 5005.90s/it, best_val=498.2]Starting MATLAB engine...
[PPO] Using device: cuda
Deleted temporary model file: C:\Users\benva\AppData\Local\Temp\PendCart_11eb3b8f.slx
Deleted: C:\Users\benva\OneDrive\Documents\MATLAB\full_wrap\PendCart_11eb3b8f.slxc
[I 2025-07-06 16:07:43,729] Trial 37 finished with value: 441.20683558738506 and parameters: {'n_steps': 256, 'batch_size': 64, 'learning_rate': 0.00020276360332576737, 'n_epochs': 4, 'gamma': 0.9724646320957013, 'clip_range': 0.33131667136273113, 'ent_coef': 1.614825455289538e-05, 'vf_coef': 0.6578433257488017, 'max_grad_norm': 1.5962749941787382, 'gae_lambda': 0.9763457648865558, 'n_layers': 3, 'layer_size': 136, 'activation_fn': 'tanh'}. Best is trial 31 with value: 498.17554663009855.
Tuning PPO:  90%|██████████████████████████████████████████████████████████████████████████████████████████████████████████████████████████████████████████████████████████████████████████                   | 45/50 [72:22:24<6:47:30, 4890.18s/it, best_val=498.2]Deleted temporary model file: C:\Users\benva\AppData\Local\Temp\PendCart_6bc8d2cb.slx
Deleted: C:\Users\benva\OneDrive\Documents\MATLAB\full_wrap\PendCart_6bc8d2cb.slxc
[I 2025-07-06 19:06:55,990] Trial 38 finished with value: 467.27408800428225 and parameters: {'n_steps': 256, 'batch_size': 64, 'learning_rate': 0.00020332414379157474, 'n_epochs': 19, 'gamma': 0.9757147121967473, 'clip_range': 0.32641301459453875, 'ent_coef': 0.0011539137633362888, 'vf_coef': 0.6394614079484426, 'max_grad_norm': 1.717522153012159, 'gae_lambda': 0.9746489865841876, 'n_layers': 3, 'layer_size': 307, 'activation_fn': 'tanh'}. Best is trial 31 with value: 498.17554663009855.
Tuning PPO:  92%|████████████████████████████████████████████████████████████████████████████████████████████████████████████████████████████████████████▏           | 46/50 [75:21:36<7:23:15, 6648.80s/it, best_val=498.2] 
Tuning PPO:  92%|████████████████████████████████████████████████████████████████████████████████████████████████████████████████████████████████████████▏           | 46/50 [75:21:36<7:23:15, 6648.80s/it, best_val=498.2][PPO|Trial 48] ✘ Pruned by Halving at 40000 (reward 192.4)
Deleted temporary model file: C:\Users\benva\AppData\Local\Temp\PendCart_8526086a.slx
Deleted: C:\Users\benva\OneDrive\Documents\MATLAB\full_wrap\PendCart_8526086a.slxc
[I 2025-07-06 22:11:45,690] Trial 48 pruned. 
Tuning PPO:  94%|███████████████████████████████████████████████████████████████████████████████████████████████████████████████████████████████████████████         | 47/50 [78:26:26<6:39:03, 7981.07s/it, best_val=498.2][PPO|Trial 47] ✘ Pruned by Halving at 40000 (reward 131.0)
Deleted temporary model file: C:\Users\benva\AppData\Local\Temp\PendCart_c90da43d.slx
Deleted: C:\Users\benva\OneDrive\Documents\MATLAB\full_wrap\PendCart_c90da43d.slxc
[I 2025-07-06 22:41:45,977] Trial 47 pruned. 
Tuning PPO:  96%|██████████████████████████████████████████████████████████████████████████████████████████████████████████████████████████████████████████████      | 48/50 [78:56:26<3:24:13, 6126.83s/it, best_val=498.2][PPO|Trial 49] ✘ Pruned by Halving at 40000 (reward 86.5)
Deleted temporary model file: C:\Users\benva\AppData\Local\Temp\PendCart_c4efa834.slx
Deleted: C:\Users\benva\OneDrive\Documents\MATLAB\full_wrap\PendCart_c4efa834.slxc
[I 2025-07-07 00:32:32,702] Trial 49 pruned. 
Tuning PPO:  98%|█████████████████████████████████████████████████████████████████████████████████████████████████████████████████████████████████████████████████   | 49/50 [80:47:13<1:44:42, 6282.80s/it, best_val=498.2]Deleted temporary model file: C:\Users\benva\AppData\Local\Temp\PendCart_fb560465.slx
Deleted: C:\Users\benva\OneDrive\Documents\MATLAB\full_wrap\PendCart_fb560465.slxc
[I 2025-07-07 02:13:51,404] Trial 46 finished with value: 372.90655287809244 and parameters: {'n_steps': 256, 'batch_size': 64, 'learning_rate': 0.0006038984119951887, 'n_epochs': 9, 'gamma': 0.956929156418017, 'clip_range': 0.21977357053787208, 'ent_coef': 7.010196882686885e-06, 'vf_coef': 0.47563158806230327, 'max_grad_norm': 0.9312108711227923, 'gae_lambda': 0.9136802272895326, 'n_layers': 3, 'layer_size': 242, 'activation_fn': 'tanh'}. Best is trial 31 with value: 498.17554663009855.
Tuning PPO: 100%|██████████████████████████████████████████████████████████████████████████████████████████████████████████████████████████████████████████████████████| 50/50 [82:28:32<00:00, 5938.25s/it, best_val=498.2]

Best for PPO: reward=498.18
  n_steps: 256
  batch_size: 64
  learning_rate: 0.0008713461063969535
  n_epochs: 6
  gamma: 0.9712855407850021
  clip_range: 0.214787640685994
  ent_coef: 0.08475074762856749
  vf_coef: 0.8033012425766726
  max_grad_norm: 0.3108620374755726
  gae_lambda: 0.8563106168425115
  n_layers: 3
  layer_size: 128
  activation_fn: tanh