PS C:\Users\benva\OneDrive\Documents\MATLAB> myenv\Scripts\Activate.ps1
(myenv) PS C:\Users\benva\OneDrive\Documents\MATLAB> cd .\full_wrap\
(myenv) PS C:\Users\benva\OneDrive\Documents\MATLAB\full_wrap> python .\hyperparameter_tuning.py
PS C:\Users\benva\OneDrive\Documents\MATLAB> myenv\Scripts\Activate.ps1
(myenv) PS C:\Users\benva\OneDrive\Documents\MATLAB> cd .\full_wrap\
(myenv) PS C:\Users\benva\OneDrive\Documents\MATLAB\full_wrap> python .\hyperparameter_tuning.py
Starting hyperparameter tuning...

==================================================
Tuning hyperparameters for PPO...
==================================================


Tuning PPO with 4 parallel workers
[I 2025-06-16 00:10:53,064] A new study created in memory with name: no-name-b8ffab56-a648-4943-9de0-dddf6566a107
Tuning PPO:   0%|                                                      | 0/50 [00:00<?, ?it/s]Starting MATLAB engine...
Starting MATLAB engine...
Starting MATLAB engine...
Starting MATLAB engine...
Using device: cuda
C:\Users\benva\OneDrive\Documents\MATLAB\myenv\Lib\site-packages\stable_baselines3\common\vec_env\patch_gym.py:49: UserWarning: You provided an OpenAI Gym environment. We strongly recommend transitioning to Gymnasium environments. Stable-Baselines3 is automatically wrapping your environments in a compatibility layer, which could potentially cause issues.
  warnings.warn(
Using device: cuda
Using device: cuda
C:\Users\benva\OneDrive\Documents\MATLAB\myenv\Lib\site-packages\stable_baselines3\common\vec_env\patch_gym.py:49: UserWarning: You provided an OpenAI Gym environment. We strongly recommend transitioning to Gymnasium environments. Stable-Baselines3 is automatically wrapping your environments in a compatibility layer, which could potentially cause issues.
  warnings.warn(
C:\Users\benva\OneDrive\Documents\MATLAB\myenv\Lib\site-packages\stable_baselines3\common\on_policy_algorithm.py:150: UserWarning: You are trying to run PPO on the GPU, but it is primarily intended to run on the CPU when not using a CNN policy (you are using ActorCriticPolicy which should be a MlpPolicy). See https://github.com/DLR-RM/stable-baselines3/issues/1245 for more info. You can pass `device='cpu'` or `export CUDA_VISIBLE_DEVICES=` to force using the CPU.Note: The model will train, but the GPU utilization will be poor and the training might take longer than on CPU.
  warnings.warn(
Using device: cuda
Deleted temporary model file: C:\Users\benva\AppData\Local\Temp\PendCart_5984e73a.slx
Deleted: C:\Users\benva\OneDrive\Documents\MATLAB\full_wrap\PendCart_5984e73a.slxc
[I 2025-06-16 01:01:53,206] Trial 3 finished with value: 13.603567753850689 and parameters: {'n_steps': 351, 'batch_size_idx': 0, 'learning_rate': 0.0006580443648580116, 'n_epochs': 7, 'gamma': 0.9822331785117202, 'clip_range': 0.34579415961710014, 'ent_coef': 0.022500798538013962, 'vf_coef': 0.6079335254029314, 'max_grad_norm': 3.173519576625185, 'gae_lambda': 0.91304674344586, 'n_layers': 3, 'layer_size': 237, 'activation_fn': 'leaky_relu'}. Best is trial 3 with value: 13.603567753850689.
Tuning PPO:   2%|███▏                                                                                                                                                            | 1/50 [51:00<41:39:06, 3060.14s/it, best_value=13.60]Starting MATLAB engine...
Using device: cuda
Deleted temporary model file: C:\Users\benva\AppData\Local\Temp\PendCart_f64fdad0.slx
Deleted: C:\Users\benva\OneDrive\Documents\MATLAB\full_wrap\PendCart_f64fdad0.slxc
[I 2025-06-16 01:03:30,653] Trial 2 finished with value: 11.727675796090766 and parameters: {'n_steps': 603, 'batch_size_idx': 1, 'learning_rate': 0.0005873081792312356, 'n_epochs': 12, 'gamma': 0.9783062235866241, 'clip_range': 0.24402073256450985, 'ent_coef': 4.657008487528408e-07, 'vf_coef': 0.697082466734829, 'max_grad_norm': 2.279981167536502, 'gae_lambda': 0.8370867112403104, 'n_layers': 3, 'layer_size': 197, 'activation_fn': 'tanh'}. Best is trial 3 with value: 13.603567753850689.
Tuning PPO:   4%|██████▍                                                                                                                                                         | 2/50 [52:37<17:33:54, 1317.38s/it, best_value=13.60]Starting MATLAB engine...
Deleted temporary model file: C:\Users\benva\AppData\Local\Temp\PendCart_efc0366d.slx
Deleted: C:\Users\benva\OneDrive\Documents\MATLAB\full_wrap\PendCart_efc0366d.slxc
[I 2025-06-16 01:03:40,953] Trial 1 finished with value: 14.404988693835577 and parameters: {'n_steps': 198, 'batch_size_idx': 3, 'learning_rate': 2.9034951579834356e-05, 'n_epochs': 14, 'gamma': 0.907519178684037, 'clip_range': 0.3321760029061539, 'ent_coef': 4.530959383757622e-07, 'vf_coef': 0.48717189581277875, 'max_grad_norm': 3.834341651706555, 'gae_lambda': 0.834452053479175, 'n_layers': 1, 'layer_size': 173, 'activation_fn': 'leaky_relu'}. Best is trial 1 with value: 14.404988693835577.
Tuning PPO:   6%|█████████▋                                                                                                                                                        | 3/50 [52:47<9:24:25, 720.54s/it, best_value=14.40]Starting MATLAB engine...
Using device: cuda
Using device: cuda
Deleted temporary model file: C:\Users\benva\AppData\Local\Temp\PendCart_143e2af1.slx
Deleted: C:\Users\benva\OneDrive\Documents\MATLAB\full_wrap\PendCart_143e2af1.slxc
[I 2025-06-16 01:04:52,820] Trial 0 finished with value: 14.135238445742534 and parameters: {'n_steps': 269, 'batch_size_idx': 0, 'learning_rate': 0.00013247406025151883, 'n_epochs': 12, 'gamma': 0.9653693829692959, 'clip_range': 0.17721931491823034, 'ent_coef': 0.0065386712810070495, 'vf_coef': 0.30819930656875555, 'max_grad_norm': 1.0935697504854927, 'gae_lambda': 0.8125282206619273, 'n_layers': 1, 'layer_size': 173, 'activation_fn': 'leaky_relu'}. Best is trial 1 with value: 14.404988693835577.
Tuning PPO:   8%|████████████▉                                                                                                                                                     | 4/50 [53:59<5:56:04, 464.45s/it, best_value=14.40]Starting MATLAB engine...
Using device: cuda
Deleted temporary model file: C:\Users\benva\AppData\Local\Temp\PendCart_48c212c9.slx
Deleted: C:\Users\benva\OneDrive\Documents\MATLAB\full_wrap\PendCart_48c212c9.slxc
[I 2025-06-16 01:48:31,949] Trial 4 finished with value: 12.655360973820477 and parameters: {'n_steps': 79, 'batch_size_idx': 0, 'learning_rate': 2.1140195609754534e-05, 'n_epochs': 13, 'gamma': 0.9004746656613815, 'clip_range': 0.35384660784220257, 'ent_coef': 0.0021237926065465177, 'vf_coef': 0.3991550777905284, 'max_grad_norm': 2.2884381675962175, 'gae_lambda': 0.9299368194087245, 'n_layers': 3, 'layer_size': 200, 'activation_fn': 'leaky_relu'}. Best is trial 1 with value: 14.404988693835577.
Tuning PPO:  10%|███████████████▊                                                                                                                                              | 5/50 [1:37:38<15:31:04, 1241.44s/it, best_value=14.40]Starting MATLAB engine...
Using device: cuda
Deleted temporary model file: C:\Users\benva\AppData\Local\Temp\PendCart_5a8057ad.slx
Deleted: C:\Users\benva\OneDrive\Documents\MATLAB\full_wrap\PendCart_5a8057ad.slxc
[I 2025-06-16 01:48:59,417] Trial 5 finished with value: 12.377148239947108 and parameters: {'n_steps': 137, 'batch_size_idx': 0, 'learning_rate': 0.00016046145176640682, 'n_epochs': 8, 'gamma': 0.9671716793906494, 'clip_range': 0.13277731669120763, 'ent_coef': 0.00012110355366121923, 'vf_coef': 0.26956368919347734, 'max_grad_norm': 1.2892823168242433, 'gae_lambda': 0.9881744419456846, 'n_layers': 2, 'layer_size': 158, 'activation_fn': 'relu'}. Best is trial 1 with value: 14.404988693835577.
Tuning PPO:  12%|███████████████████                                                                                                                                            | 6/50 [1:38:06<10:07:42, 828.69s/it, best_value=14.40]Starting MATLAB engine...
Using device: cuda
Deleted temporary model file: C:\Users\benva\AppData\Local\Temp\PendCart_42a093cb.slx
Deleted: C:\Users\benva\OneDrive\Documents\MATLAB\full_wrap\PendCart_42a093cb.slxc
[I 2025-06-16 01:50:35,382] Trial 7 finished with value: 12.139606116401836 and parameters: {'n_steps': 920, 'batch_size_idx': 1, 'learning_rate': 0.00010289085973478694, 'n_epochs': 4, 'gamma': 0.9528352022021662, 'clip_range': 0.26981301565729365, 'ent_coef': 3.5369230167699055e-06, 'vf_coef': 0.2075463520652558, 'max_grad_norm': 3.99393902766147, 'gae_lambda': 0.853234942918022, 'n_layers': 3, 'layer_size': 96, 'activation_fn': 'leaky_relu'}. Best is trial 1 with value: 14.404988693835577.
Tuning PPO:  14%|██████████████████████▍                                                                                                                                         | 7/50 [1:39:42<7:02:13, 589.15s/it, best_value=14.40]Starting MATLAB engine...
Using device: cuda
Deleted temporary model file: C:\Users\benva\AppData\Local\Temp\PendCart_61769c9c.slx
Deleted: C:\Users\benva\OneDrive\Documents\MATLAB\full_wrap\PendCart_61769c9c.slxc
[I 2025-06-16 01:54:01,748] Trial 6 finished with value: 33.55480710899732 and parameters: {'n_steps': 1110, 'batch_size_idx': 2, 'learning_rate': 0.0007656886490973808, 'n_epochs': 8, 'gamma': 0.9094398928890381, 'clip_range': 0.19931737459108761, 'ent_coef': 8.096214904082498e-05, 'vf_coef': 0.779600263159121, 'max_grad_norm': 3.6320712111152273, 'gae_lambda': 0.9170728650141484, 'n_layers': 3, 'layer_size': 54, 'activation_fn': 'relu'}. Best is trial 6 with value: 33.55480710899732.
Tuning PPO:  16%|█████████████████████████▌                                                                                                                                      | 8/50 [1:43:08<5:27:06, 467.29s/it, best_value=33.55]Starting MATLAB engine...
Using device: cuda
Deleted temporary model file: C:\Users\benva\AppData\Local\Temp\PendCart_bfe93e23.slx
Deleted: C:\Users\benva\OneDrive\Documents\MATLAB\full_wrap\PendCart_bfe93e23.slxc
[I 2025-06-16 02:27:10,942] Trial 8 finished with value: 17.983091476907607 and parameters: {'n_steps': 717, 'batch_size_idx': 0, 'learning_rate': 7.372014374897311e-05, 'n_epochs': 12, 'gamma': 0.9881443463152529, 'clip_range': 0.2631648824843409, 'ent_coef': 1.991469486228589e-07, 'vf_coef': 0.7737536489145366, 'max_grad_norm': 3.3147159102953188, 'gae_lambda': 0.8039027778869982, 'n_layers': 2, 'layer_size': 58, 'activation_fn': 'relu'}. Best is trial 6 with value: 33.55480710899732.
Tuning PPO:  18%|████████████████████████████▌                                                                                                                                  | 9/50 [2:16:17<10:44:25, 943.06s/it, best_value=33.55]Starting MATLAB engine...
Using device: cuda
Deleted temporary model file: C:\Users\benva\AppData\Local\Temp\PendCart_e34f905f.slx
Deleted: C:\Users\benva\OneDrive\Documents\MATLAB\full_wrap\PendCart_e34f905f.slxc
[I 2025-06-16 02:30:05,577] Trial 9 finished with value: 14.210006072540338 and parameters: {'n_steps': 764, 'batch_size_idx': 0, 'learning_rate': 0.00011996077902218562, 'n_epochs': 14, 'gamma': 0.9934586248757318, 'clip_range': 0.2629249535534975, 'ent_coef': 3.836746034499609e-05, 'vf_coef': 0.21028811316478996, 'max_grad_norm': 4.358683509733264, 'gae_lambda': 0.9855420049873124, 'n_layers': 2, 'layer_size': 53, 'activation_fn': 'relu'}. Best is trial 6 with value: 33.55480710899732.
Tuning PPO:  20%|███████████████████████████████▊                                                                                                                               | 10/50 [2:19:12<7:50:33, 705.83s/it, best_value=33.55]Starting MATLAB engine...
Using device: cuda
Deleted temporary model file: C:\Users\benva\AppData\Local\Temp\PendCart_e4d1560d.slx
Deleted: C:\Users\benva\OneDrive\Documents\MATLAB\full_wrap\PendCart_e4d1560d.slxc
[I 2025-06-16 02:30:36,108] Trial 10 finished with value: 12.021944103393926 and parameters: {'n_steps': 694, 'batch_size_idx': 0, 'learning_rate': 0.00011317654714377372, 'n_epochs': 18, 'gamma': 0.9550037052907224, 'clip_range': 0.3691560010818219, 'ent_coef': 0.027986172086635303, 'vf_coef': 0.7892285303515211, 'max_grad_norm': 3.423803563420569, 'gae_lambda': 0.9195147315246914, 'n_layers': 1, 'layer_size': 184, 'activation_fn': 'elu'}. Best is trial 6 with value: 33.55480710899732.
Tuning PPO:  22%|██████████████████████████████████▉                                                                                                                            | 11/50 [2:19:43<5:24:26, 499.15s/it, best_value=33.55]Starting MATLAB engine...
Using device: cuda
Deleted temporary model file: C:\Users\benva\AppData\Local\Temp\PendCart_3c81dfe4.slx
Deleted: C:\Users\benva\OneDrive\Documents\MATLAB\full_wrap\PendCart_3c81dfe4.slxc
[I 2025-06-16 02:32:48,951] Trial 11 finished with value: 21.678208495315292 and parameters: {'n_steps': 246, 'batch_size_idx': 3, 'learning_rate': 9.471427347427282e-05, 'n_epochs': 4, 'gamma': 0.9527625470678499, 'clip_range': 0.38550549962500047, 'ent_coef': 0.005003369447094646, 'vf_coef': 0.4569346616561797, 'max_grad_norm': 1.369553501784347, 'gae_lambda': 0.8352339843668151, 'n_layers': 3, 'layer_size': 229, 'activation_fn': 'tanh'}. Best is trial 6 with value: 33.55480710899732.
Tuning PPO:  24%|██████████████████████████████████████▏                                                                                                                        | 12/50 [2:21:55<4:05:33, 387.72s/it, best_value=33.55]Starting MATLAB engine...
Using device: cuda
Deleted temporary model file: C:\Users\benva\AppData\Local\Temp\PendCart_4e7328c6.slx
Deleted: C:\Users\benva\OneDrive\Documents\MATLAB\full_wrap\PendCart_4e7328c6.slxc
[I 2025-06-16 03:07:16,620] Trial 12 finished with value: 12.705177202969418 and parameters: {'n_steps': 169, 'batch_size_idx': 0, 'learning_rate': 3.983866986015136e-05, 'n_epochs': 10, 'gamma': 0.9500872039489845, 'clip_range': 0.31567526911435473, 'ent_coef': 0.0003864672163860524, 'vf_coef': 0.33880281369470555, 'max_grad_norm': 2.6452131020562417, 'gae_lambda': 0.8319372166368022, 'n_layers': 3, 'layer_size': 88, 'activation_fn': 'elu'}. Best is trial 6 with value: 33.55480710899732.
Tuning PPO:  26%|█████████████████████████████████████████▎                                                                                                                     | 13/50 [2:56:23<9:12:55, 896.63s/it, best_value=33.55]Starting MATLAB engine...
Using device: cuda
Deleted temporary model file: C:\Users\benva\AppData\Local\Temp\PendCart_dce373d0.slx
Deleted: C:\Users\benva\OneDrive\Documents\MATLAB\full_wrap\PendCart_dce373d0.slxc
[I 2025-06-16 03:13:42,142] Trial 14 finished with value: 13.475216540867029 and parameters: {'n_steps': 1818, 'batch_size_idx': 2, 'learning_rate': 4.266080296381216e-05, 'n_epochs': 9, 'gamma': 0.9215620601141612, 'clip_range': 0.2020896174590262, 'ent_coef': 0.0003273943854536584, 'vf_coef': 0.9268939459067023, 'max_grad_norm': 4.881458622360309, 'gae_lambda': 0.8726496294015695, 'n_layers': 2, 'layer_size': 34, 'activation_fn': 'relu'}. Best is trial 6 with value: 33.55480710899732.
Tuning PPO:  28%|████████████████████████████████████████████▌                                                                                                                  | 14/50 [3:02:49<7:25:21, 742.25s/it, best_value=33.55]Starting MATLAB engine...
Using device: cuda
Deleted temporary model file: C:\Users\benva\AppData\Local\Temp\PendCart_16c12493.slx
Deleted: C:\Users\benva\OneDrive\Documents\MATLAB\full_wrap\PendCart_16c12493.slxc
[I 2025-06-16 03:14:02,634] Trial 13 finished with value: 10.622082573848498 and parameters: {'n_steps': 1848, 'batch_size_idx': 11, 'learning_rate': 0.0009492194830480456, 'n_epochs': 20, 'gamma': 0.9228610297715537, 'clip_range': 0.10156826398890621, 'ent_coef': 1.1307278617835618e-08, 'vf_coef': 0.9691199165497734, 'max_grad_norm': 4.958394840628133, 'gae_lambda': 0.8814987685853822, 'n_layers': 2, 'layer_size': 115, 'activation_fn': 'elu'}. Best is trial 6 with value: 33.55480710899732.
Tuning PPO:  30%|███████████████████████████████████████████████▋                                                                                                               | 15/50 [3:03:09<5:06:04, 524.69s/it, best_value=33.55]Starting MATLAB engine...
Using device: cuda
Deleted temporary model file: C:\Users\benva\AppData\Local\Temp\PendCart_90d98c49.slx
Deleted: C:\Users\benva\OneDrive\Documents\MATLAB\full_wrap\PendCart_90d98c49.slxc
[I 2025-06-16 03:19:46,926] Trial 15 finished with value: 11.121222861280032 and parameters: {'n_steps': 1962, 'batch_size_idx': 2, 'learning_rate': 0.00029176475003495924, 'n_epochs': 4, 'gamma': 0.9275092948967145, 'clip_range': 0.1965902099854542, 'ent_coef': 0.0005131551263452579, 'vf_coef': 0.9888646631177712, 'max_grad_norm': 4.973618868337118, 'gae_lambda': 0.8735472957995918, 'n_layers': 3, 'layer_size': 114, 'activation_fn': 'tanh'}. Best is trial 6 with value: 33.55480710899732.
Tuning PPO:  32%|██████████████████████████████████████████████████▉                                                                                                            | 16/50 [3:08:53<4:26:33, 470.39s/it, best_value=33.55]Starting MATLAB engine...
Using device: cuda
Deleted temporary model file: C:\Users\benva\AppData\Local\Temp\PendCart_b1df10bd.slx
Deleted: C:\Users\benva\OneDrive\Documents\MATLAB\full_wrap\PendCart_b1df10bd.slxc
[I 2025-06-16 03:51:52,140] Trial 16 finished with value: 14.494785682159534 and parameters: {'n_steps': 1635, 'batch_size_idx': 1, 'learning_rate': 0.0003060147907605851, 'n_epochs': 4, 'gamma': 0.9298518593588276, 'clip_range': 0.19549639770630545, 'ent_coef': 0.000612757638607837, 'vf_coef': 0.9733692926447801, 'max_grad_norm': 1.7777039516762008, 'gae_lambda': 0.8786729861884958, 'n_layers': 2, 'layer_size': 254, 'activation_fn': 'tanh'}. Best is trial 6 with value: 33.55480710899732.
Tuning PPO:  34%|██████████████████████████████████████████████████████                                                                                                         | 17/50 [3:40:59<8:19:19, 907.86s/it, best_value=33.55]Starting MATLAB engine...
Using device: cuda
Deleted temporary model file: C:\Users\benva\AppData\Local\Temp\PendCart_41dc9f97.slx
Deleted: C:\Users\benva\OneDrive\Documents\MATLAB\full_wrap\PendCart_41dc9f97.slxc
[I 2025-06-16 03:56:23,397] Trial 17 finished with value: 19.168309785508228 and parameters: {'n_steps': 1811, 'batch_size_idx': 0, 'learning_rate': 0.0002795055050142659, 'n_epochs': 4, 'gamma': 0.9304989523097191, 'clip_range': 0.12285663618272484, 'ent_coef': 1.8674856074799412e-08, 'vf_coef': 0.9921020241546155, 'max_grad_norm': 0.6486438205404486, 'gae_lambda': 0.9509057231562393, 'n_layers': 3, 'layer_size': 255, 'activation_fn': 'tanh'}. Best is trial 6 with value: 33.55480710899732.
Tuning PPO:  36%|█████████████████████████████████████████████████████████▏                                                                                                     | 18/50 [3:45:30<6:22:10, 716.56s/it, best_value=33.55]Starting MATLAB engine...
Using device: cuda
Deleted temporary model file: C:\Users\benva\AppData\Local\Temp\PendCart_49883b51.slx
Deleted: C:\Users\benva\OneDrive\Documents\MATLAB\full_wrap\PendCart_49883b51.slxc
[I 2025-06-16 03:56:54,666] Trial 18 finished with value: 6.837404161531905 and parameters: {'n_steps': 1227, 'batch_size_idx': 0, 'learning_rate': 0.0003042769624886504, 'n_epochs': 4, 'gamma': 0.9282407024351264, 'clip_range': 0.39365882747466496, 'ent_coef': 0.0016437928539936378, 'vf_coef': 0.5446483923023268, 'max_grad_norm': 1.5411502527988767, 'gae_lambda': 0.9512634221915859, 'n_layers': 3, 'layer_size': 255, 'activation_fn': 'tanh'}. Best is trial 6 with value: 33.55480710899732.
Tuning PPO:  38%|████████████████████████████████████████████████████████████▍                                                                                                  | 19/50 [3:46:01<4:23:52, 510.74s/it, best_value=33.55]Starting MATLAB engine...
Using device: cuda
Deleted temporary model file: C:\Users\benva\AppData\Local\Temp\PendCart_0788d2c6.slx
Deleted: C:\Users\benva\OneDrive\Documents\MATLAB\full_wrap\PendCart_0788d2c6.slxc
[I 2025-06-16 03:58:53,716] Trial 19 finished with value: 18.303301445625163 and parameters: {'n_steps': 436, 'batch_size_idx': 2, 'learning_rate': 1.1052111370287777e-05, 'n_epochs': 6, 'gamma': 0.9363834379058106, 'clip_range': 0.39002954863816386, 'ent_coef': 7.660691848923514e-06, 'vf_coef': 0.5400635910363677, 'max_grad_norm': 0.4569459207154274, 'gae_lambda': 0.9398588649583594, 'n_layers': 3, 'layer_size': 256, 'activation_fn': 'tanh'}. Best is trial 6 with value: 33.55480710899732.
Tuning PPO:  40%|███████████████████████████████████████████████████████████████▌                                                                                               | 20/50 [3:48:00<3:16:34, 393.14s/it, best_value=33.55]Starting MATLAB engine...
Using device: cuda
Deleted temporary model file: C:\Users\benva\AppData\Local\Temp\PendCart_fba6cde0.slx
Deleted: C:\Users\benva\OneDrive\Documents\MATLAB\full_wrap\PendCart_fba6cde0.slxc
