[I 2025-06-16 04:31:25,988] Trial 20 finished with value: 13.739265460748706 and parameters: {'n_steps': 404, 'batch_size_idx': 2, 'learning_rate': 1.0028734574057079e-05, 'n_epochs': 6, 'gamma': 0.9366716911629304, 'clip_range': 0.3933036926536001, 'ent_coef': 1.6261790342573175e-05, 'vf_coef': 0.5180608962936897, 'max_grad_norm': 0.42704423552199444, 'gae_lambda': 0.9484676576166977, 'n_layers': 3, 'layer_size': 217, 'activation_fn': 'tanh'}. Best is trial 6 with value: 33.55480710899732.
Tuning PPO:  42%|██████████████████████████████████████████████████████████████████▊                                                                                            | 21/50 [4:20:32<6:56:13, 861.14s/it, best_value=33.55]Starting MATLAB engine...
Using device: cuda
Deleted temporary model file: C:\Users\benva\AppData\Local\Temp\PendCart_ad4f72fb.slx
Deleted: C:\Users\benva\OneDrive\Documents\MATLAB\full_wrap\PendCart_ad4f72fb.slxc
[I 2025-06-16 04:36:14,450] Trial 22 finished with value: 14.600824507595343 and parameters: {'n_steps': 457, 'batch_size_idx': 0, 'learning_rate': 1.1733463264165615e-05, 'n_epochs': 6, 'gamma': 0.9394231403999979, 'clip_range': 0.3045831770134658, 'ent_coef': 5.878801484387073e-06, 'vf_coef': 0.6525711583361776, 'max_grad_norm': 0.5747002225578055, 'gae_lambda': 0.9496582249454564, 'n_layers': 3, 'layer_size': 219, 'activation_fn': 'relu'}. Best is trial 6 with value: 33.55480710899732.
Tuning PPO:  44%|█████████████████████████████████████████████████████████████████████▉                                                                                         | 22/50 [4:25:21<5:21:39, 689.27s/it, best_value=33.55]Starting MATLAB engine...
Using device: cuda
Deleted temporary model file: C:\Users\benva\AppData\Local\Temp\PendCart_1776a108.slx
Deleted: C:\Users\benva\OneDrive\Documents\MATLAB\full_wrap\PendCart_1776a108.slxc
[I 2025-06-16 04:36:47,042] Trial 21 finished with value: 15.09372842880038 and parameters: {'n_steps': 465, 'batch_size_idx': 2, 'learning_rate': 1.0082247563742992e-05, 'n_epochs': 6, 'gamma': 0.9403733679386611, 'clip_range': 0.15699352720803517, 'ent_coef': 0.0959421934694893, 'vf_coef': 0.5660489706851742, 'max_grad_norm': 0.3916381223738026, 'gae_lambda': 0.951678050883502, 'n_layers': 3, 'layer_size': 222, 'activation_fn': 'relu'}. Best is trial 6 with value: 33.55480710899732.
Tuning PPO:  46%|█████████████████████████████████████████████████████████████████████████▏                                                                                     | 23/50 [4:25:53<3:41:29, 492.21s/it, best_value=33.55]Starting MATLAB engine...
Using device: cuda
Deleted temporary model file: C:\Users\benva\AppData\Local\Temp\PendCart_956d25d9.slx
Deleted: C:\Users\benva\OneDrive\Documents\MATLAB\full_wrap\PendCart_956d25d9.slxc
[I 2025-06-16 04:38:25,982] Trial 23 finished with value: 17.799489934348173 and parameters: {'n_steps': 107, 'batch_size_idx': 0, 'learning_rate': 6.322500551358702e-05, 'n_epochs': 6, 'gamma': 0.9420394658234603, 'clip_range': 0.30503269251450454, 'ent_coef': 0.06207320645096717, 'vf_coef': 0.11359206867222726, 'max_grad_norm': 1.930772540601636, 'gae_lambda': 0.8964603385898032, 'n_layers': 3, 'layer_size': 219, 'activation_fn': 'relu'}. Best is trial 6 with value: 33.55480710899732.
Tuning PPO:  48%|████████████████████████████████████████████████████████████████████████████▎                                                                                  | 24/50 [4:27:32<2:42:09, 374.21s/it, best_value=33.55]Starting MATLAB engine...
Using device: cuda
Deleted temporary model file: C:\Users\benva\AppData\Local\Temp\PendCart_0f33b518.slx
Deleted: C:\Users\benva\OneDrive\Documents\MATLAB\full_wrap\PendCart_0f33b518.slxc
[I 2025-06-16 05:15:40,762] Trial 24 finished with value: 18.004868294939573 and parameters: {'n_steps': 1106, 'batch_size_idx': 1, 'learning_rate': 0.00046525790305495504, 'n_epochs': 6, 'gamma': 0.915316844600533, 'clip_range': 0.15485520069040054, 'ent_coef': 1.3208795918071455e-08, 'vf_coef': 0.8547168605661888, 'max_grad_norm': 0.8907878389303374, 'gae_lambda': 0.9014707551245913, 'n_layers': 3, 'layer_size': 225, 'activation_fn': 'tanh'}. Best is trial 6 with value: 33.55480710899732.
Tuning PPO:  50%|███████████████████████████████████████████████████████████████████████████████▌                                                                               | 25/50 [5:04:47<6:28:31, 932.45s/it, best_value=33.55]Starting MATLAB engine...
Using device: cuda
Deleted temporary model file: C:\Users\benva\AppData\Local\Temp\PendCart_ec6cba30.slx
Deleted: C:\Users\benva\OneDrive\Documents\MATLAB\full_wrap\PendCart_ec6cba30.slxc
[I 2025-06-16 05:17:08,420] Trial 26 finished with value: 7.925680787117416 and parameters: {'n_steps': 1149, 'batch_size_idx': 0, 'learning_rate': 0.00018865718391397127, 'n_epochs': 10, 'gamma': 0.9127112429629739, 'clip_range': 0.11301685253591398, 'ent_coef': 5.023291791236528e-08, 'vf_coef': 0.8686352161273578, 'max_grad_norm': 1.9109671074989798, 'gae_lambda': 0.9001109853565673, 'n_layers': 3, 'layer_size': 149, 'activation_fn': 'tanh'}. Best is trial 6 with value: 33.55480710899732.
Tuning PPO:  52%|██████████████████████████████████████████████████████████████████████████████████▋                                                                            | 26/50 [5:06:15<4:31:35, 678.99s/it, best_value=33.55]Starting MATLAB engine...
Using device: cuda
Deleted temporary model file: C:\Users\benva\AppData\Local\Temp\PendCart_169facd8.slx
Deleted: C:\Users\benva\OneDrive\Documents\MATLAB\full_wrap\PendCart_169facd8.slxc
[I 2025-06-16 05:20:00,602] Trial 27 finished with value: 14.508116341095047 and parameters: {'n_steps': 1326, 'batch_size_idx': 5, 'learning_rate': 0.00023777184817080647, 'n_epochs': 10, 'gamma': 0.9137184902208315, 'clip_range': 0.10673882862847744, 'ent_coef': 1.4842109589860852e-08, 'vf_coef': 0.8549590487823536, 'max_grad_norm': 1.0022192475979743, 'gae_lambda': 0.9637116308559223, 'n_layers': 3, 'layer_size': 143, 'activation_fn': 'tanh'}. Best is trial 6 with value: 33.55480710899732.
Tuning PPO:  54%|█████████████████████████████████████████████████████████████████████████████████████▊                                                                         | 27/50 [5:09:07<3:21:59, 526.94s/it, best_value=33.55]Starting MATLAB engine...
Using device: cuda
Deleted temporary model file: C:\Users\benva\AppData\Local\Temp\PendCart_d49b4231.slx
Deleted: C:\Users\benva\OneDrive\Documents\MATLAB\full_wrap\PendCart_d49b4231.slxc
[I 2025-06-16 05:20:28,793] Trial 25 finished with value: 16.67458485958685 and parameters: {'n_steps': 1223, 'batch_size_idx': 0, 'learning_rate': 0.00020030151353494247, 'n_epochs': 10, 'gamma': 0.9121618861519911, 'clip_range': 0.13405127663476538, 'ent_coef': 0.0862560276709318, 'vf_coef': 0.8159641195088103, 'max_grad_norm': 0.9799988219587095, 'gae_lambda': 0.9004467366778094, 'n_layers': 3, 'layer_size': 141, 'activation_fn': 'tanh'}. Best is trial 6 with value: 33.55480710899732.
Tuning PPO:  56%|█████████████████████████████████████████████████████████████████████████████████████████                                                                      | 28/50 [5:09:35<2:18:20, 377.31s/it, best_value=33.55]Starting MATLAB engine...
Using device: cuda
Deleted temporary model file: C:\Users\benva\AppData\Local\Temp\PendCart_0032c4f6.slx
Deleted: C:\Users\benva\OneDrive\Documents\MATLAB\full_wrap\PendCart_0032c4f6.slxc
[I 2025-06-16 05:56:02,823] Trial 29 finished with value: 9.011350377046597 and parameters: {'n_steps': 283, 'batch_size_idx': 0, 'learning_rate': 0.0009188677428973725, 'n_epochs': 8, 'gamma': 0.9606347365219976, 'clip_range': 0.22779727730228333, 'ent_coef': 6.692904094415159e-05, 'vf_coef': 0.4456628165293865, 'max_grad_norm': 2.732361509621703, 'gae_lambda': 0.9737337907809616, 'n_layers': 2, 'layer_size': 127, 'activation_fn': 'tanh'}. Best is trial 6 with value: 33.55480710899732.
Tuning PPO:  58%|████████████████████████████████████████████████████████████████████████████████████████████▏                                                                  | 29/50 [5:45:09<5:16:31, 904.34s/it, best_value=33.55]Starting MATLAB engine...
Using device: cuda
Deleted temporary model file: C:\Users\benva\AppData\Local\Temp\PendCart_cc0e4ba7.slx
Deleted: C:\Users\benva\OneDrive\Documents\MATLAB\full_wrap\PendCart_cc0e4ba7.slxc
[I 2025-06-16 05:58:36,440] Trial 31 finished with value: 14.306728311312195 and parameters: {'n_steps': 251, 'batch_size_idx': 0, 'learning_rate': 0.0009622664153623797, 'n_epochs': 8, 'gamma': 0.9012575894107889, 'clip_range': 0.2271239486637819, 'ent_coef': 6.758330699426328e-05, 'vf_coef': 0.7191661727069822, 'max_grad_norm': 2.9087628251737354, 'gae_lambda': 0.9728264410279621, 'n_layers': 2, 'layer_size': 240, 'activation_fn': 'elu'}. Best is trial 6 with value: 33.55480710899732.
Tuning PPO:  60%|███████████████████████████████████████████████████████████████████████████████████████████████▍                                                               | 30/50 [5:47:43<3:46:22, 679.12s/it, best_value=33.55]Starting MATLAB engine...
Deleted temporary model file: C:\Users\benva\AppData\Local\Temp\PendCart_61171b00.slx
Deleted: C:\Users\benva\OneDrive\Documents\MATLAB\full_wrap\PendCart_61171b00.slxc
[I 2025-06-16 05:58:44,791] Trial 30 finished with value: 19.87206970624245 and parameters: {'n_steps': 214, 'batch_size_idx': 1, 'learning_rate': 0.00043012467156744433, 'n_epochs': 8, 'gamma': 0.959937853126626, 'clip_range': 0.23157111591932072, 'ent_coef': 4.0340984379386574e-05, 'vf_coef': 0.4331631107240665, 'max_grad_norm': 3.0603186057161427, 'gae_lambda': 0.9705432397530217, 'n_layers': 2, 'layer_size': 241, 'activation_fn': 'tanh'}. Best is trial 6 with value: 33.55480710899732.
Tuning PPO:  62%|██████████████████████████████████████████████████████████████████████████████████████████████████▌                                                            | 31/50 [5:47:51<2:31:19, 477.89s/it, best_value=33.55]Starting MATLAB engine...
Using device: cuda
Using device: cuda
Deleted temporary model file: C:\Users\benva\AppData\Local\Temp\PendCart_10cb0b80.slx
Deleted: C:\Users\benva\OneDrive\Documents\MATLAB\full_wrap\PendCart_10cb0b80.slxc
[I 2025-06-16 05:59:19,978] Trial 28 finished with value: 15.58018024805688 and parameters: {'n_steps': 1396, 'batch_size_idx': 0, 'learning_rate': 0.0001964553810240442, 'n_epochs': 10, 'gamma': 0.9101809437823478, 'clip_range': 0.22892487272382395, 'ent_coef': 1.2035980300514268e-06, 'vf_coef': 0.8611447541592989, 'max_grad_norm': 0.9119393353662153, 'gae_lambda': 0.967408141210916, 'n_layers': 2, 'layer_size': 141, 'activation_fn': 'tanh'}. Best is trial 6 with value: 33.55480710899732.
Tuning PPO:  64%|█████████████████████████████████████████████████████████████████████████████████████████████████████▊                                                         | 32/50 [5:48:26<1:43:31, 345.07s/it, best_value=33.55]Starting MATLAB engine...
Using device: cuda
Deleted temporary model file: C:\Users\benva\AppData\Local\Temp\PendCart_b91f14d8.slx
Deleted: C:\Users\benva\OneDrive\Documents\MATLAB\full_wrap\PendCart_b91f14d8.slxc
[I 2025-06-16 06:34:45,813] Trial 32 finished with value: 8.749329393028443 and parameters: {'n_steps': 259, 'batch_size_idx': 1, 'learning_rate': 0.00042299635043729835, 'n_epochs': 8, 'gamma': 0.9694018584158421, 'clip_range': 0.17029965476379008, 'ent_coef': 0.006960661769731275, 'vf_coef': 0.6859872170849789, 'max_grad_norm': 1.3346223963267483, 'gae_lambda': 0.85470632962383, 'n_layers': 2, 'layer_size': 237, 'activation_fn': 'elu'}. Best is trial 6 with value: 33.55480710899732.
Tuning PPO:  66%|████████████████████████████████████████████████████████████████████████████████████████████████████████▉                                                      | 33/50 [6:23:52<4:09:08, 879.31s/it, best_value=33.55]Starting MATLAB engine...
Using device: cuda
Deleted temporary model file: C:\Users\benva\AppData\Local\Temp\PendCart_8686521e.slx
Deleted: C:\Users\benva\OneDrive\Documents\MATLAB\full_wrap\PendCart_8686521e.slxc
[I 2025-06-16 06:37:02,173] Trial 33 finished with value: 11.019487475633596 and parameters: {'n_steps': 251, 'batch_size_idx': 0, 'learning_rate': 0.0005071596367323716, 'n_epochs': 5, 'gamma': 0.9655810209957023, 'clip_range': 0.17531169319342108, 'ent_coef': 0.0036046181784349695, 'vf_coef': 0.41100790660483355, 'max_grad_norm': 3.9605668930346973, 'gae_lambda': 0.9295506887288616, 'n_layers': 1, 'layer_size': 238, 'activation_fn': 'tanh'}. Best is trial 6 with value: 33.55480710899732.
Tuning PPO:  68%|████████████████████████████████████████████████████████████████████████████████████████████████████████████                                                   | 34/50 [6:26:09<2:55:02, 656.42s/it, best_value=33.55]Starting MATLAB engine...
Using device: cuda
Deleted temporary model file: C:\Users\benva\AppData\Local\Temp\PendCart_9693d52d.slx
Deleted: C:\Users\benva\OneDrive\Documents\MATLAB\full_wrap\PendCart_9693d52d.slxc
[I 2025-06-16 06:37:30,128] Trial 34 finished with value: 21.557110505460013 and parameters: {'n_steps': 219, 'batch_size_idx': 1, 'learning_rate': 0.0004525552335296971, 'n_epochs': 5, 'gamma': 0.9727869317294725, 'clip_range': 0.17455467342229386, 'ent_coef': 0.006070227262721474, 'vf_coef': 0.3908442289813845, 'max_grad_norm': 3.919991801941321, 'gae_lambda': 0.9995267410407478, 'n_layers': 1, 'layer_size': 238, 'activation_fn': 'tanh'}. Best is trial 6 with value: 33.55480710899732.
Tuning PPO:  70%|███████████████████████████████████████████████████████████████████████████████████████████████████████████████▎                                               | 35/50 [6:26:37<1:56:58, 467.88s/it, best_value=33.55]Starting MATLAB engine...
Deleted temporary model file: C:\Users\benva\AppData\Local\Temp\PendCart_875ce8b7.slx
Deleted: C:\Users\benva\OneDrive\Documents\MATLAB\full_wrap\PendCart_875ce8b7.slxc
[I 2025-06-16 06:37:40,931] Trial 35 finished with value: 10.986581692725329 and parameters: {'n_steps': 200, 'batch_size_idx': 3, 'learning_rate': 0.0004265669692441323, 'n_epochs': 5, 'gamma': 0.9700936963346619, 'clip_range': 0.2876000421981308, 'ent_coef': 0.005443570165943167, 'vf_coef': 0.4288721690386914, 'max_grad_norm': 3.7069838065027794, 'gae_lambda': 0.9238450895634988, 'n_layers': 1, 'layer_size': 237, 'activation_fn': 'tanh'}. Best is trial 6 with value: 33.55480710899732.
Tuning PPO:  72%|██████████████████████████████████████████████████████████████████████████████████████████████████████████████████▍                                            | 36/50 [6:26:47<1:17:10, 330.76s/it, best_value=33.55]Starting MATLAB engine...
Using device: cuda
Using device: cuda
Deleted temporary model file: C:\Users\benva\AppData\Local\Temp\PendCart_76c25279.slx
Deleted: C:\Users\benva\OneDrive\Documents\MATLAB\full_wrap\PendCart_76c25279.slxc
[I 2025-06-16 07:13:49,105] Trial 36 finished with value: 9.396292266061156 and parameters: {'n_steps': 219, 'batch_size_idx': 1, 'learning_rate': 0.0006535018390025484, 'n_epochs': 5, 'gamma': 0.9586402619133282, 'clip_range': 0.2865404513598946, 'ent_coef': 1.5969113646817326e-06, 'vf_coef': 0.4570757411215324, 'max_grad_norm': 3.66652537234689, 'gae_lambda': 0.9951109830041034, 'n_layers': 1, 'layer_size': 201, 'activation_fn': 'tanh'}. Best is trial 6 with value: 33.55480710899732.
Tuning PPO:  74%|█████████████████████████████████████████████████████████████████████████████████████████████████████████████████████▋                                         | 37/50 [7:02:56<3:11:05, 881.98s/it, best_value=33.55]Starting MATLAB engine...
Using device: cuda
Deleted temporary model file: C:\Users\benva\AppData\Local\Temp\PendCart_295845ff.slx
Deleted: C:\Users\benva\OneDrive\Documents\MATLAB\full_wrap\PendCart_295845ff.slxc
[I 2025-06-16 07:16:02,717] Trial 37 finished with value: 18.6747760366731 and parameters: {'n_steps': 198, 'batch_size_idx': 3, 'learning_rate': 0.0004072537850547564, 'n_epochs': 5, 'gamma': 0.9608896771821612, 'clip_range': 0.21372963742433013, 'ent_coef': 1.2418445901515237e-06, 'vf_coef': 0.482628376893884, 'max_grad_norm': 3.7013871580787177, 'gae_lambda': 0.9937687751649388, 'n_layers': 1, 'layer_size': 200, 'activation_fn': 'tanh'}. Best is trial 6 with value: 33.55480710899732.
Tuning PPO:  76%|████████████████████████████████████████████████████████████████████████████████████████████████████████████████████████▊                                      | 38/50 [7:05:09<2:11:29, 657.47s/it, best_value=33.55]Starting MATLAB engine...
Using device: cuda
Deleted temporary model file: C:\Users\benva\AppData\Local\Temp\PendCart_57d06c1f.slx
Deleted: C:\Users\benva\OneDrive\Documents\MATLAB\full_wrap\PendCart_57d06c1f.slxc
[I 2025-06-16 07:16:42,914] Trial 38 finished with value: 15.99297477857076 and parameters: {'n_steps': 153, 'batch_size_idx': 1, 'learning_rate': 0.0007109053981054869, 'n_epochs': 5, 'gamma': 0.97953828184896, 'clip_range': 0.2134579412065173, 'ent_coef': 0.012326498947267353, 'vf_coef': 0.3624068710437414, 'max_grad_norm': 3.635983070774726, 'gae_lambda': 0.9907612179951336, 'n_layers': 1, 'layer_size': 205, 'activation_fn': 'leaky_relu'}. Best is trial 6 with value: 33.55480710899732.
Tuning PPO:  78%|████████████████████████████████████████████████████████████████████████████████████████████████████████████████████████████                                   | 39/50 [7:05:49<1:26:35, 472.29s/it, best_value=33.55]Starting MATLAB engine...
Deleted temporary model file: C:\Users\benva\AppData\Local\Temp\PendCart_4dc531ce.slx
Deleted: C:\Users\benva\OneDrive\Documents\MATLAB\full_wrap\PendCart_4dc531ce.slxc
[I 2025-06-16 07:16:53,154] Trial 39 finished with value: 15.621664206633005 and parameters: {'n_steps': 337, 'batch_size_idx': 0, 'learning_rate': 0.0006624661109319477, 'n_epochs': 7, 'gamma': 0.9600659336959314, 'clip_range': 0.2095645604185764, 'ent_coef': 0.012801860137231964, 'vf_coef': 0.35781249364697254, 'max_grad_norm': 4.409683535336113, 'gae_lambda': 0.9971831539201247, 'n_layers': 1, 'layer_size': 196, 'activation_fn': 'leaky_relu'}. Best is trial 6 with value: 33.55480710899732.
Tuning PPO:  80%|████████████████████████████████████████████████████████████████████████████████████████████████████████████████████████████████▊                                | 40/50 [7:06:00<55:36, 333.67s/it, best_value=33.55]Starting MATLAB engine...
Using device: cuda
Using device: cuda
Deleted temporary model file: C:\Users\benva\AppData\Local\Temp\PendCart_bdcc070c.slx
Deleted: C:\Users\benva\OneDrive\Documents\MATLAB\full_wrap\PendCart_bdcc070c.slxc
[I 2025-06-16 07:53:06,580] Trial 40 finished with value: 16.120986137320408 and parameters: {'n_steps': 328, 'batch_size_idx': 3, 'learning_rate': 7.819687913986276e-05, 'n_epochs': 7, 'gamma': 0.9789297698492939, 'clip_range': 0.21252367986195955, 'ent_coef': 0.013736513704035266, 'vf_coef': 0.3784202186561243, 'max_grad_norm': 4.241399542057241, 'gae_lambda': 0.9983378784554927, 'n_layers': 1, 'layer_size': 173, 'activation_fn': 'leaky_relu'}. Best is trial 6 with value: 33.55480710899732.
Tuning PPO:  82%|██████████████████████████████████████████████████████████████████████████████████████████████████████████████████████████████████▍                            | 41/50 [7:42:13<2:12:50, 885.60s/it, best_value=33.55]Starting MATLAB engine...
Using device: cuda
Deleted temporary model file: C:\Users\benva\AppData\Local\Temp\PendCart_c0ee37cb.slx
Deleted: C:\Users\benva\OneDrive\Documents\MATLAB\full_wrap\PendCart_c0ee37cb.slxc
[I 2025-06-16 07:54:19,149] Trial 41 finished with value: 12.185521319107053 and parameters: {'n_steps': 137, 'batch_size_idx': 0, 'learning_rate': 0.0006903777367750848, 'n_epochs': 7, 'gamma': 0.976940736140804, 'clip_range': 0.18719364950055653, 'ent_coef': 0.013984162260566238, 'vf_coef': 0.3770400476160117, 'max_grad_norm': 4.358164844927448, 'gae_lambda': 0.8220452774152277, 'n_layers': 1, 'layer_size': 167, 'activation_fn': 'leaky_relu'}. Best is trial 6 with value: 33.55480710899732.
Tuning PPO:  84%|█████████████████████████████████████████████████████████████████████████████████████████████████████████████████████████████████████▌                         | 42/50 [7:43:26<1:25:33, 641.69s/it, best_value=33.55]Starting MATLAB engine...
Using device: cuda
Deleted temporary model file: C:\Users\benva\AppData\Local\Temp\PendCart_35267c89.slx
Deleted: C:\Users\benva\OneDrive\Documents\MATLAB\full_wrap\PendCart_35267c89.slxc
[I 2025-06-16 07:55:34,756] Trial 43 finished with value: 9.355657338844706 and parameters: {'n_steps': 117, 'batch_size_idx': 1, 'learning_rate': 8.030174393909045e-05, 'n_epochs': 12, 'gamma': 0.9758713055486751, 'clip_range': 0.24250069929108406, 'ent_coef': 0.00157080285021199, 'vf_coef': 0.2660458490253016, 'max_grad_norm': 3.131647949253332, 'gae_lambda': 0.8238013299480516, 'n_layers': 2, 'layer_size': 177, 'activation_fn': 'relu'}. Best is trial 6 with value: 33.55480710899732.
Tuning PPO:  86%|██████████████████████████████████████████████████████████████████████████████████████████████████████████████████████████████████████████▍                      | 43/50 [7:44:41<55:03, 471.87s/it, best_value=33.55]Starting MATLAB engine...
Deleted temporary model file: C:\Users\benva\AppData\Local\Temp\PendCart_5c59f8db.slx
Deleted: C:\Users\benva\OneDrive\Documents\MATLAB\full_wrap\PendCart_5c59f8db.slxc
