[I 2025-06-16 07:55:47,134] Trial 42 finished with value: 16.941611231783256 and parameters: {'n_steps': 114, 'batch_size_idx': 1, 'learning_rate': 7.514434487670426e-05, 'n_epochs': 12, 'gamma': 0.9742890729247154, 'clip_range': 0.24501037160614214, 'ent_coef': 0.0001484832471904034, 'vf_coef': 0.24338845974459405, 'max_grad_norm': 4.253164662515932, 'gae_lambda': 0.8269027069383923, 'n_layers': 2, 'layer_size': 81, 'activation_fn': 'relu'}. Best is trial 6 with value: 33.55480710899732.
Tuning PPO:  88%|█████████████████████████████████████████████████████████████████████████████████████████████████████████████████████████████████████████████▋                   | 44/50 [7:44:54<33:24, 334.02s/it, best_value=33.55]Starting MATLAB engine...
Using device: cuda
Using device: cuda
Deleted temporary model file: C:\Users\benva\AppData\Local\Temp\PendCart_03694162.slx
Deleted: C:\Users\benva\OneDrive\Documents\MATLAB\full_wrap\PendCart_03694162.slxc
[I 2025-06-16 08:32:45,840] Trial 44 finished with value: 98.27366380632711 and parameters: {'n_steps': 123, 'batch_size_idx': 1, 'learning_rate': 0.0001418208241571663, 'n_epochs': 12, 'gamma': 0.9462681298290184, 'clip_range': 0.24696661540081993, 'ent_coef': 0.0012224645451237057, 'vf_coef': 0.6104720831701522, 'max_grad_norm': 3.117415939692258, 'gae_lambda': 0.9818428236547987, 'n_layers': 3, 'layer_size': 245, 'activation_fn': 'tanh'}. Best is trial 44 with value: 98.27366380632711.
Tuning PPO:  90%|███████████████████████████████████████████████████████████████████████████████████████████████████████████████████████████████████████████████                | 45/50 [8:21:52<1:14:57, 899.43s/it, best_value=98.27]Starting MATLAB engine...
Using device: cuda
Deleted temporary model file: C:\Users\benva\AppData\Local\Temp\PendCart_4ef434d5.slx
Deleted: C:\Users\benva\OneDrive\Documents\MATLAB\full_wrap\PendCart_4ef434d5.slxc
[I 2025-06-16 08:33:10,136] Trial 45 finished with value: 66.49846178340263 and parameters: {'n_steps': 113, 'batch_size_idx': 0, 'learning_rate': 0.00013803694752839425, 'n_epochs': 15, 'gamma': 0.9471053474897682, 'clip_range': 0.13115150723625799, 'ent_coef': 0.0012842439099187257, 'vf_coef': 0.28504052890336795, 'max_grad_norm': 3.3535606006686924, 'gae_lambda': 0.9831995400092276, 'n_layers': 3, 'layer_size': 247, 'activation_fn': 'relu'}. Best is trial 44 with value: 98.27366380632711.
Tuning PPO:  92%|████████████████████████████████████████████████████████████████████████████████████████████████████████████████████████████████████████████████████             | 46/50 [8:22:17<42:27, 636.89s/it, best_value=98.27]Starting MATLAB engine...
Using device: cuda
Deleted temporary model file: C:\Users\benva\AppData\Local\Temp\PendCart_24b0bfda.slx
Deleted: C:\Users\benva\OneDrive\Documents\MATLAB\full_wrap\PendCart_24b0bfda.slxc
[I 2025-06-16 08:35:15,956] Trial 47 finished with value: 23.42821082780171 and parameters: {'n_steps': 518, 'batch_size_idx': 2, 'learning_rate': 0.0003694343603624708, 'n_epochs': 4, 'gamma': 0.9470511075112238, 'clip_range': 0.14872588737944817, 'ent_coef': 2.1683204310056106e-05, 'vf_coef': 0.6226062850203571, 'max_grad_norm': 2.5202218371272456, 'gae_lambda': 0.980760488909588, 'n_layers': 3, 'layer_size': 246, 'activation_fn': 'tanh'}. Best is trial 44 with value: 98.27366380632711.
Tuning PPO:  94%|███████████████████████████████████████████████████████████████████████████████████████████████████████████████████████████████████████████████████████▎         | 47/50 [8:24:22<24:10, 483.57s/it, best_value=98.27]Deleted temporary model file: C:\Users\benva\AppData\Local\Temp\PendCart_7d37aa75.slx
Deleted: C:\Users\benva\OneDrive\Documents\MATLAB\full_wrap\PendCart_7d37aa75.slxc
[I 2025-06-16 08:38:02,770] Trial 46 finished with value: 302.76913511133057 and parameters: {'n_steps': 68, 'batch_size_idx': 1, 'learning_rate': 0.000344580194153308, 'n_epochs': 4, 'gamma': 0.9479956062170828, 'clip_range': 0.13195201626331293, 'ent_coef': 1.0974275204517842e-05, 'vf_coef': 0.6245891170378073, 'max_grad_norm': 2.4987564934099336, 'gae_lambda': 0.9381761664814343, 'n_layers': 3, 'layer_size': 249, 'activation_fn': 'tanh'}. Best is trial 46 with value: 302.76913511133057.
Tuning PPO:  96%|█████████████████████████████████████████████████████████████████████████████████████████████████████████████████████████████████████████████████████████▌      | 48/50 [8:27:09<12:57, 388.54s/it, best_value=302.77]Deleted temporary model file: C:\Users\benva\AppData\Local\Temp\PendCart_d359551e.slx
Deleted: C:\Users\benva\OneDrive\Documents\MATLAB\full_wrap\PendCart_d359551e.slxc
[I 2025-06-16 09:05:42,524] Trial 49 finished with value: 28.78969602222197 and parameters: {'n_steps': 105, 'batch_size_idx': 1, 'learning_rate': 0.00015899249084170365, 'n_epochs': 16, 'gamma': 0.9468983610179905, 'clip_range': 0.14826198114592487, 'ent_coef': 0.0007719403332931896, 'vf_coef': 0.6074788794315997, 'max_grad_norm': 2.313073811003935, 'gae_lambda': 0.9835547618528375, 'n_layers': 3, 'layer_size': 230, 'activation_fn': 'relu'}. Best is trial 46 with value: 302.76913511133057.
Tuning PPO:  98%|████████████████████████████████████████████████████████████████████████████████████████████████████████████████████████████████████████████████████████████▊   | 49/50 [8:54:49<12:49, 769.91s/it, best_value=302.77]Deleted temporary model file: C:\Users\benva\AppData\Local\Temp\PendCart_84a04316.slx
Deleted: C:\Users\benva\OneDrive\Documents\MATLAB\full_wrap\PendCart_84a04316.slxc
[I 2025-06-16 09:07:43,622] Trial 48 finished with value: 211.47558065537146 and parameters: {'n_steps': 64, 'batch_size_idx': 1, 'learning_rate': 0.00014856381419545768, 'n_epochs': 15, 'gamma': 0.944178224384107, 'clip_range': 0.2558576397584118, 'ent_coef': 2.219803920480839e-05, 'vf_coef': 0.598688901984433, 'max_grad_norm': 3.044322594416028, 'gae_lambda': 0.9836181712008033, 'n_layers': 3, 'layer_size': 243, 'activation_fn': 'tanh'}. Best is trial 46 with value: 302.76913511133057.
Tuning PPO: 100%|████████████████████████████████████████████████████████████████████████████████████████████████████████████████████████████████████████████████████████████████| 50/50 [8:56:50<00:00, 644.21s/it, best_value=302.77] 

Best parameters for ppo:
Best value: 302.76913511133057
  n_steps: 68
  batch_size_idx: 1
  learning_rate: 0.000344580194153308
  n_epochs: 4
  gamma: 0.9479956062170828
  clip_range: 0.13195201626331293
  ent_coef: 1.0974275204517842e-05
  vf_coef: 0.6245891170378073
  max_grad_norm: 2.4987564934099336
  gae_lambda: 0.9381761664814343
  n_layers: 3
  layer_size: 249
  activation_fn: tanh
  net_arch: [249, 249, 249]
  activation_fn: tanh
(myenv) PS C:\Users\benva\OneDrive\Documents\MATLAB\full_wrap> 