[I 2025-06-14 09:39:25,196] Trial 49 finished with value: 89.2244141290204 and parameters: {'learning_rate': 2.3931471215445666e-05, 'buffer_size': 70438, 'batch_size': 96, 'tau': 0.006016060239177655, 'gamma': 0.9189051348935606, 'policy_delay': 1, 'action_noise_sigma': 0.4061583004234537, 'target_policy_noise': 0.28838347021967914, 'target_noise_clip': 0.5188496823007173, 'n_layers': 2, 'layer_size': 221, 'activation_fn': 'tanh'}. Best is trial 19 with value: 497.88514375586203.
Tuning TD3: 100%|████████████████████████████████████████████████████████████████████████████████████████████████████████████████████████████████████████████████████████████████| 50/50 [9:35:51<00:00, 691.03s/it, best_value=497.89] 

Best parameters for td3:
Best value: 497.88514375586203
  learning_rate: 0.0003628679940906992
  buffer_size: 87109
  batch_size: 211
  tau: 0.0038994688719567227
  gamma: 0.901171035191233
  policy_delay: 2
  action_noise_sigma: 0.385735825460373
  target_policy_noise: 0.1725812902376957
  target_noise_clip: 0.601027096247111
  n_layers: 3
  layer_size: 187
  activation_fn: tanh
  net_arch: [187, 187, 187]
  activation_fn: tanh
(myenv) PS C:\Users\benva\OneDrive\Documents\MATLAB\full_wrap> 