PS C:\Users\benva\OneDrive\Documents\MATLAB> myenv\Scripts\Activate.ps1
(myenv) PS C:\Users\benva\OneDrive\Documents\MATLAB> cd .\full_wrap\
(myenv) PS C:\Users\benva\OneDrive\Documents\MATLAB\full_wrap> python .\hyperparameter_tuning.py
Starting hyperparameter tuning...

==================================================
Tuning hyperparameters for TD3...
==================================================


Tuning TD3 with 4 parallel workers
[I 2025-06-14 00:03:33,578] A new study created in memory with name: no-name-7ca45ad8-ad67-4d57-b3a2-fdddfc4c1e2e
Tuning TD3:   0%|                                                                                                                                                                                               | 0/50 [00:00<?, ?it/s]Starting MATLAB engine...
Starting MATLAB engine...
Starting MATLAB engine...
Starting MATLAB engine...
Using device: cuda
Using device: cuda
C:\Users\benva\OneDrive\Documents\MATLAB\myenv\Lib\site-packages\stable_baselines3\common\vec_env\patch_gym.py:49: UserWarning: You provided an OpenAI Gym environment. We strongly recommend transitioning to Gymnasium environments. Stable-Baselines3 is automatically wrapping your environments in a compatibility layer, which could potentially cause issues.
  warnings.warn(
Using device: cuda
Using device: cuda
Deleted temporary model file: C:\Users\benva\AppData\Local\Temp\PendCart_561c776c.slx
[I 2025-06-14 00:43:11,896] Trial 0 finished with value: 118.94138722833227 and parameters: {'learning_rate': 0.0009531916300780667, 'buffer_size': 127040, 'batch_size': 511, 'tau': 0.007702202735525895, 'gamma': 0.9428889303152354, 'policy_delay': 4, 'action_noise_sigma': 0.1020777897320515, 'target_policy_noise': 0.10477469465730704, 'target_noise_clip': 0.5635043295165336, 'n_layers': 2, 'layer_size': 64, 'activation_fn': 'relu'}. Best is trial 0 with value: 118.94138722833227.
Tuning TD3:   2%|███▏                                                                                                                                                           | 1/50 [39:38<32:22:17, 2378.32s/it, best_value=118.94]Starting MATLAB engine...
Using device: cuda
C:\Users\benva\OneDrive\Documents\MATLAB\myenv\Lib\site-packages\stable_baselines3\common\vec_env\patch_gym.py:49: UserWarning: You provided an OpenAI Gym environment. We strongly recommend transitioning to Gymnasium environments. Stable-Baselines3 is automatically wrapping your environments in a compatibility layer, which could potentially cause issues.
  warnings.warn(
Deleted temporary model file: C:\Users\benva\AppData\Local\Temp\PendCart_41f0a3e4.slx
[I 2025-06-14 00:44:05,679] Trial 3 finished with value: 17.751983440446633 and parameters: {'learning_rate': 4.198908361153436e-05, 'buffer_size': 95293, 'batch_size': 486, 'tau': 0.01455032036054844, 'gamma': 0.9529863834558269, 'policy_delay': 3, 'action_noise_sigma': 0.3087692840060601, 'target_policy_noise': 0.20498669587759868, 'target_noise_clip': 0.6631082100450579, 'n_layers': 1, 'layer_size': 203, 'activation_fn': 'leaky_relu'}. Best is trial 0 with value: 118.94138722833227.
Tuning TD3:   4%|██████▎                                                                                                                                                        | 2/50 [40:32<13:28:45, 1010.94s/it, best_value=118.94]Starting MATLAB engine...
Using device: cuda
Deleted temporary model file: C:\Users\benva\AppData\Local\Temp\PendCart_6c0fb391.slx
[I 2025-06-14 00:45:25,356] Trial 1 finished with value: 105.4188849512199 and parameters: {'learning_rate': 1.8714230386716687e-05, 'buffer_size': 52508, 'batch_size': 281, 'tau': 0.019084259889626806, 'gamma': 0.941608448191699, 'policy_delay': 1, 'action_noise_sigma': 0.29896719911741815, 'target_policy_noise': 0.43030112808690535, 'target_noise_clip': 0.33658977385601957, 'n_layers': 2, 'layer_size': 153, 'activation_fn': 'elu'}. Best is trial 0 with value: 118.94138722833227.
Tuning TD3:   6%|█████████▋                                                                                                                                                       | 3/50 [41:51<7:38:48, 585.71s/it, best_value=118.94]Starting MATLAB engine...
Using device: cuda
Deleted temporary model file: C:\Users\benva\AppData\Local\Temp\PendCart_eb7329eb.slx
[I 2025-06-14 00:51:51,777] Trial 2 finished with value: 490.03284926703645 and parameters: {'learning_rate': 0.00012567046648622813, 'buffer_size': 199627, 'batch_size': 357, 'tau': 0.0012617998752425129, 'gamma': 0.9094568561921038, 'policy_delay': 2, 'action_noise_sigma': 0.4338302553552793, 'target_policy_noise': 0.39261547272129194, 'target_noise_clip': 0.6649082926020251, 'n_layers': 2, 'layer_size': 242, 'activation_fn': 'elu'}. Best is trial 2 with value: 490.03284926703645.
Tuning TD3:   8%|████████████▉                                                                                                                                                    | 4/50 [48:18<6:28:43, 507.03s/it, best_value=490.03]Starting MATLAB engine...
Using device: cuda
Deleted temporary model file: C:\Users\benva\AppData\Local\Temp\PendCart_19e0da64.slx
[I 2025-06-14 01:27:55,572] Trial 4 finished with value: 397.7257861368098 and parameters: {'learning_rate': 0.0002329218030016842, 'buffer_size': 67869, 'batch_size': 385, 'tau': 0.012082734599694923, 'gamma': 0.9633998266717692, 'policy_delay': 1, 'action_noise_sigma': 0.4855536911520647, 'target_policy_noise': 0.32127073872471723, 'target_noise_clip': 0.30037574562916675, 'n_layers': 2, 'layer_size': 120, 'activation_fn': 'leaky_relu'}. Best is trial 2 with value: 490.03284926703645.
Tuning TD3:  10%|███████████████▋                                                                                                                                             | 5/50 [1:24:21<13:48:21, 1104.47s/it, best_value=490.03]Starting MATLAB engine...
Using device: cuda
Deleted temporary model file: C:\Users\benva\AppData\Local\Temp\PendCart_5c2d5006.slx
[I 2025-06-14 01:30:11,009] Trial 5 finished with value: 490.12145716507484 and parameters: {'learning_rate': 0.0007424670830578253, 'buffer_size': 146096, 'batch_size': 511, 'tau': 0.013231266351160998, 'gamma': 0.9420904298697835, 'policy_delay': 3, 'action_noise_sigma': 0.2564049275955024, 'target_policy_noise': 0.29737110803138256, 'target_noise_clip': 0.53962609691064, 'n_layers': 2, 'layer_size': 255, 'activation_fn': 'leaky_relu'}. Best is trial 5 with value: 490.12145716507484.
Tuning TD3:  12%|███████████████████                                                                                                                                            | 6/50 [1:26:37<9:28:19, 775.00s/it, best_value=490.12]Starting MATLAB engine...
Using device: cuda
Deleted temporary model file: C:\Users\benva\AppData\Local\Temp\PendCart_870d6c1a.slx
[I 2025-06-14 01:31:49,443] Trial 6 finished with value: 448.1069187091674 and parameters: {'learning_rate': 2.803318842288408e-05, 'buffer_size': 156105, 'batch_size': 143, 'tau': 0.015998857689195217, 'gamma': 0.9351695514658965, 'policy_delay': 4, 'action_noise_sigma': 0.28396410925640736, 'target_policy_noise': 0.15858465527168222, 'target_noise_clip': 0.30820798516562503, 'n_layers': 3, 'layer_size': 229, 'activation_fn': 'leaky_relu'}. Best is trial 5 with value: 490.12145716507484.
Tuning TD3:  14%|██████████████████████▎                                                                                                                                        | 7/50 [1:28:15<6:36:54, 553.81s/it, best_value=490.12]Starting MATLAB engine...
Using device: cuda
Deleted temporary model file: C:\Users\benva\AppData\Local\Temp\PendCart_9fe6d97a.slx
[I 2025-06-14 01:37:25,743] Trial 7 finished with value: 474.3458028570382 and parameters: {'learning_rate': 0.0004825682677110868, 'buffer_size': 106645, 'batch_size': 90, 'tau': 0.01822402724722868, 'gamma': 0.9195382208820211, 'policy_delay': 3, 'action_noise_sigma': 0.2933939006424527, 'target_policy_noise': 0.48259613660415657, 'target_noise_clip': 0.6080256007623017, 'n_layers': 3, 'layer_size': 119, 'activation_fn': 'elu'}. Best is trial 5 with value: 490.12145716507484.
Tuning TD3:  16%|█████████████████████████▍                                                                                                                                     | 8/50 [1:33:52<5:39:11, 484.57s/it, best_value=490.12]Starting MATLAB engine...
Using device: cuda
Deleted temporary model file: C:\Users\benva\AppData\Local\Temp\PendCart_22601ebb.slx
[I 2025-06-14 02:13:58,629] Trial 8 finished with value: 497.3096977756055 and parameters: {'learning_rate': 0.00046429685573950736, 'buffer_size': 133639, 'batch_size': 326, 'tau': 0.019642256794568266, 'gamma': 0.9500155212346649, 'policy_delay': 4, 'action_noise_sigma': 0.25910492239204236, 'target_policy_noise': 0.2908752489737062, 'target_noise_clip': 0.4826182489663199, 'n_layers': 3, 'layer_size': 59, 'activation_fn': 'relu'}. Best is trial 8 with value: 497.3096977756055.
Tuning TD3:  18%|████████████████████████████▎                                                                                                                                | 9/50 [2:10:25<11:36:03, 1018.61s/it, best_value=497.31]Starting MATLAB engine...
Using device: cuda
Deleted temporary model file: C:\Users\benva\AppData\Local\Temp\PendCart_684e9e5e.slx
[I 2025-06-14 02:15:09,550] Trial 9 finished with value: 464.5074354880926 and parameters: {'learning_rate': 0.0004960704011572842, 'buffer_size': 165909, 'batch_size': 137, 'tau': 0.006703508638999854, 'gamma': 0.9454011658851493, 'policy_delay': 3, 'action_noise_sigma': 0.3749117206745515, 'target_policy_noise': 0.2710592013403646, 'target_noise_clip': 0.35138884217002214, 'n_layers': 2, 'layer_size': 137, 'activation_fn': 'tanh'}. Best is trial 8 with value: 497.3096977756055.
Tuning TD3:  20%|███████████████████████████████▌                                                                                                                              | 10/50 [2:11:35<8:04:01, 726.04s/it, best_value=497.31]Starting MATLAB engine...
Using device: cuda
Deleted temporary model file: C:\Users\benva\AppData\Local\Temp\PendCart_0b01bce7.slx
[I 2025-06-14 02:17:31,945] Trial 10 finished with value: 494.1001301409565 and parameters: {'learning_rate': 0.0002573200468599372, 'buffer_size': 116643, 'batch_size': 203, 'tau': 0.010205393872537407, 'gamma': 0.9112623587364241, 'policy_delay': 2, 'action_noise_sigma': 0.2819750984674717, 'target_policy_noise': 0.20165856712133534, 'target_noise_clip': 0.5600595923500199, 'n_layers': 1, 'layer_size': 225, 'activation_fn': 'elu'}. Best is trial 8 with value: 497.3096977756055.
Tuning TD3:  22%|██████████████████████████████████▊                                                                                                                           | 11/50 [2:13:58<5:55:49, 547.42s/it, best_value=497.31]Starting MATLAB engine...
Using device: cuda
Deleted temporary model file: C:\Users\benva\AppData\Local\Temp\PendCart_ee8f037d.slx
[I 2025-06-14 02:23:51,757] Trial 11 finished with value: 461.1316485209305 and parameters: {'learning_rate': 6.211329555268307e-05, 'buffer_size': 167472, 'batch_size': 425, 'tau': 0.013100007685831996, 'gamma': 0.969710836209125, 'policy_delay': 1, 'action_noise_sigma': 0.3384803747488519, 'target_policy_noise': 0.32109563188043366, 'target_noise_clip': 0.6705887091643088, 'n_layers': 3, 'layer_size': 159, 'activation_fn': 'elu'}. Best is trial 8 with value: 497.3096977756055.
Tuning TD3:  24%|█████████████████████████████████████▉                                                                                                                        | 12/50 [2:20:18<5:14:24, 496.43s/it, best_value=497.31]Starting MATLAB engine...
Using device: cuda
Deleted temporary model file: C:\Users\benva\AppData\Local\Temp\PendCart_a59ad1a3.slx
[I 2025-06-14 02:56:37,930] Trial 12 finished with value: 303.9676637454062 and parameters: {'learning_rate': 0.0008277317355009393, 'buffer_size': 138506, 'batch_size': 287, 'tau': 0.0066292716415517735, 'gamma': 0.9734432073112561, 'policy_delay': 3, 'action_noise_sigma': 0.20422120495258156, 'target_policy_noise': 0.2525556029138484, 'target_noise_clip': 0.5254542781612599, 'n_layers': 1, 'layer_size': 215, 'activation_fn': 'relu'}. Best is trial 8 with value: 497.3096977756055.
Tuning TD3:  26%|█████████████████████████████████████████                                                                                                                     | 13/50 [2:53:04<9:40:41, 941.67s/it, best_value=497.31]Starting MATLAB engine...
Using device: cuda
Deleted temporary model file: C:\Users\benva\AppData\Local\Temp\PendCart_2fc91285.slx
[I 2025-06-14 02:58:50,065] Trial 13 finished with value: 223.35809226052328 and parameters: {'learning_rate': 8.275750582088829e-05, 'buffer_size': 189724, 'batch_size': 268, 'tau': 0.008156628633290055, 'gamma': 0.9966978993491016, 'policy_delay': 4, 'action_noise_sigma': 0.16796761275022412, 'target_policy_noise': 0.3696195823545837, 'target_noise_clip': 0.4525981198147895, 'n_layers': 3, 'layer_size': 36, 'activation_fn': 'relu'}. Best is trial 8 with value: 497.3096977756055.
Tuning TD3:  28%|████████████████████████████████████████████▏                                                                                                                 | 14/50 [2:55:16<6:58:17, 697.15s/it, best_value=497.31]Starting MATLAB engine...
Using device: cuda
Deleted temporary model file: C:\Users\benva\AppData\Local\Temp\PendCart_83ffb243.slx
[I 2025-06-14 03:05:15,015] Trial 14 finished with value: 472.5283805000813 and parameters: {'learning_rate': 0.0001978991579883752, 'buffer_size': 117968, 'batch_size': 232, 'tau': 0.009133656191021413, 'gamma': 0.9921120818414719, 'policy_delay': 2, 'action_noise_sigma': 0.1797298088467022, 'target_policy_noise': 0.22897961506891912, 'target_noise_clip': 0.4407205702137593, 'n_layers': 1, 'layer_size': 56, 'activation_fn': 'relu'}. Best is trial 8 with value: 497.3096977756055.
Tuning TD3:  30%|███████████████████████████████████████████████▍                                                                                                              | 15/50 [3:01:41<5:51:46, 603.04s/it, best_value=497.31]Starting MATLAB engine...
Using device: cuda
Deleted temporary model file: C:\Users\benva\AppData\Local\Temp\PendCart_b49b77aa.slx
[I 2025-06-14 03:11:38,829] Trial 15 finished with value: 433.5991145644713 and parameters: {'learning_rate': 0.0002037071597480834, 'buffer_size': 118473, 'batch_size': 257, 'tau': 0.008539342481418962, 'gamma': 0.9949685162198393, 'policy_delay': 2, 'action_noise_sigma': 0.18981995339466362, 'target_policy_noise': 0.2393595758450474, 'target_noise_clip': 0.44636565267912426, 'n_layers': 1, 'layer_size': 54, 'activation_fn': 'relu'}. Best is trial 8 with value: 497.3096977756055.
Tuning TD3:  32%|██████████████████████████████████████████████████▌                                                                                                           | 16/50 [3:08:05<5:04:19, 537.05s/it, best_value=497.31]Starting MATLAB engine...
Using device: cuda
Deleted temporary model file: C:\Users\benva\AppData\Local\Temp\PendCart_33513d8c.slx
[I 2025-06-14 03:43:49,088] Trial 16 finished with value: 421.8776872420027 and parameters: {'learning_rate': 0.0001835215910432004, 'buffer_size': 98762, 'batch_size': 202, 'tau': 0.009295901343692264, 'gamma': 0.9982804063867157, 'policy_delay': 2, 'action_noise_sigma': 0.20482558409862686, 'target_policy_noise': 0.20434830211153487, 'target_noise_clip': 0.4303400772466524, 'n_layers': 1, 'layer_size': 48, 'activation_fn': 'relu'}. Best is trial 8 with value: 497.3096977756055.
Tuning TD3:  34%|█████████████████████████████████████████████████████▋                                                                                                        | 17/50 [3:40:15<8:45:47, 955.99s/it, best_value=497.31]Starting MATLAB engine...
Using device: cuda
Deleted temporary model file: C:\Users\benva\AppData\Local\Temp\PendCart_b3a1aa48.slx
[I 2025-06-14 03:44:28,429] Trial 17 finished with value: 347.64595487665724 and parameters: {'learning_rate': 0.00021586868931560118, 'buffer_size': 113275, 'batch_size': 233, 'tau': 0.010103321817902855, 'gamma': 0.9228238077544657, 'policy_delay': 2, 'action_noise_sigma': 0.22526347928490106, 'target_policy_noise': 0.206925291130005, 'target_noise_clip': 0.4480460494509484, 'n_layers': 1, 'layer_size': 91, 'activation_fn': 'tanh'}. Best is trial 8 with value: 497.3096977756055.
Tuning TD3:  36%|████████████████████████████████████████████████████████▉                                                                                                     | 18/50 [3:40:54<6:02:57, 680.55s/it, best_value=497.31]Starting MATLAB engine...
Using device: cuda
Deleted temporary model file: C:\Users\benva\AppData\Local\Temp\PendCart_f608cb8c.slx
[I 2025-06-14 03:51:35,809] Trial 18 finished with value: 479.2562930531737 and parameters: {'learning_rate': 0.00024248995924000432, 'buffer_size': 89138, 'batch_size': 210, 'tau': 0.0028809432635791337, 'gamma': 0.9015597269795367, 'policy_delay': 2, 'action_noise_sigma': 0.23142539022251188, 'target_policy_noise': 0.18063351306836165, 'target_noise_clip': 0.4622835669350364, 'n_layers': 1, 'layer_size': 88, 'activation_fn': 'tanh'}. Best is trial 8 with value: 497.3096977756055.
Tuning TD3:  38%|████████████████████████████████████████████████████████████                                                                                                  | 19/50 [3:48:02<5:12:19, 604.51s/it, best_value=497.31]Starting MATLAB engine...
Using device: cuda
Deleted temporary model file: C:\Users\benva\AppData\Local\Temp\PendCart_56ed9e93.slx
[I 2025-06-14 03:57:45,853] Trial 19 finished with value: 497.88514375586203 and parameters: {'learning_rate': 0.0003628679940906992, 'buffer_size': 87109, 'batch_size': 211, 'tau': 0.0038994688719567227, 'gamma': 0.901171035191233, 'policy_delay': 2, 'action_noise_sigma': 0.385735825460373, 'target_policy_noise': 0.1725812902376957, 'target_noise_clip': 0.601027096247111, 'n_layers': 3, 'layer_size': 187, 'activation_fn': 'tanh'}. Best is trial 19 with value: 497.88514375586203.
Tuning TD3:  40%|███████████████████████████████████████████████████████████████▏                                                                                              | 20/50 [3:54:12<4:27:03, 534.12s/it, best_value=497.89]Starting MATLAB engine...
Using device: cuda
Deleted temporary model file: C:\Users\benva\AppData\Local\Temp\PendCart_234b73c5.slx
[I 2025-06-14 04:29:57,583] Trial 21 finished with value: 465.4834784642334 and parameters: {'learning_rate': 0.000384725716781245, 'buffer_size': 87113, 'batch_size': 342, 'tau': 0.0033518128643982657, 'gamma': 0.9244793975139853, 'policy_delay': 4, 'action_noise_sigma': 0.3838063943424809, 'target_policy_noise': 0.14849308903778297, 'target_noise_clip': 0.5898935473916783, 'n_layers': 3, 'layer_size': 185, 'activation_fn': 'elu'}. Best is trial 19 with value: 497.88514375586203.
Tuning TD3:  42%|██████████████████████████████████████████████████████████████████▎                                                                                           | 21/50 [4:26:24<7:40:55, 953.63s/it, best_value=497.89]Starting MATLAB engine...
Deleted temporary model file: C:\Users\benva\AppData\Local\Temp\PendCart_6182c8c3.slx
[I 2025-06-14 04:29:57,807] Trial 20 finished with value: 478.48043223270736 and parameters: {'learning_rate': 0.00036967440441698694, 'buffer_size': 75765, 'batch_size': 348, 'tau': 0.003610637897924064, 'gamma': 0.9274185293290722, 'policy_delay': 4, 'action_noise_sigma': 0.3622423126949032, 'target_policy_noise': 0.14944415577251913, 'target_noise_clip': 0.5943542447620154, 'n_layers': 3, 'layer_size': 181, 'activation_fn': 'tanh'}. Best is trial 19 with value: 497.88514375586203.
Tuning TD3:  44%|█████████████████████████████████████████████████████████████████████▌                                                                                        | 22/50 [4:26:24<5:11:29, 667.50s/it, best_value=497.89]Starting MATLAB engine...
Using device: cuda
Using device: cuda
Deleted temporary model file: C:\Users\benva\AppData\Local\Temp\PendCart_aed6255e.slx
[I 2025-06-14 04:35:35,961] Trial 22 finished with value: 398.7106721927444 and parameters: {'learning_rate': 0.00045707386959027225, 'buffer_size': 83809, 'batch_size': 335, 'tau': 0.016804941788120486, 'gamma': 0.9266689574782777, 'policy_delay': 4, 'action_noise_sigma': 0.36675773767188896, 'target_policy_noise': 0.11730963635844854, 'target_noise_clip': 0.6032863518050323, 'n_layers': 3, 'layer_size': 183, 'activation_fn': 'elu'}. Best is trial 19 with value: 497.88514375586203.
Tuning TD3:  46%|████████████████████████████████████████████████████████████████████████▋                                                                                     | 23/50 [4:32:02<4:15:54, 568.67s/it, best_value=497.89]Starting MATLAB engine...
Using device: cuda
Deleted temporary model file: C:\Users\benva\AppData\Local\Temp\PendCart_c7fe5a16.slx
