PS C:\Users\benva\OneDrive\Documents\MATLAB> myenv\Scripts\Activate.ps1
(myenv) PS C:\Users\benva\OneDrive\Documents\MATLAB> cd .\full_wrap\
(myenv) PS C:\Users\benva\OneDrive\Documents\MATLAB\full_wrap> python .\hyperparameter_tuning.py
Starting hyperparameter tuning...

==================================================
Tuning hyperparameters for DDPG...
==================================================


Tuning DDPG with 6 parallel workers
[I 2025-06-16 23:27:02,195] A new study created in memory with name: no-name-05d7af65-1bb7-4203-b566-5d01a2bf048e
Starting MATLAB engine...
Starting MATLAB engine...
Starting MATLAB engine...
Starting MATLAB engine...
Starting MATLAB engine...
Starting MATLAB engine...
Using device: cuda
Using device: cuda
Using device: cuda
Using device: cuda
C:\Users\benva\OneDrive\Documents\MATLAB\myenv\Lib\site-packages\stable_baselines3\common\vec_env\patch_gym.py:49: UserWarning: You provided an OpenAI Gym environment. We strongly recommend transitioning to Gymnasium environments. Stable-Baselines3 is automatically wrapping your environments in a compatibility layer, which could potentially cause issues.
  warnings.warn(
Using device: cuda
Using device: cuda
Deleted temporary model file: C:\Users\benva\AppData\Local\Temp\PendCart_5198bb24.slx
Deleted: C:\Users\benva\OneDrive\Documents\MATLAB\full_wrap\PendCart_5198bb24.slxc
[I 2025-06-17 01:19:59,171] Trial 2 finished with value: 352.81379143706516 and parameters: {'learning_rate': 7.56292838676151e-05, 'buffer_size': 168179, 'batch_size': 286, 'tau': 0.019321386124916986, 'gamma': 0.9064360970221088, 'action_noise_sigma': 0.26340214724337907, 'n_layers': 2, 'layer_size': 128, 'activation_fn': 'leaky_relu'}. Best is trial 2 with value: 352.81379143706516.
Starting MATLAB engine...
Using device: cuda
C:\Users\benva\OneDrive\Documents\MATLAB\myenv\Lib\site-packages\stable_baselines3\common\vec_env\patch_gym.py:49: UserWarning: You provided an OpenAI Gym environment. We strongly recommend transitioning to Gymnasium environments. Stable-Baselines3 is automatically wrapping your environments in a compatibility layer, which could potentially cause issues.
  warnings.warn(
Deleted temporary model file: C:\Users\benva\AppData\Local\Temp\PendCart_3b85decb.slx
Deleted: C:\Users\benva\OneDrive\Documents\MATLAB\full_wrap\PendCart_3b85decb.slxc
[I 2025-06-17 01:26:07,174] Trial 5 finished with value: 384.67126985870857 and parameters: {'learning_rate': 0.0001154361148762338, 'buffer_size': 129943, 'batch_size': 485, 'tau': 0.014289915073416, 'gamma': 0.967031194650367, 'action_noise_sigma': 0.35295732677872593, 'n_layers': 1, 'layer_size': 111, 'activation_fn': 'tanh'}. Best is trial 5 with value: 384.67126985870857.
Starting MATLAB engine...
Using device: cuda
Deleted temporary model file: C:\Users\benva\AppData\Local\Temp\PendCart_9e671e46.slx
Deleted: C:\Users\benva\OneDrive\Documents\MATLAB\full_wrap\PendCart_9e671e46.slxc
[I 2025-06-17 01:28:19,752] Trial 3 finished with value: 434.0816651684645 and parameters: {'learning_rate': 0.00018554359149394013, 'buffer_size': 69368, 'batch_size': 136, 'tau': 0.012083803237040204, 'gamma': 0.9238979520608903, 'action_noise_sigma': 0.19858087617601858, 'n_layers': 1, 'layer_size': 128, 'activation_fn': 'relu'}. Best is trial 3 with value: 434.0816651684645.
Starting MATLAB engine...
Using device: cuda
Deleted temporary model file: C:\Users\benva\AppData\Local\Temp\PendCart_e1a39e31.slx
Deleted: C:\Users\benva\OneDrive\Documents\MATLAB\full_wrap\PendCart_e1a39e31.slxc
[I 2025-06-17 01:29:10,593] Trial 1 finished with value: 421.9537544248721 and parameters: {'learning_rate': 0.00023347919666192517, 'buffer_size': 185086, 'batch_size': 509, 'tau': 0.008001605574842974, 'gamma': 0.9918442302306201, 'action_noise_sigma': 0.30122323435281795, 'n_layers': 1, 'layer_size': 108, 'activation_fn': 'elu'}. Best is trial 3 with value: 434.0816651684645.
Starting MATLAB engine...
Using device: cuda
Deleted temporary model file: C:\Users\benva\AppData\Local\Temp\PendCart_5cfe6cee.slx
Deleted: C:\Users\benva\OneDrive\Documents\MATLAB\full_wrap\PendCart_5cfe6cee.slxc
[I 2025-06-17 01:30:10,557] Trial 0 finished with value: 493.0677263491769 and parameters: {'learning_rate': 7.557925791722932e-05, 'buffer_size': 185715, 'batch_size': 125, 'tau': 0.01910624646484046, 'gamma': 0.9049917764832579, 'action_noise_sigma': 0.29146850155737913, 'n_layers': 3, 'layer_size': 158, 'activation_fn': 'relu'}. Best is trial 0 with value: 493.0677263491769.
Starting MATLAB engine...
Using device: cuda
Deleted temporary model file: C:\Users\benva\AppData\Local\Temp\PendCart_ec959e98.slx
Deleted: C:\Users\benva\OneDrive\Documents\MATLAB\full_wrap\PendCart_ec959e98.slxc
[I 2025-06-17 01:31:22,376] Trial 4 finished with value: 484.32723599552673 and parameters: {'learning_rate': 0.00031658429484999914, 'buffer_size': 146384, 'batch_size': 150, 'tau': 0.0018250823917122308, 'gamma': 0.9532505079404183, 'action_noise_sigma': 0.2171711510422926, 'n_layers': 2, 'layer_size': 64, 'activation_fn': 'leaky_relu'}. Best is trial 0 with value: 493.0677263491769.
Starting MATLAB engine...
Using device: cuda
Deleted temporary model file: C:\Users\benva\AppData\Local\Temp\PendCart_ab407863.slx
Deleted: C:\Users\benva\OneDrive\Documents\MATLAB\full_wrap\PendCart_ab407863.slxc
[I 2025-06-17 02:56:51,313] Trial 6 finished with value: 23.803949253130966 and parameters: {'learning_rate': 1.918762424539135e-05, 'buffer_size': 115737, 'batch_size': 337, 'tau': 0.007913447933299459, 'gamma': 0.916204707996197, 'action_noise_sigma': 0.21376604897430804, 'n_layers': 1, 'layer_size': 160, 'activation_fn': 'elu'}. Best is trial 0 with value: 493.0677263491769.
Starting MATLAB engine...
Using device: cuda
Deleted temporary model file: C:\Users\benva\AppData\Local\Temp\PendCart_4b130e64.slx
Deleted: C:\Users\benva\OneDrive\Documents\MATLAB\full_wrap\PendCart_4b130e64.slxc
[I 2025-06-17 03:22:39,436] Trial 7 finished with value: 401.96372020844603 and parameters: {'learning_rate': 8.433587351773491e-05, 'buffer_size': 180078, 'batch_size': 213, 'tau': 0.017511778635727084, 'gamma': 0.9529374360533209, 'action_noise_sigma': 0.10883554646012046, 'n_layers': 2, 'layer_size': 250, 'activation_fn': 'leaky_relu'}. Best is trial 0 with value: 493.0677263491769.
Starting MATLAB engine...
Using device: cuda
Deleted temporary model file: C:\Users\benva\AppData\Local\Temp\PendCart_5a1590ca.slx
Deleted: C:\Users\benva\OneDrive\Documents\MATLAB\full_wrap\PendCart_5a1590ca.slxc
[I 2025-06-17 03:25:42,023] Trial 9 finished with value: 395.46357547722937 and parameters: {'learning_rate': 0.00014929259032924632, 'buffer_size': 109271, 'batch_size': 193, 'tau': 0.005534007481444038, 'gamma': 0.9597577065745131, 'action_noise_sigma': 0.2800197019772017, 'n_layers': 3, 'layer_size': 177, 'activation_fn': 'relu'}. Best is trial 0 with value: 493.0677263491769.
Starting MATLAB engine...
Using device: cuda
Deleted temporary model file: C:\Users\benva\AppData\Local\Temp\PendCart_dfbdff13.slx
Deleted: C:\Users\benva\OneDrive\Documents\MATLAB\full_wrap\PendCart_dfbdff13.slxc
[I 2025-06-17 03:32:22,797] Trial 8 finished with value: 473.60422077107006 and parameters: {'learning_rate': 4.611070487635088e-05, 'buffer_size': 160901, 'batch_size': 456, 'tau': 0.013038731197417382, 'gamma': 0.9818433812877562, 'action_noise_sigma': 0.20802361380232412, 'n_layers': 3, 'layer_size': 199, 'activation_fn': 'elu'}. Best is trial 0 with value: 493.0677263491769.
Starting MATLAB engine...
Using device: cuda
Deleted temporary model file: C:\Users\benva\AppData\Local\Temp\PendCart_cb5edfd9.slx
Deleted: C:\Users\benva\OneDrive\Documents\MATLAB\full_wrap\PendCart_cb5edfd9.slxc
[I 2025-06-17 03:33:35,197] Trial 10 finished with value: 491.25428986813824 and parameters: {'learning_rate': 0.00043423043343758787, 'buffer_size': 145248, 'batch_size': 466, 'tau': 0.019440572428230104, 'gamma': 0.962583633040792, 'action_noise_sigma': 0.4851201004108626, 'n_layers': 1, 'layer_size': 228, 'activation_fn': 'leaky_relu'}. Best is trial 0 with value: 493.0677263491769.
Starting MATLAB engine...
Using device: cuda
Deleted temporary model file: C:\Users\benva\AppData\Local\Temp\PendCart_bad34c5a.slx
Deleted: C:\Users\benva\OneDrive\Documents\MATLAB\full_wrap\PendCart_bad34c5a.slxc
[I 2025-06-17 03:35:47,402] Trial 11 finished with value: 486.93599908234035 and parameters: {'learning_rate': 0.0001314338119064175, 'buffer_size': 97318, 'batch_size': 463, 'tau': 0.003096344468803558, 'gamma': 0.9054823973043726, 'action_noise_sigma': 0.34008475828600127, 'n_layers': 3, 'layer_size': 150, 'activation_fn': 'tanh'}. Best is trial 0 with value: 493.0677263491769.
Starting MATLAB engine...
Using device: cuda
Deleted temporary model file: C:\Users\benva\AppData\Local\Temp\PendCart_4f0c641a.slx
Deleted: C:\Users\benva\OneDrive\Documents\MATLAB\full_wrap\PendCart_4f0c641a.slxc
[I 2025-06-17 04:35:41,645] Trial 12 finished with value: 13.874663642787393 and parameters: {'learning_rate': 1.1970577961911188e-05, 'buffer_size': 154217, 'batch_size': 152, 'tau': 0.013102438332242047, 'gamma': 0.9946607415958981, 'action_noise_sigma': 0.2953098660335072, 'n_layers': 1, 'layer_size': 205, 'activation_fn': 'tanh'}. Best is trial 0 with value: 493.0677263491769.
Starting MATLAB engine...
Using device: cuda
Deleted temporary model file: C:\Users\benva\AppData\Local\Temp\PendCart_0d561841.slx
Deleted: C:\Users\benva\OneDrive\Documents\MATLAB\full_wrap\PendCart_0d561841.slxc
[I 2025-06-17 05:01:48,101] Trial 13 finished with value: 12.180360749627813 and parameters: {'learning_rate': 1.12191474677205e-05, 'buffer_size': 191403, 'batch_size': 421, 'tau': 0.002960855527713321, 'gamma': 0.966149182708793, 'action_noise_sigma': 0.10277641460077845, 'n_layers': 1, 'layer_size': 156, 'activation_fn': 'relu'}. Best is trial 0 with value: 493.0677263491769.
Starting MATLAB engine...
Using device: cuda
Deleted temporary model file: C:\Users\benva\AppData\Local\Temp\PendCart_2ed225e9.slx
Deleted: C:\Users\benva\OneDrive\Documents\MATLAB\full_wrap\PendCart_2ed225e9.slxc
[I 2025-06-17 05:14:46,707] Trial 17 finished with value: 11.920912940681468 and parameters: {'learning_rate': 0.0009183361930251585, 'buffer_size': 136163, 'batch_size': 80, 'tau': 0.016450723806049106, 'gamma': 0.9332411048355175, 'action_noise_sigma': 0.4770223402283577, 'n_layers': 3, 'layer_size': 225, 'activation_fn': 'relu'}. Best is trial 0 with value: 493.0677263491769.
Starting MATLAB engine...
Using device: cuda
Deleted temporary model file: C:\Users\benva\AppData\Local\Temp\PendCart_e615a232.slx
Deleted: C:\Users\benva\OneDrive\Documents\MATLAB\full_wrap\PendCart_e615a232.slxc
[I 2025-06-17 05:30:29,172] Trial 15 finished with value: 302.2375145970035 and parameters: {'learning_rate': 0.0008214478585181921, 'buffer_size': 195985, 'batch_size': 64, 'tau': 0.016702637957916676, 'gamma': 0.9310429916712962, 'action_noise_sigma': 0.49722392827957573, 'n_layers': 3, 'layer_size': 48, 'activation_fn': 'relu'}. Best is trial 0 with value: 493.0677263491769.
Starting MATLAB engine...
Using device: cuda
Deleted temporary model file: C:\Users\benva\AppData\Local\Temp\PendCart_40adaa46.slx
Deleted: C:\Users\benva\OneDrive\Documents\MATLAB\full_wrap\PendCart_40adaa46.slxc
[I 2025-06-17 05:33:24,939] Trial 14 finished with value: 496.22926804054003 and parameters: {'learning_rate': 6.97385681750532e-05, 'buffer_size': 163094, 'batch_size': 353, 'tau': 0.01622997858093718, 'gamma': 0.9398102505966908, 'action_noise_sigma': 0.26505870604351767, 'n_layers': 3, 'layer_size': 185, 'activation_fn': 'relu'}. Best is trial 14 with value: 496.22926804054003.
Starting MATLAB engine...
Using device: cuda
Deleted temporary model file: C:\Users\benva\AppData\Local\Temp\PendCart_6d152ba5.slx
Deleted: C:\Users\benva\OneDrive\Documents\MATLAB\full_wrap\PendCart_6d152ba5.slxc
[I 2025-06-17 05:45:45,298] Trial 16 finished with value: 479.0903703439525 and parameters: {'learning_rate': 0.0007455816111831341, 'buffer_size': 195762, 'batch_size': 377, 'tau': 0.01649252166647753, 'gamma': 0.9326454760627668, 'action_noise_sigma': 0.4967990815479052, 'n_layers': 3, 'layer_size': 234, 'activation_fn': 'relu'}. Best is trial 14 with value: 496.22926804054003.
Starting MATLAB engine...
Using device: cuda
Deleted temporary model file: C:\Users\benva\AppData\Local\Temp\PendCart_ff146b94.slx
Deleted: C:\Users\benva\OneDrive\Documents\MATLAB\full_wrap\PendCart_ff146b94.slxc
[I 2025-06-17 06:15:03,045] Trial 18 finished with value: 12.689219332267465 and parameters: {'learning_rate': 0.000964687995059102, 'buffer_size': 187703, 'batch_size': 369, 'tau': 0.01679082809028342, 'gamma': 0.9331891001805633, 'action_noise_sigma': 0.4795014527392689, 'n_layers': 3, 'layer_size': 254, 'activation_fn': 'relu'}. Best is trial 14 with value: 496.22926804054003.
Starting MATLAB engine...
Using device: cuda
Deleted temporary model file: C:\Users\benva\AppData\Local\Temp\PendCart_6c6c39d7.slx
Deleted: C:\Users\benva\OneDrive\Documents\MATLAB\full_wrap\PendCart_6c6c39d7.slxc
[I 2025-06-17 06:55:27,191] Trial 19 finished with value: 257.5901043021263 and parameters: {'learning_rate': 0.0009314857714922214, 'buffer_size': 144323, 'batch_size': 366, 'tau': 0.016465754815397148, 'gamma': 0.9419829757494219, 'action_noise_sigma': 0.4854066779443769, 'n_layers': 2, 'layer_size': 256, 'activation_fn': 'leaky_relu'}. Best is trial 14 with value: 496.22926804054003.
Starting MATLAB engine...
Using device: cuda
Deleted temporary model file: C:\Users\benva\AppData\Local\Temp\PendCart_d78d41d0.slx
Deleted: C:\Users\benva\OneDrive\Documents\MATLAB\full_wrap\PendCart_d78d41d0.slxc
[I 2025-06-17 07:14:01,705] Trial 22 finished with value: 168.50519012239607 and parameters: {'learning_rate': 5.1524114763991994e-05, 'buffer_size': 172025, 'batch_size': 362, 'tau': 0.01463871555071895, 'gamma': 0.9401929758246912, 'action_noise_sigma': 0.40683118923879746, 'n_layers': 3, 'layer_size': 187, 'activation_fn': 'relu'}. Best is trial 14 with value: 496.22926804054003.
Starting MATLAB engine...
Using device: cuda
Deleted temporary model file: C:\Users\benva\AppData\Local\Temp\PendCart_14c64747.slx
Deleted: C:\Users\benva\OneDrive\Documents\MATLAB\full_wrap\PendCart_14c64747.slxc
[I 2025-06-17 07:14:30,751] Trial 20 finished with value: 416.62275476620323 and parameters: {'learning_rate': 0.0005478493054263612, 'buffer_size': 199152, 'batch_size': 371, 'tau': 0.019719514551817488, 'gamma': 0.943309629039468, 'action_noise_sigma': 0.4801566629863876, 'n_layers': 2, 'layer_size': 255, 'activation_fn': 'leaky_relu'}. Best is trial 14 with value: 496.22926804054003.
Starting MATLAB engine...
Using device: cuda
Deleted temporary model file: C:\Users\benva\AppData\Local\Temp\PendCart_d4eb1709.slx
Deleted: C:\Users\benva\OneDrive\Documents\MATLAB\full_wrap\PendCart_d4eb1709.slxc
[I 2025-06-17 07:23:22,808] Trial 23 finished with value: 11.104627725069017 and parameters: {'learning_rate': 4.249464862033183e-05, 'buffer_size': 172164, 'batch_size': 273, 'tau': 0.010086085878128448, 'gamma': 0.941939645867932, 'action_noise_sigma': 0.42210319635146054, 'n_layers': 2, 'layer_size': 184, 'activation_fn': 'relu'}. Best is trial 14 with value: 496.22926804054003.
Starting MATLAB engine...
Using device: cuda
Deleted temporary model file: C:\Users\benva\AppData\Local\Temp\PendCart_588df0c5.slx
Deleted: C:\Users\benva\OneDrive\Documents\MATLAB\full_wrap\PendCart_588df0c5.slxc
[I 2025-06-17 07:31:38,797] Trial 21 finished with value: 398.17586601739515 and parameters: {'learning_rate': 0.00046517250653380657, 'buffer_size': 50075, 'batch_size': 374, 'tau': 0.019983609098884733, 'gamma': 0.9399528007669475, 'action_noise_sigma': 0.42862423398302385, 'n_layers': 2, 'layer_size': 245, 'activation_fn': 'leaky_relu'}. Best is trial 14 with value: 496.22926804054003.
Starting MATLAB engine...
Using device: cuda
Deleted temporary model file: C:\Users\benva\AppData\Local\Temp\PendCart_d6698fe1.slx
Deleted: C:\Users\benva\OneDrive\Documents\MATLAB\full_wrap\PendCart_d6698fe1.slxc
[I 2025-06-17 08:20:17,129] Trial 24 finished with value: 296.6133586944621 and parameters: {'learning_rate': 4.068612775955598e-05, 'buffer_size': 166508, 'batch_size': 223, 'tau': 0.009686199920551251, 'gamma': 0.9423843205891111, 'action_noise_sigma': 0.3959869763544768, 'n_layers': 2, 'layer_size': 189, 'activation_fn': 'relu'}. Best is trial 14 with value: 496.22926804054003.
Starting MATLAB engine...
Using device: cuda
Deleted temporary model file: C:\Users\benva\AppData\Local\Temp\PendCart_e9938066.slx
Deleted: C:\Users\benva\OneDrive\Documents\MATLAB\full_wrap\PendCart_e9938066.slxc
[I 2025-06-17 08:32:17,241] Trial 25 finished with value: 71.45406645675413 and parameters: {'learning_rate': 3.1128261904146805e-05, 'buffer_size': 166420, 'batch_size': 268, 'tau': 0.010131689084782788, 'gamma': 0.9159255752159235, 'action_noise_sigma': 0.3752722660016931, 'n_layers': 2, 'layer_size': 176, 'activation_fn': 'relu'}. Best is trial 14 with value: 496.22926804054003.
Starting MATLAB engine...
Using device: cuda
Deleted temporary model file: C:\Users\benva\AppData\Local\Temp\PendCart_752c518e.slx
Deleted: C:\Users\benva\OneDrive\Documents\MATLAB\full_wrap\PendCart_752c518e.slxc
[I 2025-06-17 09:13:20,475] Trial 29 finished with value: 135.5499869964563 and parameters: {'learning_rate': 2.5940951251639967e-05, 'buffer_size': 156049, 'batch_size': 245, 'tau': 0.018361232002827844, 'gamma': 0.9760370283055797, 'action_noise_sigma': 0.35267332852475863, 'n_layers': 3, 'layer_size': 217, 'activation_fn': 'relu'}. Best is trial 14 with value: 496.22926804054003.
Starting MATLAB engine...
Using device: cuda
Deleted temporary model file: C:\Users\benva\AppData\Local\Temp\PendCart_99ea921f.slx
Deleted: C:\Users\benva\OneDrive\Documents\MATLAB\full_wrap\PendCart_99ea921f.slxc
[I 2025-06-17 09:20:55,572] Trial 27 finished with value: 496.1546126541304 and parameters: {'learning_rate': 3.3299295113628326e-05, 'buffer_size': 158202, 'batch_size': 277, 'tau': 0.01924801073967954, 'gamma': 0.9759583564498745, 'action_noise_sigma': 0.40955850545531647, 'n_layers': 2, 'layer_size': 213, 'activation_fn': 'leaky_relu'}. Best is trial 14 with value: 496.22926804054003.
Starting MATLAB engine...
Using device: cuda
Deleted temporary model file: C:\Users\benva\AppData\Local\Temp\PendCart_f042e94c.slx
Deleted: C:\Users\benva\OneDrive\Documents\MATLAB\full_wrap\PendCart_f042e94c.slxc
[I 2025-06-17 09:22:07,773] Trial 26 finished with value: 447.8282939748081 and parameters: {'learning_rate': 3.0491688114904694e-05, 'buffer_size': 170470, 'batch_size': 293, 'tau': 0.01945671857447983, 'gamma': 0.9770224523577172, 'action_noise_sigma': 0.4120759919400425, 'n_layers': 2, 'layer_size': 220, 'activation_fn': 'leaky_relu'}. Best is trial 14 with value: 496.22926804054003.
Starting MATLAB engine...
Using device: cuda
Deleted temporary model file: C:\Users\benva\AppData\Local\Temp\PendCart_c50319f4.slx
Deleted: C:\Users\benva\OneDrive\Documents\MATLAB\full_wrap\PendCart_c50319f4.slxc
[I 2025-06-17 09:24:06,437] Trial 28 finished with value: 412.6668958599781 and parameters: {'learning_rate': 2.4602465740028245e-05, 'buffer_size': 155768, 'batch_size': 243, 'tau': 0.01867653710285154, 'gamma': 0.9773563687878233, 'action_noise_sigma': 0.3580479112615793, 'n_layers': 3, 'layer_size': 214, 'activation_fn': 'leaky_relu'}. Best is trial 14 with value: 496.22926804054003.
Starting MATLAB engine...
Using device: cuda
Deleted temporary model file: C:\Users\benva\AppData\Local\Temp\PendCart_f9cbfee2.slx
Deleted: C:\Users\benva\OneDrive\Documents\MATLAB\full_wrap\PendCart_f9cbfee2.slxc
[I 2025-06-17 10:21:22,110] Trial 30 finished with value: 415.19810855252115 and parameters: {'learning_rate': 2.7642666234037188e-05, 'buffer_size': 154846, 'batch_size': 320, 'tau': 0.018403950325471662, 'gamma': 0.9786340737965433, 'action_noise_sigma': 0.25208845246162914, 'n_layers': 3, 'layer_size': 221, 'activation_fn': 'leaky_relu'}. Best is trial 14 with value: 496.22926804054003.
Starting MATLAB engine...
Using device: cuda
Deleted temporary model file: C:\Users\benva\AppData\Local\Temp\PendCart_09475937.slx
Deleted: C:\Users\benva\OneDrive\Documents\MATLAB\full_wrap\PendCart_09475937.slxc
[I 2025-06-17 10:36:43,180] Trial 31 finished with value: 483.5037163726346 and parameters: {'learning_rate': 7.09041748011319e-05, 'buffer_size': 152466, 'batch_size': 317, 'tau': 0.01803530443021691, 'gamma': 0.9733884002437082, 'action_noise_sigma': 0.25349437724180124, 'n_layers': 3, 'layer_size': 216, 'activation_fn': 'leaky_relu'}. Best is trial 14 with value: 496.22926804054003.
Starting MATLAB engine...
Using device: cuda
Deleted temporary model file: C:\Users\benva\AppData\Local\Temp\PendCart_f8e92fd2.slx
Deleted: C:\Users\benva\OneDrive\Documents\MATLAB\full_wrap\PendCart_f8e92fd2.slxc
[I 2025-06-17 10:53:06,415] Trial 32 finished with value: 14.520252384936787 and parameters: {'learning_rate': 6.421320196371607e-05, 'buffer_size': 118794, 'batch_size': 323, 'tau': 0.01836081617029949, 'gamma': 0.9803063152214779, 'action_noise_sigma': 0.24561037841592914, 'n_layers': 3, 'layer_size': 215, 'activation_fn': 'leaky_relu'}. Best is trial 14 with value: 496.22926804054003.
Starting MATLAB engine...
Using device: cuda
Deleted temporary model file: C:\Users\benva\AppData\Local\Temp\PendCart_16d4bdfb.slx
Deleted: C:\Users\benva\OneDrive\Documents\MATLAB\full_wrap\PendCart_16d4bdfb.slxc
