[I 2025-06-17 11:03:16,121] Trial 35 finished with value: 12.97981322409041 and parameters: {'learning_rate': 6.449614174346488e-05, 'buffer_size': 184581, 'batch_size': 109, 'tau': 0.015074088746530323, 'gamma': 0.9880037993527442, 'action_noise_sigma': 0.24836745506476596, 'n_layers': 3, 'layer_size': 78, 'activation_fn': 'elu'}. Best is trial 14 with value: 496.22926804054003.
Starting MATLAB engine...
Using device: cuda
Deleted temporary model file: C:\Users\benva\AppData\Local\Temp\PendCart_a0dbfbc7.slx
Deleted: C:\Users\benva\OneDrive\Documents\MATLAB\full_wrap\PendCart_a0dbfbc7.slxc
[I 2025-06-17 11:22:50,221] Trial 33 finished with value: 447.3610470088599 and parameters: {'learning_rate': 6.303434621857125e-05, 'buffer_size': 178270, 'batch_size': 333, 'tau': 0.014967938203339588, 'gamma': 0.9750166122346127, 'action_noise_sigma': 0.24276114662406625, 'n_layers': 3, 'layer_size': 209, 'activation_fn': 'elu'}. Best is trial 14 with value: 496.22926804054003.
Starting MATLAB engine...
Using device: cuda
Deleted temporary model file: C:\Users\benva\AppData\Local\Temp\PendCart_82b95c71.slx
Deleted: C:\Users\benva\OneDrive\Documents\MATLAB\full_wrap\PendCart_82b95c71.slxc
[I 2025-06-17 11:27:59,760] Trial 34 finished with value: 470.75170509251836 and parameters: {'learning_rate': 6.663959238793274e-05, 'buffer_size': 179167, 'batch_size': 105, 'tau': 0.014975611152696112, 'gamma': 0.9895624350385065, 'action_noise_sigma': 0.2465335109199277, 'n_layers': 3, 'layer_size': 95, 'activation_fn': 'elu'}. Best is trial 14 with value: 496.22926804054003.
Starting MATLAB engine...
Using device: cuda
Deleted temporary model file: C:\Users\benva\AppData\Local\Temp\PendCart_749e430b.slx
Deleted: C:\Users\benva\OneDrive\Documents\MATLAB\full_wrap\PendCart_749e430b.slxc
[I 2025-06-17 12:11:54,540] Trial 37 finished with value: 51.39863855565845 and parameters: {'learning_rate': 5.551390287776084e-05, 'buffer_size': 178445, 'batch_size': 510, 'tau': 0.014847883318501499, 'gamma': 0.9883868726151361, 'action_noise_sigma': 0.3138749080191966, 'n_layers': 1, 'layer_size': 170, 'activation_fn': 'elu'}. Best is trial 14 with value: 496.22926804054003.
Starting MATLAB engine...
Using device: cuda
Deleted temporary model file: C:\Users\benva\AppData\Local\Temp\PendCart_a6169388.slx
Deleted: C:\Users\benva\OneDrive\Documents\MATLAB\full_wrap\PendCart_a6169388.slxc
[I 2025-06-17 12:22:50,308] Trial 36 finished with value: 407.2588343083679 and parameters: {'learning_rate': 7.356891535476117e-05, 'buffer_size': 139984, 'batch_size': 436, 'tau': 0.015555338392959493, 'gamma': 0.98712650819798, 'action_noise_sigma': 0.31761444594141736, 'n_layers': 1, 'layer_size': 201, 'activation_fn': 'elu'}. Best is trial 14 with value: 496.22926804054003.
Starting MATLAB engine...
Using device: cuda
Deleted temporary model file: C:\Users\benva\AppData\Local\Temp\PendCart_aae4b139.slx
Deleted: C:\Users\benva\OneDrive\Documents\MATLAB\full_wrap\PendCart_aae4b139.slxc
[I 2025-06-17 12:53:50,480] Trial 38 finished with value: 436.66855314626054 and parameters: {'learning_rate': 0.0002394896247906736, 'buffer_size': 182531, 'batch_size': 420, 'tau': 0.01524886116624177, 'gamma': 0.9884074229698615, 'action_noise_sigma': 0.31056561669809574, 'n_layers': 1, 'layer_size': 138, 'activation_fn': 'elu'}. Best is trial 14 with value: 496.22926804054003.
Starting MATLAB engine...
Using device: cuda
Deleted temporary model file: C:\Users\benva\AppData\Local\Temp\PendCart_544086c1.slx
Deleted: C:\Users\benva\OneDrive\Documents\MATLAB\full_wrap\PendCart_544086c1.slxc
[I 2025-06-17 13:00:17,223] Trial 39 finished with value: 414.1708663302555 and parameters: {'learning_rate': 0.00022282054065820333, 'buffer_size': 140999, 'batch_size': 419, 'tau': 0.015545560631860737, 'gamma': 0.9002671639511407, 'action_noise_sigma': 0.3233567139077037, 'n_layers': 1, 'layer_size': 165, 'activation_fn': 'tanh'}. Best is trial 14 with value: 496.22926804054003.
Starting MATLAB engine...
Using device: cuda
Deleted temporary model file: C:\Users\benva\AppData\Local\Temp\PendCart_3aef5e73.slx
Deleted: C:\Users\benva\OneDrive\Documents\MATLAB\full_wrap\PendCart_3aef5e73.slxc
[I 2025-06-17 13:23:46,270] Trial 40 finished with value: 443.12978603333585 and parameters: {'learning_rate': 0.00023275538747739947, 'buffer_size': 141896, 'batch_size': 416, 'tau': 0.015575896317129086, 'gamma': 0.914037678267674, 'action_noise_sigma': 0.3258775193544339, 'n_layers': 1, 'layer_size': 125, 'activation_fn': 'tanh'}. Best is trial 14 with value: 496.22926804054003.
Starting MATLAB engine...
Using device: cuda
Deleted temporary model file: C:\Users\benva\AppData\Local\Temp\PendCart_6429e460.slx
Deleted: C:\Users\benva\OneDrive\Documents\MATLAB\full_wrap\PendCart_6429e460.slxc
[I 2025-06-17 13:29:18,654] Trial 41 finished with value: 449.86364141936394 and parameters: {'learning_rate': 0.00024034662340036874, 'buffer_size': 138992, 'batch_size': 420, 'tau': 0.01996040803971312, 'gamma': 0.9016769614835086, 'action_noise_sigma': 0.44720355423275715, 'n_layers': 1, 'layer_size': 126, 'activation_fn': 'tanh'}. Best is trial 14 with value: 496.22926804054003.
Starting MATLAB engine...
Using device: cuda
Deleted temporary model file: C:\Users\benva\AppData\Local\Temp\PendCart_1b8fb9d4.slx
Deleted: C:\Users\benva\OneDrive\Documents\MATLAB\full_wrap\PendCart_1b8fb9d4.slxc
[I 2025-06-17 14:13:16,579] Trial 42 finished with value: 439.8944247619643 and parameters: {'learning_rate': 0.0002407753305713334, 'buffer_size': 139544, 'batch_size': 416, 'tau': 0.017383881863071462, 'gamma': 0.9654393935539194, 'action_noise_sigma': 0.4558094311414153, 'n_layers': 1, 'layer_size': 143, 'activation_fn': 'tanh'}. Best is trial 14 with value: 496.22926804054003.
Starting MATLAB engine...
Using device: cuda
Deleted temporary model file: C:\Users\benva\AppData\Local\Temp\PendCart_1f8a0cbd.slx
Deleted: C:\Users\benva\OneDrive\Documents\MATLAB\full_wrap\PendCart_1f8a0cbd.slxc
[I 2025-06-17 14:22:49,108] Trial 43 finished with value: 426.88288839183707 and parameters: {'learning_rate': 0.00019814968704946973, 'buffer_size': 131783, 'batch_size': 478, 'tau': 0.01339621709948267, 'gamma': 0.959881030297454, 'action_noise_sigma': 0.16523444106169366, 'n_layers': 1, 'layer_size': 121, 'activation_fn': 'tanh'}. Best is trial 14 with value: 496.22926804054003.
Starting MATLAB engine...
Using device: cuda
Deleted temporary model file: C:\Users\benva\AppData\Local\Temp\PendCart_9c370143.slx
Deleted: C:\Users\benva\OneDrive\Documents\MATLAB\full_wrap\PendCart_9c370143.slxc
[I 2025-06-17 14:51:36,531] Trial 44 finished with value: 400.0974497679157 and parameters: {'learning_rate': 0.00010124280611631762, 'buffer_size': 128698, 'batch_size': 479, 'tau': 0.011492364146020017, 'gamma': 0.9594075717674746, 'action_noise_sigma': 0.16042465656502441, 'n_layers': 2, 'layer_size': 115, 'activation_fn': 'tanh'}. Best is trial 14 with value: 496.22926804054003.
Deleted temporary model file: C:\Users\benva\AppData\Local\Temp\PendCart_f5f79bdd.slx
Deleted: C:\Users\benva\OneDrive\Documents\MATLAB\full_wrap\PendCart_f5f79bdd.slxc
[I 2025-06-17 15:02:05,824] Trial 45 finished with value: 482.599405122099 and parameters: {'learning_rate': 0.00010146974554600097, 'buffer_size': 131105, 'batch_size': 155, 'tau': 0.017519377574178846, 'gamma': 0.9610767117474539, 'action_noise_sigma': 0.1706393785478003, 'n_layers': 2, 'layer_size': 123, 'activation_fn': 'leaky_relu'}. Best is trial 14 with value: 496.22926804054003.
Deleted temporary model file: C:\Users\benva\AppData\Local\Temp\PendCart_63c9d559.slx
Deleted: C:\Users\benva\OneDrive\Documents\MATLAB\full_wrap\PendCart_63c9d559.slxc
[I 2025-06-17 15:22:04,900] Trial 46 finished with value: 495.30717021872687 and parameters: {'learning_rate': 0.00010582926113197269, 'buffer_size': 97786, 'batch_size': 472, 'tau': 0.006502852876512473, 'gamma': 0.905741264940707, 'action_noise_sigma': 0.45866443369961724, 'n_layers': 2, 'layer_size': 149, 'activation_fn': 'tanh'}. Best is trial 14 with value: 496.22926804054003.
Deleted temporary model file: C:\Users\benva\AppData\Local\Temp\PendCart_67d2728f.slx
Deleted: C:\Users\benva\OneDrive\Documents\MATLAB\full_wrap\PendCart_67d2728f.slxc
[I 2025-06-17 15:26:42,659] Trial 47 finished with value: 492.13745541750967 and parameters: {'learning_rate': 0.00013027398227151812, 'buffer_size': 82645, 'batch_size': 477, 'tau': 0.007501566164580798, 'gamma': 0.9096384708800939, 'action_noise_sigma': 0.27843535318551754, 'n_layers': 2, 'layer_size': 142, 'activation_fn': 'tanh'}. Best is trial 14 with value: 496.22926804054003.
Deleted temporary model file: C:\Users\benva\AppData\Local\Temp\PendCart_8a03d79b.slx
Deleted: C:\Users\benva\OneDrive\Documents\MATLAB\full_wrap\PendCart_8a03d79b.slxc
[I 2025-06-17 15:58:37,432] Trial 48 finished with value: 432.0045663223209 and parameters: {'learning_rate': 0.00010990225756855772, 'buffer_size': 95025, 'batch_size': 476, 'tau': 0.007241776998422935, 'gamma': 0.9094782510095648, 'action_noise_sigma': 0.15770080615923918, 'n_layers': 3, 'layer_size': 235, 'activation_fn': 'tanh'}. Best is trial 14 with value: 496.22926804054003.
Deleted temporary model file: C:\Users\benva\AppData\Local\Temp\PendCart_54134076.slx
Deleted: C:\Users\benva\OneDrive\Documents\MATLAB\full_wrap\PendCart_54134076.slxc
[I 2025-06-17 16:03:48,544] Trial 49 finished with value: 366.3835373802701 and parameters: {'learning_rate': 0.00011542050128407557, 'buffer_size': 102798, 'batch_size': 470, 'tau': 0.005690577574461728, 'gamma': 0.9115851231534975, 'action_noise_sigma': 0.2956330944061385, 'n_layers': 2, 'layer_size': 150, 'activation_fn': 'leaky_relu'}. Best is trial 14 with value: 496.22926804054003.

Best parameters for ddpg:
Best value: 496.22926804054003
  learning_rate: 6.97385681750532e-05
  buffer_size: 163094
  batch_size: 353
  tau: 0.01622997858093718
  gamma: 0.9398102505966908
  action_noise_sigma: 0.26505870604351767
  n_layers: 3
  layer_size: 185
  activation_fn: relu
  net_arch: [185, 185, 185]
  activation_fn: relu
(myenv) PS C:\Users\benva\OneDrive\Documents\MATLAB\full_wrap> 