[I 2025-06-28 01:51:59,546] Trial 26 finished with value: 112.04986257054252 and parameters: {'learning_rate': 0.0007586400182445802, 'buffer_size': 125274, 'batch_size': 160, 'gamma': 0.9685617484579946, 'tau': 0.022898567312119145, 'exploration_fraction': 0.3080845124234014, 'exploration_final_eps': 0.06733157193322509, 'target_update_interval': 1594, 'train_freq': 1, 'n_layers': 5, 'layer_size': 128, 'activation_fn': 'tanh'}. Best is trial 20 with value: 354.6540971570381.
Tuning DQN:  56%|█████████████████████████████████████████████████████████████████████████████████████████████████████████▎                                                                                  | 28/50 [30:03:48<44:22:42, 7261.91s/it, best_val=354.7]Starting MATLAB engine...
[DQN] Using device: cuda
[DQN|Trial 31] ✘ Pruned by Halving at 40000 (reward 12.2)
Deleted temporary model file: C:\Users\benva\AppData\Local\Temp\PendCart_b3301c0d.slx
Deleted: C:\Users\benva\OneDrive\Documents\MATLAB\full_wrap\PendCart_b3301c0d.slxc
[I 2025-06-28 02:05:59,938] Trial 31 pruned.
Tuning DQN:  58%|█████████████████████████████████████████████████████████████████████████████████████████████████████████████                                                                               | 29/50 [30:17:48<31:07:23, 5335.39s/it, best_val=354.7]Starting MATLAB engine...
[DQN] Using device: cuda
[DQN|Trial 33] ✘ Pruned by Halving at 20000 (reward 19.9)
Deleted temporary model file: C:\Users\benva\AppData\Local\Temp\PendCart_42ce3813.slx
Deleted: C:\Users\benva\OneDrive\Documents\MATLAB\full_wrap\PendCart_42ce3813.slxc
[I 2025-06-28 03:39:49,312] Trial 33 pruned.
Tuning DQN:  60%|████████████████████████████████████████████████████████████████████████████████████████████████████████████████▊                                                                           | 30/50 [31:51:37<30:07:51, 5423.59s/it, best_val=354.7]Starting MATLAB engine...
[DQN] Using device: cuda
[DQN|Trial 34] ✘ Pruned by Halving at 20000 (reward 10.2)
Deleted temporary model file: C:\Users\benva\AppData\Local\Temp\PendCart_df422557.slx
Deleted: C:\Users\benva\OneDrive\Documents\MATLAB\full_wrap\PendCart_df422557.slxc
[I 2025-06-28 03:51:18,435] Trial 34 pruned.
Tuning DQN:  62%|████████████████████████████████████████████████████████████████████████████████████████████████████████████████████▌                                                                       | 31/50 [32:03:07<21:07:41, 4003.23s/it, best_val=354.7]Starting MATLAB engine...
[DQN] Using device: cuda
Deleted temporary model file: C:\Users\benva\AppData\Local\Temp\PendCart_8af9f735.slx
Deleted: C:\Users\benva\OneDrive\Documents\MATLAB\full_wrap\PendCart_8af9f735.slxc
[I 2025-06-28 04:03:12,286] Trial 32 finished with value: 50.707776463678044 and parameters: {'learning_rate': 0.00035046201085254744, 'buffer_size': 144974, 'batch_size': 96, 'gamma': 0.9841834065416557, 'tau': 0.020597824745561936, 'exploration_fraction': 0.2565628174985175, 'exploration_final_eps': 0.022352229557711305, 'target_update_interval': 2601, 'train_freq': 2, 'n_layers': 3, 'layer_size': 256, 'activation_fn': 'tanh'}. Best is trial 20 with value: 354.6540971570381.
Tuning DQN:  64%|████████████████████████████████████████████████████████████████████████████████████████████████████████████████████████▎                                                                   | 32/50 [32:15:00<15:04:55, 3016.40s/it, best_val=354.7]Starting MATLAB engine...
[DQN] Using device: cuda
Deleted temporary model file: C:\Users\benva\AppData\Local\Temp\PendCart_749b3876.slx
Deleted: C:\Users\benva\OneDrive\Documents\MATLAB\full_wrap\PendCart_749b3876.slxc
[I 2025-06-28 04:54:56,866] Trial 29 finished with value: 398.75100428708095 and parameters: {'learning_rate': 0.0007840777469401202, 'buffer_size': 149270, 'batch_size': 160, 'gamma': 0.9702197223635487, 'tau': 0.02200841749746698, 'exploration_fraction': 0.2997210997532054, 'exploration_final_eps': 0.02303930929841272, 'target_update_interval': 2607, 'train_freq': 1, 'n_layers': 5, 'layer_size': 256, 'activation_fn': 'tanh'}. Best is trial 29 with value: 398.75100428708095.
Tuning DQN:  66%|████████████████████████████████████████████████████████████████████████████████████████████████████████████████████████████                                                                | 33/50 [33:06:45<14:22:08, 3042.86s/it, best_val=398.8]Starting MATLAB engine...
[DQN] Using device: cuda
Deleted temporary model file: C:\Users\benva\AppData\Local\Temp\PendCart_0cee7ddc.slx
Deleted: C:\Users\benva\OneDrive\Documents\MATLAB\full_wrap\PendCart_0cee7ddc.slxc
[I 2025-06-28 05:02:19,710] Trial 28 finished with value: 439.0499902533281 and parameters: {'learning_rate': 0.0007975224079134441, 'buffer_size': 148614, 'batch_size': 128, 'gamma': 0.9849864046018536, 'tau': 0.0215924030983819, 'exploration_fraction': 0.37182355091417596, 'exploration_final_eps': 0.0717230824249314, 'target_update_interval': 1470, 'train_freq': 1, 'n_layers': 5, 'layer_size': 128, 'activation_fn': 'tanh'}. Best is trial 28 with value: 439.0499902533281.
Tuning DQN:  68%|███████████████████████████████████████████████████████████████████████████████████████████████████████████████████████████████▊                                                            | 34/50 [33:14:08<10:03:25, 2262.85s/it, best_val=439.0]Starting MATLAB engine...
[DQN] Using device: cuda
[DQN|Trial 35] ✘ Pruned by Halving at 20000 (reward 16.2)
Deleted temporary model file: C:\Users\benva\AppData\Local\Temp\PendCart_b39b872f.slx
Deleted: C:\Users\benva\OneDrive\Documents\MATLAB\full_wrap\PendCart_b39b872f.slxc
[I 2025-06-28 05:27:07,924] Trial 35 pruned.
Tuning DQN:  70%|████████████████████████████████████████████████████████████████████████████████████████████████████████████████████████████████████▎                                                        | 35/50 [33:38:56<8:27:36, 2030.46s/it, best_val=439.0]Starting MATLAB engine...
[DQN] Using device: cuda
[DQN|Trial 36] ✘ Pruned by Halving at 20000 (reward 14.7)
Deleted temporary model file: C:\Users\benva\AppData\Local\Temp\PendCart_479529aa.slx
Deleted: C:\Users\benva\OneDrive\Documents\MATLAB\full_wrap\PendCart_479529aa.slxc
[I 2025-06-28 05:38:45,155] Trial 36 pruned.
Tuning DQN:  72%|████████████████████████████████████████████████████████████████████████████████████████████████████████████████████████████████████████                                                     | 36/50 [33:50:33<6:20:26, 1630.49s/it, best_val=439.0]Starting MATLAB engine...
[DQN] Using device: cuda
[DQN|Trial 37] ✘ Pruned by Halving at 20000 (reward 17.9)
Deleted temporary model file: C:\Users\benva\AppData\Local\Temp\PendCart_3f8bbc61.slx
Deleted: C:\Users\benva\OneDrive\Documents\MATLAB\full_wrap\PendCart_3f8bbc61.slxc
[I 2025-06-28 05:49:52,605] Trial 37 pruned.
Tuning DQN:  74%|███████████████████████████████████████████████████████████████████████████████████████████████████████████████████████████████████████████▊                                                 | 37/50 [34:01:41<4:50:40, 1341.58s/it, best_val=439.0]Starting MATLAB engine...
[DQN] Using device: cuda
Deleted temporary model file: C:\Users\benva\AppData\Local\Temp\PendCart_45473113.slx
Deleted: C:\Users\benva\OneDrive\Documents\MATLAB\full_wrap\PendCart_45473113.slxc
[I 2025-06-28 06:47:44,901] Trial 30 finished with value: 445.53035252593855 and parameters: {'learning_rate': 0.0007932736361202702, 'buffer_size': 149542, 'batch_size': 160, 'gamma': 0.9837425057320124, 'tau': 0.019599990379977943, 'exploration_fraction': 0.2891246310035712, 'exploration_final_eps': 0.022754873912448813, 'target_update_interval': 2401, 'train_freq': 1, 'n_layers': 5, 'layer_size': 256, 'activation_fn': 'tanh'}. Best is trial 30 with value: 445.53035252593855.
Tuning DQN:  76%|███████████████████████████████████████████████████████████████████████████████████████████████████████████████████████████████████████████████▋                                             | 38/50 [34:59:33<6:36:09, 1980.79s/it, best_val=445.5]Starting MATLAB engine...
[DQN] Using device: cuda
[DQN|Trial 39] ✘ Pruned by Halving at 20000 (reward 13.9)
Deleted temporary model file: C:\Users\benva\AppData\Local\Temp\PendCart_5b61e65c.slx
Deleted: C:\Users\benva\OneDrive\Documents\MATLAB\full_wrap\PendCart_5b61e65c.slxc
[I 2025-06-28 06:53:46,094] Trial 39 pruned.
Tuning DQN:  78%|███████████████████████████████████████████████████████████████████████████████████████████████████████████████████████████████████████████████████▍                                         | 39/50 [35:05:34<4:34:04, 1494.91s/it, best_val=445.5]Starting MATLAB engine...
[DQN] Using device: cuda
[DQN|Trial 42] ✘ Pruned by Halving at 20000 (reward 17.7)
Deleted temporary model file: C:\Users\benva\AppData\Local\Temp\PendCart_5c6f4dc0.slx
Deleted: C:\Users\benva\OneDrive\Documents\MATLAB\full_wrap\PendCart_5c6f4dc0.slxc
[I 2025-06-28 07:42:07,017] Trial 42 pruned.
Tuning DQN:  80%|███████████████████████████████████████████████████████████████████████████████████████████████████████████████████████████████████████████████████████▏                                     | 40/50 [35:53:55<5:19:27, 1916.72s/it, best_val=445.5]Starting MATLAB engine...
[DQN] Using device: cuda
[DQN|Trial 43] ✘ Pruned by Halving at 20000 (reward 11.9)
Deleted temporary model file: C:\Users\benva\AppData\Local\Temp\PendCart_d3ba3dfd.slx
Deleted: C:\Users\benva\OneDrive\Documents\MATLAB\full_wrap\PendCart_d3ba3dfd.slxc
[I 2025-06-28 08:38:15,342] Trial 43 pruned. 
Tuning DQN:  82%|██████████████████████████████████████████████████████████████████████████████████████████████████████████████████████████████████████████████████████████▉                                  | 41/50 [36:50:03<5:52:49, 2352.20s/it, best_val=445.5]Starting MATLAB engine...
[DQN] Using device: cuda
[DQN|Trial 45] ✘ Pruned by Halving at 20000 (reward 14.7)
Deleted temporary model file: C:\Users\benva\AppData\Local\Temp\PendCart_ab6b0d6d.slx
Deleted: C:\Users\benva\OneDrive\Documents\MATLAB\full_wrap\PendCart_ab6b0d6d.slxc
[I 2025-06-28 09:30:13,770] Trial 45 pruned. 
Tuning DQN:  84%|██████████████████████████████████████████████████████████████████████████████████████████████████████████████████████████████████████████████████████████████▊                              | 42/50 [37:42:02<5:44:16, 2582.07s/it, best_val=445.5]Starting MATLAB engine...
[DQN] Using device: cuda
[DQN|Trial 41] ✘ Pruned by Halving at 40000 (reward 12.3)
Deleted temporary model file: C:\Users\benva\AppData\Local\Temp\PendCart_c9f65af4.slx
Deleted: C:\Users\benva\OneDrive\Documents\MATLAB\full_wrap\PendCart_c9f65af4.slxc
[I 2025-06-28 12:28:43,705] Trial 41 pruned.
Tuning DQN:  86%|██████████████████████████████████████████████████████████████████████████████████████████████████████████████████████████████████████████████████████████████████▌                          | 43/50 [40:40:32<9:45:43, 5020.43s/it, best_val=445.5]Starting MATLAB engine...
[DQN] Using device: cuda
[DQN|Trial 44] ✘ Pruned by Halving at 40000 (reward 12.0)
Deleted temporary model file: C:\Users\benva\AppData\Local\Temp\PendCart_a85f3c50.slx
Deleted: C:\Users\benva\OneDrive\Documents\MATLAB\full_wrap\PendCart_a85f3c50.slxc
[I 2025-06-28 12:46:53,547] Trial 44 pruned.
Tuning DQN:  88%|██████████████████████████████████████████████████████████████████████████████████████████████████████████████████████████████████████████████████████████████████████▎                      | 44/50 [40:58:42<6:24:07, 3841.25s/it, best_val=445.5]Starting MATLAB engine...
[DQN] Using device: cuda
[DQN|Trial 46] ✘ Pruned by Halving at 40000 (reward 11.0)
Deleted temporary model file: C:\Users\benva\AppData\Local\Temp\PendCart_09881a45.slx
Deleted: C:\Users\benva\OneDrive\Documents\MATLAB\full_wrap\PendCart_09881a45.slxc
[I 2025-06-28 14:14:18,849] Trial 46 pruned.
Tuning DQN:  90%|██████████████████████████████████████████████████████████████████████████████████████████████████████████████████████████████████████████████████████████████████████████                   | 45/50 [42:26:07<5:55:12, 4262.47s/it, best_val=445.5]Deleted temporary model file: C:\Users\benva\AppData\Local\Temp\PendCart_b2169f1a.slx
Deleted: C:\Users\benva\OneDrive\Documents\MATLAB\full_wrap\PendCart_b2169f1a.slxc
[I 2025-06-28 14:18:57,440] Trial 40 finished with value: 319.6601881724299 and parameters: {'learning_rate': 0.0005846924795274617, 'buffer_size': 137047, 'batch_size': 224, 'gamma': 0.9778630861008312, 'tau': 0.02792536882366833, 'exploration_fraction': 0.3968303671107859, 'exploration_final_eps': 0.03964778190512544, 'target_update_interval': 2155, 'train_freq': 1, 'n_layers': 5, 'layer_size': 192, 'activation_fn': 'tanh'}. Best is trial 30 with value: 445.53035252593855.
Tuning DQN:  92%|█████████████████████████████████████████████████████████████████████████████████████████████████████████████████████████████████████████████████████████████████████████████▉               | 46/50 [42:30:46<3:24:29, 3067.30s/it, best_val=445.5][DQN|Trial 48] ✘ Pruned by Halving at 20000 (reward 17.9)
Deleted temporary model file: C:\Users\benva\AppData\Local\Temp\PendCart_a9b3e7b4.slx
Deleted: C:\Users\benva\OneDrive\Documents\MATLAB\full_wrap\PendCart_a9b3e7b4.slxc
[I 2025-06-28 14:21:28,461] Trial 48 pruned.
Tuning DQN:  94%|█████████████████████████████████████████████████████████████████████████████████████████████████████████████████████████████████████████████████████████████████████████████████▋           | 47/50 [42:33:17<1:49:37, 2192.42s/it, best_val=445.5]Deleted temporary model file: C:\Users\benva\AppData\Local\Temp\PendCart_57af303a.slx
Deleted: C:\Users\benva\OneDrive\Documents\MATLAB\full_wrap\PendCart_57af303a.slxc
[I 2025-06-28 14:26:46,327] Trial 38 finished with value: 342.7680047232392 and parameters: {'learning_rate': 0.0014769174091299327, 'buffer_size': 105965, 'batch_size': 224, 'gamma': 0.9771072973589893, 'tau': 0.027312847726902748, 'exploration_fraction': 0.3345954119663452, 'exploration_final_eps': 0.04069541904853815, 'target_update_interval': 2075, 'train_freq': 1, 'n_layers': 5, 'layer_size': 128, 'activation_fn': 'tanh'}. Best is trial 30 with value: 445.53035252593855.
Tuning DQN:  96%|███████████████████████████████████████████████████████████████████████████████████████████████████████████████████████████████████████████████████████████████████████████████████████▎       | 48/50 [42:38:34<54:20, 1630.05s/it, best_val=445.5][DQN|Trial 49] ✘ Pruned by Halving at 20000 (reward 14.6)
Deleted temporary model file: C:\Users\benva\AppData\Local\Temp\PendCart_6d5fe7b8.slx
Deleted: C:\Users\benva\OneDrive\Documents\MATLAB\full_wrap\PendCart_6d5fe7b8.slxc
[I 2025-06-28 14:32:20,662] Trial 49 pruned.
Tuning DQN:  98%|███████████████████████████████████████████████████████████████████████████████████████████████████████████████████████████████████████████████████████████████████████████████████████████▏   | 49/50 [42:44:09<20:41, 1241.34s/it, best_val=445.5][DQN|Trial 47] ✘ Pruned by Halving at 40000 (reward 12.6)
Deleted temporary model file: C:\Users\benva\AppData\Local\Temp\PendCart_901cc181.slx
Deleted: C:\Users\benva\OneDrive\Documents\MATLAB\full_wrap\PendCart_901cc181.slxc
[I 2025-06-28 15:22:15,445] Trial 47 pruned.
Tuning DQN: 100%|███████████████████████████████████████████████████████████████████████████████████████████████████████████████████████████████████████████████████████████████████████████████████████████████| 50/50 [43:34:04<00:00, 3136.88s/it, best_val=445.5]

Best for DQN: reward=445.53
  learning_rate: 0.0007932736361202702
  buffer_size: 149542
  batch_size: 160
  gamma: 0.9837425057320124
  tau: 0.019599990379977943
  exploration_fraction: 0.2891246310035712
  exploration_final_eps: 0.022754873912448813
  target_update_interval: 2401
  train_freq: 1
  n_layers: 5
  layer_size: 256
  activation_fn: tanh