[I 2025-06-22 22:29:30,054] Trial 42 finished with value: 496.923140320464 and parameters: {'n_steps': 126, 'batch_size_idx': 1, 'learning_rate': 0.0007914487565540364, 'n_epochs': 13, 'gamma': 0.9520596513616589, 'clip_range': 0.3660268718500816, 'ent_coef': 5.071028321424264e-06, 'vf_coef': 0.8409032149154008, 'max_grad_norm': 1.996247417137996, 'gae_lambda': 0.9159592314770219, 'n_layers': 3, 'layer_size': 93, 'activation_fn': 'tanh'}. Best is trial 42 with value: 496.923140320464.
Tuning PPO:  88%|███████████████████████████████████████████████████████████████████████████████████████████████████████████████████████████████████                  | 44/50 [26:08:56<3:54:46, 2347.82s/it, best_value=496.92]Starting MATLAB engine...
Using device: cuda
Deleted temporary model file: C:\Users\benva\AppData\Local\Temp\PendCart_f364d360.slx
Deleted: C:\Users\benva\OneDrive\Documents\MATLAB\full_wrap\PendCart_f364d360.slxc
[I 2025-06-22 22:48:37,917] Trial 44 finished with value: 171.70381312417433 and parameters: {'n_steps': 295, 'batch_size_idx': 0, 'learning_rate': 0.0006999687663711824, 'n_epochs': 13, 'gamma': 0.937527817245607, 'clip_range': 0.3288163801893277, 'ent_coef': 0.0003516962889416575, 'vf_coef': 0.671976694723266, 'max_grad_norm': 2.4057607096269793, 'gae_lambda': 0.9271672089491316, 'n_layers': 1, 'layer_size': 232, 'activation_fn': 'tanh'}. Best is trial 42 with value: 496.923140320464.
Tuning PPO:  90%|██████████████████████████████████████████████████████████████████████████████████████████████████████████████████████████████████████               | 45/50 [26:28:04<2:45:39, 1987.83s/it, best_value=496.92]Deleted temporary model file: C:\Users\benva\AppData\Local\Temp\PendCart_2f30cbd9.slx
Deleted: C:\Users\benva\OneDrive\Documents\MATLAB\full_wrap\PendCart_2f30cbd9.slxc
[I 2025-06-22 23:02:07,578] Trial 45 finished with value: 47.41038418037623 and parameters: {'n_steps': 1645, 'batch_size_idx': 1, 'learning_rate': 0.000348131727087469, 'n_epochs': 13, 'gamma': 0.9700547899398113, 'clip_range': 0.32736080997327255, 'ent_coef': 1.8391529939152775e-05, 'vf_coef': 0.6921364982670527, 'max_grad_norm': 2.3076447454385085, 'gae_lambda': 0.8452647035475551, 'n_layers': 1, 'layer_size': 217, 'activation_fn': 'tanh'}. Best is trial 42 with value: 496.923140320464.
Tuning PPO:  92%|█████████████████████████████████████████████████████████████████████████████████████████████████████████████████████████████████████████            | 46/50 [26:41:34<1:48:57, 1634.38s/it, best_value=496.92]Deleted temporary model file: C:\Users\benva\AppData\Local\Temp\PendCart_c18d30fd.slx
Deleted: C:\Users\benva\OneDrive\Documents\MATLAB\full_wrap\PendCart_c18d30fd.slxc
[I 2025-06-22 23:21:53,420] Trial 46 finished with value: 396.36289413343457 and parameters: {'n_steps': 278, 'batch_size_idx': 0, 'learning_rate': 0.0003498448941085157, 'n_epochs': 5, 'gamma': 0.9708504303830481, 'clip_range': 0.3297029950124121, 'ent_coef': 0.0017104518474687005, 'vf_coef': 0.6810639533094297, 'max_grad_norm': 2.2265824015254947, 'gae_lambda': 0.8767367101475623, 'n_layers': 2, 'layer_size': 221, 'activation_fn': 'tanh'}. Best is trial 42 with value: 496.923140320464.
Tuning PPO:  94%|████████████████████████████████████████████████████████████████████████████████████████████████████████████████████████████████████████████         | 47/50 [27:01:19<1:14:59, 1499.82s/it, best_value=496.92]Deleted temporary model file: C:\Users\benva\AppData\Local\Temp\PendCart_2cc9ef7b.slx
Deleted: C:\Users\benva\OneDrive\Documents\MATLAB\full_wrap\PendCart_2cc9ef7b.slxc
[I 2025-06-22 23:54:45,624] Trial 47 finished with value: 234.67073706659147 and parameters: {'n_steps': 292, 'batch_size_idx': 0, 'learning_rate': 0.0003621172509400638, 'n_epochs': 13, 'gamma': 0.9686330736740459, 'clip_range': 0.32594423453632926, 'ent_coef': 1.689702127102658e-05, 'vf_coef': 0.6843451071249032, 'max_grad_norm': 2.321820374251102, 'gae_lambda': 0.9315279387430561, 'n_layers': 1, 'layer_size': 224, 'activation_fn': 'tanh'}. Best is trial 42 with value: 496.923140320464.
Tuning PPO:  96%|████████████████████████████████████████████████████████████████████████████████████████████████████████████████████████████████████████████████▉      | 48/50 [27:34:12<54:43, 1641.54s/it, best_value=496.92]Deleted temporary model file: C:\Users\benva\AppData\Local\Temp\PendCart_7a10ffd9.slx
Deleted: C:\Users\benva\OneDrive\Documents\MATLAB\full_wrap\PendCart_7a10ffd9.slxc
[I 2025-06-23 01:16:02,086] Trial 48 finished with value: 336.14377726422714 and parameters: {'n_steps': 155, 'batch_size_idx': 0, 'learning_rate': 0.00035340491273137077, 'n_epochs': 13, 'gamma': 0.9359139912835422, 'clip_range': 0.34423364922829525, 'ent_coef': 0.0005440637972578279, 'vf_coef': 0.45268460868378874, 'max_grad_norm': 1.321002625508122, 'gae_lambda': 0.8775170964069821, 'n_layers': 1, 'layer_size': 71, 'activation_fn': 'tanh'}. Best is trial 42 with value: 496.923140320464.
Tuning PPO:  98%|███████████████████████████████████████████████████████████████████████████████████████████████████████████████████████████████████████████████████▉   | 49/50 [28:55:28<43:32, 2612.01s/it, best_value=496.92]Deleted temporary model file: C:\Users\benva\AppData\Local\Temp\PendCart_986450b6.slx
Deleted: C:\Users\benva\OneDrive\Documents\MATLAB\full_wrap\PendCart_986450b6.slxc
[I 2025-06-23 01:25:52,538] Trial 49 finished with value: 394.0654277047219 and parameters: {'n_steps': 275, 'batch_size_idx': 1, 'learning_rate': 0.0007144281838611175, 'n_epochs': 12, 'gamma': 0.9743703381210004, 'clip_range': 0.348613204899881, 'ent_coef': 0.00047243941075763874, 'vf_coef': 0.4458064421708439, 'max_grad_norm': 2.3034200527176147, 'gae_lambda': 0.9058137782853436, 'n_layers': 3, 'layer_size': 60, 'activation_fn': 'tanh'}. Best is trial 42 with value: 496.923140320464.
Tuning PPO: 100%|███████████████████████████████████████████████████████████████████████████████████████████████████████████████████████████████████████████████████████| 50/50 [29:05:19<00:00, 2094.38s/it, best_value=496.92] 

Best parameters for ppo:
Best value: 496.923140320464
  n_steps: 126
  batch_size_idx: 1
  learning_rate: 0.0007914487565540364
  n_epochs: 13
  gamma: 0.9520596513616589
  clip_range: 0.3660268718500816
  ent_coef: 5.071028321424264e-06
  vf_coef: 0.8409032149154008
  max_grad_norm: 1.996247417137996
  gae_lambda: 0.9159592314770219
  n_layers: 3
  layer_size: 93
  activation_fn: tanh
  net_arch: [93, 93, 93]
  activation_fn: tanh
(myenv) PS C:\Users\benva\OneDrive\Documents\MATLAB\full_wrap> 