[I 2025-06-22 09:39:39,574] Trial 20 finished with value: 16.001643466327014 and parameters: {'n_steps': 198, 'batch_size_idx': 3, 'learning_rate': 0.0001941561628000333, 'n_epochs': 14, 'gamma': 0.9304143386225501, 'clip_range': 0.19430031499923575, 'ent_coef': 9.444006473414497e-07, 'vf_coef': 0.9628197098673137, 'max_grad_norm': 4.441735579094015, 'gae_lambda': 0.980364414733282, 'n_layers': 1, 'layer_size': 164, 'activation_fn': 'elu'}. Best is trial 5 with value: 493.25398839203456.
Tuning PPO:  42%|██████████████████████████████████████████████████████████████▏                                                                                     | 21/50 [13:19:06<16:00:33, 1987.36s/it, best_value=493.25]Starting MATLAB engine...
Using device: cuda
Deleted temporary model file: C:\Users\benva\AppData\Local\Temp\PendCart_c3f0885d.slx
Deleted: C:\Users\benva\OneDrive\Documents\MATLAB\full_wrap\PendCart_c3f0885d.slxc
[I 2025-06-22 09:43:51,687] Trial 21 finished with value: 17.148103438026446 and parameters: {'n_steps': 232, 'batch_size_idx': 1, 'learning_rate': 0.00023192590767165467, 'n_epochs': 14, 'gamma': 0.9271174524390503, 'clip_range': 0.18073162777909366, 'ent_coef': 1.0287147912920718e-06, 'vf_coef': 0.7301018865389268, 'max_grad_norm': 4.264857952840514, 'gae_lambda': 0.998410317878788, 'n_layers': 1, 'layer_size': 171, 'activation_fn': 'relu'}. Best is trial 5 with value: 493.25398839203456.
Tuning PPO:  44%|█████████████████████████████████████████████████████████████████                                                                                   | 22/50 [13:23:18<11:24:24, 1466.59s/it, best_value=493.25]Starting MATLAB engine...
Using device: cuda
Deleted temporary model file: C:\Users\benva\AppData\Local\Temp\PendCart_52bb6763.slx
Deleted: C:\Users\benva\OneDrive\Documents\MATLAB\full_wrap\PendCart_52bb6763.slxc
[I 2025-06-22 09:47:32,358] Trial 22 finished with value: 26.97000539683919 and parameters: {'n_steps': 230, 'batch_size_idx': 1, 'learning_rate': 0.00027110482313696623, 'n_epochs': 14, 'gamma': 0.9988051279743921, 'clip_range': 0.19268675219660245, 'ent_coef': 2.192770705595981e-06, 'vf_coef': 0.7462985809500646, 'max_grad_norm': 4.212850884705045, 'gae_lambda': 0.9931363941597378, 'n_layers': 1, 'layer_size': 173, 'activation_fn': 'relu'}. Best is trial 5 with value: 493.25398839203456.
Tuning PPO:  46%|████████████████████████████████████████████████████████████████████▌                                                                                | 23/50 [13:26:58<8:11:43, 1092.71s/it, best_value=493.25]Starting MATLAB engine...
Using device: cuda
Deleted temporary model file: C:\Users\benva\AppData\Local\Temp\PendCart_3a169ceb.slx
Deleted: C:\Users\benva\OneDrive\Documents\MATLAB\full_wrap\PendCart_3a169ceb.slxc
[I 2025-06-22 10:21:40,330] Trial 23 finished with value: 435.56172298515 and parameters: {'n_steps': 65, 'batch_size_idx': 0, 'learning_rate': 0.00031105211762464237, 'n_epochs': 15, 'gamma': 0.9228046114121558, 'clip_range': 0.3969221159528911, 'ent_coef': 1.8660263082456204e-06, 'vf_coef': 0.721121082969671, 'max_grad_norm': 3.9851719760002733, 'gae_lambda': 0.9904865452352745, 'n_layers': 1, 'layer_size': 178, 'activation_fn': 'relu'}. Best is trial 5 with value: 493.25398839203456.
Tuning PPO:  48%|███████████████████████████████████████████████████████████████████████▌                                                                             | 24/50 [14:01:06<9:57:42, 1379.34s/it, best_value=493.25]Starting MATLAB engine...
Using device: cuda
Deleted temporary model file: C:\Users\benva\AppData\Local\Temp\PendCart_3cb769f8.slx
Deleted: C:\Users\benva\OneDrive\Documents\MATLAB\full_wrap\PendCart_3cb769f8.slxc
[I 2025-06-22 12:28:30,768] Trial 24 finished with value: 43.81623340792086 and parameters: {'n_steps': 793, 'batch_size_idx': 0, 'learning_rate': 0.00028733132149971893, 'n_epochs': 14, 'gamma': 0.9965790660752023, 'clip_range': 0.3967468999754362, 'ent_coef': 2.8951025778128153e-06, 'vf_coef': 0.7145225735585714, 'max_grad_norm': 3.9603516854474368, 'gae_lambda': 0.9943507373611151, 'n_layers': 1, 'layer_size': 106, 'activation_fn': 'relu'}. Best is trial 5 with value: 493.25398839203456.
Tuning PPO:  50%|██████████████████████████████████████████████████████████████████████████                                                                          | 25/50 [16:07:57<22:33:43, 3248.92s/it, best_value=493.25]Starting MATLAB engine...
Using device: cuda
Deleted temporary model file: C:\Users\benva\AppData\Local\Temp\PendCart_971c87b9.slx
Deleted: C:\Users\benva\OneDrive\Documents\MATLAB\full_wrap\PendCart_971c87b9.slxc
[I 2025-06-22 12:51:53,627] Trial 27 finished with value: 16.980000726621093 and parameters: {'n_steps': 65, 'batch_size_idx': 0, 'learning_rate': 6.4243173136096e-05, 'n_epochs': 6, 'gamma': 0.9618582017409179, 'clip_range': 0.39808021315979913, 'ent_coef': 9.315062792622596e-08, 'vf_coef': 0.7668358711787588, 'max_grad_norm': 1.0015493055227331, 'gae_lambda': 0.8928137858541118, 'n_layers': 2, 'layer_size': 117, 'activation_fn': 'relu'}. Best is trial 5 with value: 493.25398839203456.
Tuning PPO:  52%|████████████████████████████████████████████████████████████████████████████▉                                                                       | 26/50 [16:31:20<17:58:01, 2695.05s/it, best_value=493.25]Starting MATLAB engine...
Using device: cuda
Deleted temporary model file: C:\Users\benva\AppData\Local\Temp\PendCart_5aa5c34d.slx
Deleted: C:\Users\benva\OneDrive\Documents\MATLAB\full_wrap\PendCart_5aa5c34d.slxc
[I 2025-06-22 12:56:20,806] Trial 28 finished with value: 53.31604416905758 and parameters: {'n_steps': 67, 'batch_size_idx': 0, 'learning_rate': 7.255971629153805e-05, 'n_epochs': 6, 'gamma': 0.9599649377938895, 'clip_range': 0.3884823106655821, 'ent_coef': 1.3379936836131318e-07, 'vf_coef': 0.7919303637753285, 'max_grad_norm': 1.1194794760247477, 'gae_lambda': 0.894599923005604, 'n_layers': 2, 'layer_size': 111, 'activation_fn': 'tanh'}. Best is trial 5 with value: 493.25398839203456.
Tuning PPO:  54%|███████████████████████████████████████████████████████████████████████████████▉                                                                    | 27/50 [16:35:47<12:33:52, 1966.64s/it, best_value=493.25]Starting MATLAB engine...
Using device: cuda
Deleted temporary model file: C:\Users\benva\AppData\Local\Temp\PendCart_5143833e.slx
Deleted: C:\Users\benva\OneDrive\Documents\MATLAB\full_wrap\PendCart_5143833e.slxc
[I 2025-06-22 13:01:02,958] Trial 25 finished with value: 306.522273995005 and parameters: {'n_steps': 66, 'batch_size_idx': 0, 'learning_rate': 0.0002692236950452442, 'n_epochs': 15, 'gamma': 0.9956023132566868, 'clip_range': 0.29022944777485277, 'ent_coef': 2.4397421640761438e-06, 'vf_coef': 0.7201321197191167, 'max_grad_norm': 4.009593197040776, 'gae_lambda': 0.9639679171451392, 'n_layers': 2, 'layer_size': 111, 'activation_fn': 'relu'}. Best is trial 5 with value: 493.25398839203456.
Tuning PPO:  56%|███████████████████████████████████████████████████████████████████████████████████▍                                                                 | 28/50 [16:40:29<8:55:47, 1461.27s/it, best_value=493.25]Starting MATLAB engine...
Using device: cuda
Deleted temporary model file: C:\Users\benva\AppData\Local\Temp\PendCart_7d2ee799.slx
Deleted: C:\Users\benva\OneDrive\Documents\MATLAB\full_wrap\PendCart_7d2ee799.slxc
[I 2025-06-22 13:13:11,622] Trial 26 finished with value: 395.88290159473445 and parameters: {'n_steps': 70, 'batch_size_idx': 0, 'learning_rate': 0.00024940708113035167, 'n_epochs': 6, 'gamma': 0.9624770754234284, 'clip_range': 0.3833726041464642, 'ent_coef': 9.181095377323244e-08, 'vf_coef': 0.7611516408532737, 'max_grad_norm': 0.9413342398689555, 'gae_lambda': 0.8923362168771213, 'n_layers': 2, 'layer_size': 113, 'activation_fn': 'relu'}. Best is trial 5 with value: 493.25398839203456.
Tuning PPO:  58%|██████████████████████████████████████████████████████████████████████████████████████▍                                                              | 29/50 [16:52:38<7:14:31, 1241.48s/it, best_value=493.25]Starting MATLAB engine...
Using device: cuda
Deleted temporary model file: C:\Users\benva\AppData\Local\Temp\PendCart_03ace972.slx
Deleted: C:\Users\benva\OneDrive\Documents\MATLAB\full_wrap\PendCart_03ace972.slxc
[I 2025-06-22 13:46:19,188] Trial 29 finished with value: 345.98843178219363 and parameters: {'n_steps': 67, 'batch_size_idx': 0, 'learning_rate': 0.0004941057453200084, 'n_epochs': 16, 'gamma': 0.9187022020429467, 'clip_range': 0.3965400183559142, 'ent_coef': 0.0001219287817093775, 'vf_coef': 0.613004737579048, 'max_grad_norm': 3.577038004714299, 'gae_lambda': 0.96047790158203, 'n_layers': 2, 'layer_size': 121, 'activation_fn': 'relu'}. Best is trial 5 with value: 493.25398839203456.
Tuning PPO:  60%|█████████████████████████████████████████████████████████████████████████████████████████▍                                                           | 30/50 [17:25:45<8:08:26, 1465.31s/it, best_value=493.25]Starting MATLAB engine...
Using device: cuda
Deleted temporary model file: C:\Users\benva\AppData\Local\Temp\PendCart_c135c5bf.slx
Deleted: C:\Users\benva\OneDrive\Documents\MATLAB\full_wrap\PendCart_c135c5bf.slxc
[I 2025-06-22 15:19:53,999] Trial 30 finished with value: 30.686088806919077 and parameters: {'n_steps': 74, 'batch_size_idx': 0, 'learning_rate': 0.0005428504551745003, 'n_epochs': 16, 'gamma': 0.9405784650461525, 'clip_range': 0.3072473153741206, 'ent_coef': 1.3751930161213693e-07, 'vf_coef': 0.591761045399557, 'max_grad_norm': 3.661311369016206, 'gae_lambda': 0.9555635514820505, 'n_layers': 2, 'layer_size': 126, 'activation_fn': 'relu'}. Best is trial 5 with value: 493.25398839203456.
Tuning PPO:  62%|███████████████████████████████████████████████████████████████████████████████████████████▊                                                        | 31/50 [18:59:20<14:18:13, 2710.18s/it, best_value=493.25]Starting MATLAB engine...
Using device: cuda
Deleted temporary model file: C:\Users\benva\AppData\Local\Temp\PendCart_178bd91e.slx
Deleted: C:\Users\benva\OneDrive\Documents\MATLAB\full_wrap\PendCart_178bd91e.slxc
[I 2025-06-22 15:57:56,350] Trial 31 finished with value: 186.30778031165747 and parameters: {'n_steps': 86, 'batch_size_idx': 0, 'learning_rate': 0.000503704761437817, 'n_epochs': 16, 'gamma': 0.9421382377137095, 'clip_range': 0.3018255035380245, 'ent_coef': 1.5696700070558472e-07, 'vf_coef': 0.6053783731795682, 'max_grad_norm': 3.608951851797631, 'gae_lambda': 0.9681154686862353, 'n_layers': 2, 'layer_size': 197, 'activation_fn': 'relu'}. Best is trial 5 with value: 493.25398839203456.
Tuning PPO:  64%|██████████████████████████████████████████████████████████████████████████████████████████████▋                                                     | 32/50 [19:37:22<12:54:32, 2581.83s/it, best_value=493.25]Starting MATLAB engine...
Using device: cuda
Deleted temporary model file: C:\Users\benva\AppData\Local\Temp\PendCart_9d93c5b1.slx
Deleted: C:\Users\benva\OneDrive\Documents\MATLAB\full_wrap\PendCart_9d93c5b1.slxc
[I 2025-06-22 16:21:27,596] Trial 32 finished with value: 396.131268588848 and parameters: {'n_steps': 85, 'batch_size_idx': 0, 'learning_rate': 0.0005079949378837292, 'n_epochs': 16, 'gamma': 0.9183198604191781, 'clip_range': 0.3645328094785814, 'ent_coef': 8.673469168127225e-05, 'vf_coef': 0.5912960955814296, 'max_grad_norm': 3.726710943603256, 'gae_lambda': 0.9613992229291004, 'n_layers': 2, 'layer_size': 197, 'activation_fn': 'relu'}. Best is trial 5 with value: 493.25398839203456.
Tuning PPO:  66%|█████████████████████████████████████████████████████████████████████████████████████████████████▋                                                  | 33/50 [20:00:54<10:32:01, 2230.65s/it, best_value=493.25]Starting MATLAB engine...
Using device: cuda
Deleted temporary model file: C:\Users\benva\AppData\Local\Temp\PendCart_1bee6b5c.slx
Deleted: C:\Users\benva\OneDrive\Documents\MATLAB\full_wrap\PendCart_1bee6b5c.slxc
[I 2025-06-22 16:23:15,922] Trial 33 finished with value: 351.9728636243793 and parameters: {'n_steps': 102, 'batch_size_idx': 1, 'learning_rate': 0.0005221238744647063, 'n_epochs': 16, 'gamma': 0.919363945278427, 'clip_range': 0.31551898104363646, 'ent_coef': 0.0001006583784440393, 'vf_coef': 0.6201150108179004, 'max_grad_norm': 3.577732915997389, 'gae_lambda': 0.9547715911909913, 'n_layers': 3, 'layer_size': 199, 'activation_fn': 'leaky_relu'}. Best is trial 5 with value: 493.25398839203456.
Tuning PPO:  68%|█████████████████████████████████████████████████████████████████████████████████████████████████████▎                                               | 34/50 [20:02:42<7:05:03, 1593.95s/it, best_value=493.25]Starting MATLAB engine...
Using device: cuda
Deleted temporary model file: C:\Users\benva\AppData\Local\Temp\PendCart_b22c5fe4.slx
Deleted: C:\Users\benva\OneDrive\Documents\MATLAB\full_wrap\PendCart_b22c5fe4.slxc
[I 2025-06-22 16:31:52,462] Trial 34 finished with value: 308.1847144991462 and parameters: {'n_steps': 87, 'batch_size_idx': 0, 'learning_rate': 0.0004967597611787466, 'n_epochs': 16, 'gamma': 0.9407547930998584, 'clip_range': 0.1068221347043441, 'ent_coef': 9.616971136538896e-05, 'vf_coef': 0.23253241358763715, 'max_grad_norm': 3.544496119523183, 'gae_lambda': 0.9525312656678937, 'n_layers': 3, 'layer_size': 186, 'activation_fn': 'leaky_relu'}. Best is trial 5 with value: 493.25398839203456.
Tuning PPO:  70%|████████████████████████████████████████████████████████████████████████████████████████████████████████▎                                            | 35/50 [20:11:18<5:17:40, 1270.73s/it, best_value=493.25]Starting MATLAB engine...
Using device: cuda
Deleted temporary model file: C:\Users\benva\AppData\Local\Temp\PendCart_e1d64d59.slx
Deleted: C:\Users\benva\OneDrive\Documents\MATLAB\full_wrap\PendCart_e1d64d59.slxc
[I 2025-06-22 16:58:59,155] Trial 35 finished with value: 235.2739179881333 and parameters: {'n_steps': 92, 'batch_size_idx': 0, 'learning_rate': 0.0009759529790398018, 'n_epochs': 12, 'gamma': 0.9434165243420574, 'clip_range': 0.1088763382920534, 'ent_coef': 2.4756899020216793e-05, 'vf_coef': 0.624446055933163, 'max_grad_norm': 3.548513064940947, 'gae_lambda': 0.9212377678779937, 'n_layers': 3, 'layer_size': 192, 'activation_fn': 'leaky_relu'}. Best is trial 5 with value: 493.25398839203456.
Tuning PPO:  72%|███████████████████████████████████████████████████████████████████████████████████████████████████████████▎                                         | 36/50 [20:38:25<5:21:25, 1377.52s/it, best_value=493.25]Starting MATLAB engine...
Using device: cuda
Deleted temporary model file: C:\Users\benva\AppData\Local\Temp\PendCart_2c9dab43.slx
Deleted: C:\Users\benva\OneDrive\Documents\MATLAB\full_wrap\PendCart_2c9dab43.slxc
[I 2025-06-22 18:49:37,179] Trial 36 finished with value: 448.02015474374474 and parameters: {'n_steps': 101, 'batch_size_idx': 0, 'learning_rate': 0.0009394116460557418, 'n_epochs': 10, 'gamma': 0.9544476428404708, 'clip_range': 0.3648906455300904, 'ent_coef': 2.7237477959561666e-05, 'vf_coef': 0.834489860356228, 'max_grad_norm': 1.5546300646573958, 'gae_lambda': 0.9130401994189334, 'n_layers': 3, 'layer_size': 81, 'activation_fn': 'tanh'}. Best is trial 5 with value: 493.25398839203456.
Tuning PPO:  74%|█████████████████████████████████████████████████████████████████████████████████████████████████████████████▌                                      | 37/50 [22:29:03<10:40:23, 2955.67s/it, best_value=493.25]Starting MATLAB engine...
Using device: cuda
Deleted temporary model file: C:\Users\benva\AppData\Local\Temp\PendCart_da96b1b9.slx
Deleted: C:\Users\benva\OneDrive\Documents\MATLAB\full_wrap\PendCart_da96b1b9.slxc
[I 2025-06-22 19:20:07,672] Trial 37 finished with value: 352.17136433969745 and parameters: {'n_steps': 114, 'batch_size_idx': 1, 'learning_rate': 0.0008819024221147096, 'n_epochs': 10, 'gamma': 0.9497389171564847, 'clip_range': 0.36969987441997243, 'ent_coef': 1.8703796449302308e-08, 'vf_coef': 0.8369733954541255, 'max_grad_norm': 4.983767622242588, 'gae_lambda': 0.9104779092603508, 'n_layers': 3, 'layer_size': 89, 'activation_fn': 'leaky_relu'}. Best is trial 5 with value: 493.25398839203456.
Tuning PPO:  76%|█████████████████████████████████████████████████████████████████████████████████████████████████████████████████▏                                   | 38/50 [22:59:34<8:43:37, 2618.12s/it, best_value=493.25]Starting MATLAB engine...
Using device: cuda
Deleted temporary model file: C:\Users\benva\AppData\Local\Temp\PendCart_db9c0f3c.slx
Deleted: C:\Users\benva\OneDrive\Documents\MATLAB\full_wrap\PendCart_db9c0f3c.slxc
[I 2025-06-22 19:34:16,495] Trial 40 finished with value: 160.3967646424623 and parameters: {'n_steps': 124, 'batch_size_idx': 0, 'learning_rate': 0.0009576611484239921, 'n_epochs': 10, 'gamma': 0.9525194186549054, 'clip_range': 0.36447269610531696, 'ent_coef': 5.554850748798747e-06, 'vf_coef': 0.8353578463051654, 'max_grad_norm': 1.6824901807848816, 'gae_lambda': 0.9395387925128234, 'n_layers': 3, 'layer_size': 90, 'activation_fn': 'tanh'}. Best is trial 5 with value: 493.25398839203456.
Tuning PPO:  78%|████████████████████████████████████████████████████████████████████████████████████████████████████████████████████▏                                | 39/50 [23:13:42<6:22:40, 2087.33s/it, best_value=493.25]Starting MATLAB engine...
Using device: cuda
Deleted temporary model file: C:\Users\benva\AppData\Local\Temp\PendCart_3881aa8c.slx
Deleted: C:\Users\benva\OneDrive\Documents\MATLAB\full_wrap\PendCart_3881aa8c.slxc
[I 2025-06-22 19:39:47,048] Trial 38 finished with value: 307.53153635144776 and parameters: {'n_steps': 117, 'batch_size_idx': 0, 'learning_rate': 0.000887088346888315, 'n_epochs': 10, 'gamma': 0.9508618607690579, 'clip_range': 0.37202429604435433, 'ent_coef': 4.938558946977681e-06, 'vf_coef': 0.8366074024561339, 'max_grad_norm': 1.524494697891015, 'gae_lambda': 0.9242812416530057, 'n_layers': 3, 'layer_size': 86, 'activation_fn': 'leaky_relu'}. Best is trial 5 with value: 493.25398839203456.
Tuning PPO:  80%|███████████████████████████████████████████████████████████████████████████████████████████████████████████████████████▏                             | 40/50 [23:19:13<4:20:02, 1560.30s/it, best_value=493.25]Starting MATLAB engine...
Using device: cuda
Deleted temporary model file: C:\Users\benva\AppData\Local\Temp\PendCart_ab9c315b.slx
Deleted: C:\Users\benva\OneDrive\Documents\MATLAB\full_wrap\PendCart_ab9c315b.slxc
[I 2025-06-22 19:49:42,287] Trial 39 finished with value: 390.8037304699653 and parameters: {'n_steps': 123, 'batch_size_idx': 0, 'learning_rate': 0.0007487734187693498, 'n_epochs': 10, 'gamma': 0.9511232553134038, 'clip_range': 0.3688656284113892, 'ent_coef': 1.3510614645893713e-08, 'vf_coef': 0.8355333761762356, 'max_grad_norm': 1.6847206248199078, 'gae_lambda': 0.9143984194969549, 'n_layers': 3, 'layer_size': 88, 'activation_fn': 'tanh'}. Best is trial 5 with value: 493.25398839203456.
Tuning PPO:  82%|██████████████████████████████████████████████████████████████████████████████████████████████████████████████████████████▏                          | 41/50 [23:29:08<3:10:37, 1270.78s/it, best_value=493.25]Starting MATLAB engine...
Using device: cuda
Deleted temporary model file: C:\Users\benva\AppData\Local\Temp\PendCart_0d3bb0fe.slx
Deleted: C:\Users\benva\OneDrive\Documents\MATLAB\full_wrap\PendCart_0d3bb0fe.slxc
[I 2025-06-22 20:37:34,175] Trial 41 finished with value: 488.4060226409679 and parameters: {'n_steps': 124, 'batch_size_idx': 0, 'learning_rate': 0.0007374552642050407, 'n_epochs': 10, 'gamma': 0.9546060775635582, 'clip_range': 0.3730038662636537, 'ent_coef': 1.0742801050698325e-08, 'vf_coef': 0.8321256473332729, 'max_grad_norm': 1.4547553713179961, 'gae_lambda': 0.9087408376198003, 'n_layers': 1, 'layer_size': 90, 'activation_fn': 'tanh'}. Best is trial 5 with value: 493.25398839203456.
Tuning PPO:  84%|█████████████████████████████████████████████████████████████████████████████████████████████████████████████████████████████▏                       | 42/50 [24:17:00<3:53:28, 1751.11s/it, best_value=493.25]Starting MATLAB engine...
Using device: cuda
Deleted temporary model file: C:\Users\benva\AppData\Local\Temp\PendCart_e98dfbe4.slx
Deleted: C:\Users\benva\OneDrive\Documents\MATLAB\full_wrap\PendCart_e98dfbe4.slxc
[I 2025-06-22 22:14:47,364] Trial 43 finished with value: 16.403260928538593 and parameters: {'n_steps': 124, 'batch_size_idx': 0, 'learning_rate': 0.0007063175422364967, 'n_epochs': 13, 'gamma': 0.9542379743827325, 'clip_range': 0.3251660890637262, 'ent_coef': 5.825616277516814e-06, 'vf_coef': 0.6656090738473643, 'max_grad_norm': 1.9386523022896707, 'gae_lambda': 0.927878885547957, 'n_layers': 3, 'layer_size': 214, 'activation_fn': 'tanh'}. Best is trial 5 with value: 493.25398839203456.
Tuning PPO:  86%|████████████████████████████████████████████████████████████████████████████████████████████████████████████████████████████████▏                    | 43/50 [25:54:13<5:47:10, 2975.73s/it, best_value=493.25]Starting MATLAB engine...
Using device: cuda
Deleted temporary model file: C:\Users\benva\AppData\Local\Temp\PendCart_345f1a58.slx
Deleted: C:\Users\benva\OneDrive\Documents\MATLAB\full_wrap\PendCart_345f1a58.slxc
