PS C:\Users\benva\OneDrive\Documents\MATLAB> myenv\Scripts\Activate.ps1
(myenv) PS C:\Users\benva\OneDrive\Documents\MATLAB> cd .\full_wrap\
(myenv) PS C:\Users\benva\OneDrive\Documents\MATLAB\full_wrap> python .\hyperparameter_tuning.py
Starting hyperparameter tuning...

==================================================
Tuning hyperparameters for PPO...
==================================================


Tuning PPO with 6 parallel workers
[I 2025-06-21 20:20:33,542] A new study created in memory with name: no-name-9e0505f7-e467-402e-bd20-a859f53e305e
Tuning PPO:   0%|                                                                                                                                                                                        | 0/50 [00:00<?, ?it/s]Starting MATLAB engine...
Starting MATLAB engine...
Starting MATLAB engine...
Starting MATLAB engine...
Starting MATLAB engine...Starting MATLAB engine...

Using device: cudaUsing device: cuda
Using device: cudaUsing device: cuda
Using device: cuda


Using device: cuda
C:\Users\benva\OneDrive\Documents\MATLAB\myenv\Lib\site-packages\stable_baselines3\common\vec_env\patch_gym.py:49: UserWarning: You provided an OpenAI Gym environment. We strongly recommend transitioning to Gymnasium environments. Stable-Baselines3 is automatically wrapping your environments in a compatibility layer, which could potentially cause issues.
  warnings.warn(
C:\Users\benva\OneDrive\Documents\MATLAB\myenv\Lib\site-packages\stable_baselines3\common\on_policy_algorithm.py:150: UserWarning: You are trying to run PPO on the GPU, but it is primarily intended to run on the CPU when not using a CNN policy (you are using ActorCriticPolicy which should be a MlpPolicy). See https://github.com/DLR-RM/stable-baselines3/issues/1245 for more info. You can pass `device='cpu'` or `export CUDA_VISIBLE_DEVICES=` to force using the CPU.Note: The model will train, but the GPU utilization will be poor and the training might take longer than on CPU.
  warnings.warn(
Deleted temporary model file: C:\Users\benva\AppData\Local\Temp\PendCart_7c24fc4e.slx
Deleted: C:\Users\benva\OneDrive\Documents\MATLAB\full_wrap\PendCart_7c24fc4e.slxc
[I 2025-06-21 23:32:05,434] Trial 1 finished with value: 18.248035285666962 and parameters: {'n_steps': 103, 'batch_size_idx': 0, 'learning_rate': 2.398033136975362e-05, 'n_epochs': 20, 'gamma': 0.9453738332494873, 'clip_range': 0.3415262127647196, 'ent_coef': 3.8961902186704226e-07, 'vf_coef': 0.4987968812926751, 'max_grad_norm': 2.789855231893271, 'gae_lambda': 0.9791258357669668, 'n_layers': 1, 'layer_size': 227, 'activation_fn': 'leaky_relu'}. Best is trial 1 with value: 18.248035285666962.
Tuning PPO:   2%|██▉                                                                                                                                                  | 1/50 [3:11:31<156:25:02, 11491.89s/it, best_value=18.25]Starting MATLAB engine...
Using device: cuda
C:\Users\benva\OneDrive\Documents\MATLAB\myenv\Lib\site-packages\stable_baselines3\common\vec_env\patch_gym.py:49: UserWarning: You provided an OpenAI Gym environment. We strongly recommend transitioning to Gymnasium environments. Stable-Baselines3 is automatically wrapping your environments in a compatibility layer, which could potentially cause issues.
  warnings.warn(
Deleted temporary model file: C:\Users\benva\AppData\Local\Temp\PendCart_159bc889.slx
Deleted: C:\Users\benva\OneDrive\Documents\MATLAB\full_wrap\PendCart_159bc889.slxc
[I 2025-06-21 23:33:29,243] Trial 4 finished with value: 14.237310343717278 and parameters: {'n_steps': 138, 'batch_size_idx': 2, 'learning_rate': 1.5784152295544692e-05, 'n_epochs': 18, 'gamma': 0.913793158249108, 'clip_range': 0.3433802396951131, 'ent_coef': 0.09838686559285954, 'vf_coef': 0.49045868352872857, 'max_grad_norm': 3.121761737292541, 'gae_lambda': 0.841013931685639, 'n_layers': 2, 'layer_size': 199, 'activation_fn': 'relu'}. Best is trial 1 with value: 18.248035285666962.
Tuning PPO:   4%|██████                                                                                                                                                 | 2/50 [3:12:55<63:45:00, 4781.25s/it, best_value=18.25]Starting MATLAB engine...
Using device: cuda
Deleted temporary model file: C:\Users\benva\AppData\Local\Temp\PendCart_f2fe6c39.slx
Deleted: C:\Users\benva\OneDrive\Documents\MATLAB\full_wrap\PendCart_f2fe6c39.slxc
[I 2025-06-21 23:42:54,158] Trial 0 finished with value: 265.31621693624044 and parameters: {'n_steps': 68, 'batch_size_idx': 1, 'learning_rate': 0.000344580194153308, 'n_epochs': 4, 'gamma': 0.9479956062170828, 'clip_range': 0.13195201626331293, 'ent_coef': 1.0974275204517842e-05, 'vf_coef': 0.6245891170378073, 'max_grad_norm': 2.4987564934099336, 'gae_lambda': 0.9381761664814343, 'n_layers': 3, 'layer_size': 249, 'activation_fn': 'tanh'}. Best is trial 0 with value: 265.31621693624044.
Tuning PPO:   6%|█████████                                                                                                                                             | 3/50 [3:22:20<37:17:11, 2855.98s/it, best_value=265.32]Starting MATLAB engine...
Deleted temporary model file: C:\Users\benva\AppData\Local\Temp\PendCart_1bdf1a14.slx
Deleted: C:\Users\benva\OneDrive\Documents\MATLAB\full_wrap\PendCart_1bdf1a14.slxc
[I 2025-06-21 23:42:56,338] Trial 2 finished with value: 120.92041613203617 and parameters: {'n_steps': 2035, 'batch_size_idx': 3, 'learning_rate': 0.0006105216691569955, 'n_epochs': 15, 'gamma': 0.9101586192303078, 'clip_range': 0.13836283103967736, 'ent_coef': 7.792850381089296e-06, 'vf_coef': 0.1895406814252822, 'max_grad_norm': 2.3834305978077084, 'gae_lambda': 0.9072611031283853, 'n_layers': 3, 'layer_size': 210, 'activation_fn': 'relu'}. Best is trial 0 with value: 265.31621693624044.
Tuning PPO:   8%|████████████                                                                                                                                          | 4/50 [3:22:22<22:05:49, 1729.33s/it, best_value=265.32]Starting MATLAB engine...
Using device: cuda
Using device: cuda
Deleted temporary model file: C:\Users\benva\AppData\Local\Temp\PendCart_10135c40.slx
Deleted: C:\Users\benva\OneDrive\Documents\MATLAB\full_wrap\PendCart_10135c40.slxc
[I 2025-06-21 23:58:55,315] Trial 3 finished with value: 398.4664151357892 and parameters: {'n_steps': 110, 'batch_size_idx': 0, 'learning_rate': 0.0001549982552170471, 'n_epochs': 5, 'gamma': 0.9572089409780564, 'clip_range': 0.37557762758006774, 'ent_coef': 3.920408771733461e-08, 'vf_coef': 0.8091914122581415, 'max_grad_norm': 0.459116465951192, 'gae_lambda': 0.9000567266522909, 'n_layers': 2, 'layer_size': 114, 'activation_fn': 'tanh'}. Best is trial 3 with value: 398.4664151357892.
Tuning PPO:  10%|███████████████                                                                                                                                       | 5/50 [3:38:21<18:08:39, 1451.54s/it, best_value=398.47]Starting MATLAB engine...
Using device: cuda
Deleted temporary model file: C:\Users\benva\AppData\Local\Temp\PendCart_a920e83b.slx
Deleted: C:\Users\benva\OneDrive\Documents\MATLAB\full_wrap\PendCart_a920e83b.slxc
[I 2025-06-22 00:09:17,407] Trial 5 finished with value: 493.25398839203456 and parameters: {'n_steps': 86, 'batch_size_idx': 0, 'learning_rate': 0.0001754229079135003, 'n_epochs': 6, 'gamma': 0.9007656486132167, 'clip_range': 0.20990024249457842, 'ent_coef': 9.534909829230192e-07, 'vf_coef': 0.7149510416119175, 'max_grad_norm': 1.2193287556400725, 'gae_lambda': 0.82669656416611, 'n_layers': 2, 'layer_size': 243, 'activation_fn': 'elu'}. Best is trial 5 with value: 493.25398839203456.
Tuning PPO:  12%|██████████████████                                                                                                                                    | 6/50 [3:48:43<14:17:39, 1169.53s/it, best_value=493.25]Starting MATLAB engine...
Using device: cuda
Deleted temporary model file: C:\Users\benva\AppData\Local\Temp\PendCart_3fc4e3cf.slx
Deleted: C:\Users\benva\OneDrive\Documents\MATLAB\full_wrap\PendCart_3fc4e3cf.slxc
[I 2025-06-22 02:54:39,106] Trial 6 finished with value: 166.52305443720806 and parameters: {'n_steps': 1189, 'batch_size_idx': 0, 'learning_rate': 0.0008470241996672729, 'n_epochs': 12, 'gamma': 0.9069487836501168, 'clip_range': 0.27634418131845484, 'ent_coef': 2.5974645760412395e-07, 'vf_coef': 0.3722210088703116, 'max_grad_norm': 3.1714401392726974, 'gae_lambda': 0.9435432257934516, 'n_layers': 2, 'layer_size': 107, 'activation_fn': 'tanh'}. Best is trial 5 with value: 493.25398839203456.
Tuning PPO:  14%|█████████████████████                                                                                                                                 | 7/50 [6:34:05<48:08:45, 4030.82s/it, best_value=493.25]Starting MATLAB engine...
Using device: cuda
Deleted temporary model file: C:\Users\benva\AppData\Local\Temp\PendCart_2854d20c.slx
Deleted: C:\Users\benva\OneDrive\Documents\MATLAB\full_wrap\PendCart_2854d20c.slxc
[I 2025-06-22 03:09:29,945] Trial 10 finished with value: 15.689384679203659 and parameters: {'n_steps': 494, 'batch_size_idx': 2, 'learning_rate': 2.1410865887018875e-05, 'n_epochs': 19, 'gamma': 0.9839145332324104, 'clip_range': 0.2386820364306174, 'ent_coef': 3.364685454747484e-05, 'vf_coef': 0.36976522560752034, 'max_grad_norm': 2.1210613252152264, 'gae_lambda': 0.884303191159174, 'n_layers': 2, 'layer_size': 243, 'activation_fn': 'relu'}. Best is trial 5 with value: 493.25398839203456.
Tuning PPO:  16%|████████████████████████                                                                                                                              | 8/50 [6:48:56<35:21:50, 3031.20s/it, best_value=493.25]Starting MATLAB engine...
Using device: cuda
Deleted temporary model file: C:\Users\benva\AppData\Local\Temp\PendCart_81f684b0.slx
Deleted: C:\Users\benva\OneDrive\Documents\MATLAB\full_wrap\PendCart_81f684b0.slxc
[I 2025-06-22 03:14:09,059] Trial 7 finished with value: 336.9451720502828 and parameters: {'n_steps': 598, 'batch_size_idx': 0, 'learning_rate': 2.8171971512370763e-05, 'n_epochs': 19, 'gamma': 0.90718571385473, 'clip_range': 0.2458752620741031, 'ent_coef': 0.00016299715108069148, 'vf_coef': 0.30626946115532083, 'max_grad_norm': 0.46106515739637755, 'gae_lambda': 0.9209530363110074, 'n_layers': 3, 'layer_size': 51, 'activation_fn': 'tanh'}. Best is trial 5 with value: 493.25398839203456.
Tuning PPO:  18%|███████████████████████████                                                                                                                           | 9/50 [6:53:35<24:43:25, 2170.85s/it, best_value=493.25]Starting MATLAB engine...
Using device: cuda
Deleted temporary model file: C:\Users\benva\AppData\Local\Temp\PendCart_594703f0.slx
Deleted: C:\Users\benva\OneDrive\Documents\MATLAB\full_wrap\PendCart_594703f0.slxc
[I 2025-06-22 03:18:36,548] Trial 11 finished with value: 13.753866369409781 and parameters: {'n_steps': 346, 'batch_size_idx': 0, 'learning_rate': 1.1244870157541388e-05, 'n_epochs': 11, 'gamma': 0.9051715794932897, 'clip_range': 0.3351437387460709, 'ent_coef': 0.0013343725711980061, 'vf_coef': 0.52223321378597, 'max_grad_norm': 1.6369558958045145, 'gae_lambda': 0.9377594860427584, 'n_layers': 3, 'layer_size': 243, 'activation_fn': 'tanh'}. Best is trial 5 with value: 493.25398839203456.
Tuning PPO:  20%|█████████████████████████████▊                                                                                                                       | 10/50 [6:58:03<17:35:29, 1583.25s/it, best_value=493.25]Starting MATLAB engine...
Deleted temporary model file: C:\Users\benva\AppData\Local\Temp\PendCart_6848863a.slx
Deleted: C:\Users\benva\OneDrive\Documents\MATLAB\full_wrap\PendCart_6848863a.slxc
[I 2025-06-22 03:18:47,903] Trial 8 finished with value: 333.91515455572045 and parameters: {'n_steps': 372, 'batch_size_idx': 1, 'learning_rate': 0.0004249263985446119, 'n_epochs': 18, 'gamma': 0.9646168963099688, 'clip_range': 0.3000957140646994, 'ent_coef': 2.5274045059461766e-05, 'vf_coef': 0.42585953372688135, 'max_grad_norm': 2.7617616807050775, 'gae_lambda': 0.8558558765808437, 'n_layers': 1, 'layer_size': 32, 'activation_fn': 'leaky_relu'}. Best is trial 5 with value: 493.25398839203456.
Tuning PPO:  22%|████████████████████████████████▊                                                                                                                    | 11/50 [6:58:14<11:56:24, 1102.17s/it, best_value=493.25]Starting MATLAB engine...
Using device: cuda
Using device: cuda
Deleted temporary model file: C:\Users\benva\AppData\Local\Temp\PendCart_fc00b904.slx
Deleted: C:\Users\benva\OneDrive\Documents\MATLAB\full_wrap\PendCart_fc00b904.slxc
[I 2025-06-22 03:26:15,647] Trial 9 finished with value: 440.48027143157435 and parameters: {'n_steps': 263, 'batch_size_idx': 0, 'learning_rate': 0.0005762226012035106, 'n_epochs': 13, 'gamma': 0.9359661982067855, 'clip_range': 0.35798381833050286, 'ent_coef': 1.0447044132870427e-05, 'vf_coef': 0.23318703738900273, 'max_grad_norm': 3.782806033422479, 'gae_lambda': 0.9358721721147181, 'n_layers': 2, 'layer_size': 110, 'activation_fn': 'relu'}. Best is trial 5 with value: 493.25398839203456.
Tuning PPO:  24%|████████████████████████████████████▏                                                                                                                  | 12/50 [7:05:42<9:31:57, 903.08s/it, best_value=493.25]Starting MATLAB engine...
Using device: cuda
Deleted temporary model file: C:\Users\benva\AppData\Local\Temp\PendCart_8e4fbae8.slx
Deleted: C:\Users\benva\OneDrive\Documents\MATLAB\full_wrap\PendCart_8e4fbae8.slxc
[I 2025-06-22 06:06:48,370] Trial 12 finished with value: 15.137492012383461 and parameters: {'n_steps': 485, 'batch_size_idx': 1, 'learning_rate': 1.8597056505747294e-05, 'n_epochs': 8, 'gamma': 0.9111147568773995, 'clip_range': 0.23034100227574109, 'ent_coef': 0.0031814207554664467, 'vf_coef': 0.5036229595963903, 'max_grad_norm': 3.0439960836195263, 'gae_lambda': 0.862288877480758, 'n_layers': 3, 'layer_size': 246, 'activation_fn': 'elu'}. Best is trial 5 with value: 493.25398839203456.
Tuning PPO:  26%|██████████████████████████████████████▋                                                                                                              | 13/50 [9:46:14<36:27:41, 3547.60s/it, best_value=493.25]Starting MATLAB engine...
Using device: cuda
Deleted temporary model file: C:\Users\benva\AppData\Local\Temp\PendCart_084d8ca8.slx
Deleted: C:\Users\benva\OneDrive\Documents\MATLAB\full_wrap\PendCart_084d8ca8.slxc
[I 2025-06-22 06:23:38,187] Trial 13 finished with value: 15.699319516246637 and parameters: {'n_steps': 404, 'batch_size_idx': 0, 'learning_rate': 5.550634159959547e-05, 'n_epochs': 11, 'gamma': 0.9674039914711573, 'clip_range': 0.2512610163487655, 'ent_coef': 0.00015178581623156016, 'vf_coef': 0.6625211069350314, 'max_grad_norm': 3.026322566026904, 'gae_lambda': 0.8169715523106259, 'n_layers': 2, 'layer_size': 48, 'activation_fn': 'elu'}. Best is trial 5 with value: 493.25398839203456.
Tuning PPO:  28%|█████████████████████████████████████████▍                                                                                                          | 14/50 [10:03:04<27:48:38, 2781.07s/it, best_value=493.25]Starting MATLAB engine...
Using device: cuda
Deleted temporary model file: C:\Users\benva\AppData\Local\Temp\PendCart_b49cc854.slx
Deleted: C:\Users\benva\OneDrive\Documents\MATLAB\full_wrap\PendCart_b49cc854.slxc
[I 2025-06-22 06:27:26,350] Trial 14 finished with value: 12.961373940729732 and parameters: {'n_steps': 386, 'batch_size_idx': 1, 'learning_rate': 4.622061900154521e-05, 'n_epochs': 7, 'gamma': 0.9009266169447792, 'clip_range': 0.35009356941285896, 'ent_coef': 9.732908829868678e-06, 'vf_coef': 0.1427315763811477, 'max_grad_norm': 2.8225478423136328, 'gae_lambda': 0.8725955017672888, 'n_layers': 2, 'layer_size': 74, 'activation_fn': 'elu'}. Best is trial 5 with value: 493.25398839203456.
Tuning PPO:  30%|████████████████████████████████████████████▍                                                                                                       | 15/50 [10:06:52<19:33:23, 2011.54s/it, best_value=493.25]Starting MATLAB engine...
Using device: cuda
Deleted temporary model file: C:\Users\benva\AppData\Local\Temp\PendCart_e74ee394.slx
Deleted: C:\Users\benva\OneDrive\Documents\MATLAB\full_wrap\PendCart_e74ee394.slxc
[I 2025-06-22 06:30:48,890] Trial 16 finished with value: 18.017503399000226 and parameters: {'n_steps': 155, 'batch_size_idx': 0, 'learning_rate': 0.00012396894883910656, 'n_epochs': 4, 'gamma': 0.9319630639591954, 'clip_range': 0.19361350095135604, 'ent_coef': 2.400854450123169e-08, 'vf_coef': 0.8807941471084253, 'max_grad_norm': 0.4863488228363435, 'gae_lambda': 0.8001859387604058, 'n_layers': 2, 'layer_size': 148, 'activation_fn': 'elu'}. Best is trial 5 with value: 493.25398839203456.
Tuning PPO:  32%|███████████████████████████████████████████████▎                                                                                                    | 16/50 [10:10:15<13:51:19, 1467.03s/it, best_value=493.25]Starting MATLAB engine...
Using device: cuda
Deleted temporary model file: C:\Users\benva\AppData\Local\Temp\PendCart_10e99d64.slx
Deleted: C:\Users\benva\OneDrive\Documents\MATLAB\full_wrap\PendCart_10e99d64.slxc
[I 2025-06-22 06:37:04,604] Trial 17 finished with value: 27.80163226988271 and parameters: {'n_steps': 202, 'batch_size_idx': 0, 'learning_rate': 0.00013766700871867472, 'n_epochs': 8, 'gamma': 0.929399941594069, 'clip_range': 0.18301400479048324, 'ent_coef': 6.853261516648249e-07, 'vf_coef': 0.9070995560172803, 'max_grad_norm': 4.617524978773561, 'gae_lambda': 0.8099951744866398, 'n_layers': 1, 'layer_size': 166, 'activation_fn': 'elu'}. Best is trial 5 with value: 493.25398839203456.
Tuning PPO:  34%|██████████████████████████████████████████████████▎                                                                                                 | 17/50 [10:16:31<10:26:22, 1138.87s/it, best_value=493.25]Starting MATLAB engine...
Using device: cuda
Deleted temporary model file: C:\Users\benva\AppData\Local\Temp\PendCart_50d1778a.slx
Deleted: C:\Users\benva\OneDrive\Documents\MATLAB\full_wrap\PendCart_50d1778a.slxc
[I 2025-06-22 06:37:51,976] Trial 15 finished with value: 133.1365781406219 and parameters: {'n_steps': 174, 'batch_size_idx': 0, 'learning_rate': 0.00011811700812998108, 'n_epochs': 4, 'gamma': 0.9317911880653982, 'clip_range': 0.2097511184484854, 'ent_coef': 2.4881172611952374e-08, 'vf_coef': 0.8911878175391033, 'max_grad_norm': 0.4710123294825679, 'gae_lambda': 0.82815119078939, 'n_layers': 2, 'layer_size': 149, 'activation_fn': 'elu'}. Best is trial 5 with value: 493.25398839203456.
Tuning PPO:  36%|██████████████████████████████████████████████████████                                                                                                | 18/50 [10:17:18<7:12:28, 810.89s/it, best_value=493.25]Starting MATLAB engine...
Using device: cuda
Deleted temporary model file: C:\Users\benva\AppData\Local\Temp\PendCart_1802d561.slx
Deleted: C:\Users\benva\OneDrive\Documents\MATLAB\full_wrap\PendCart_1802d561.slxc
[I 2025-06-22 09:18:37,495] Trial 18 finished with value: 46.75103529137733 and parameters: {'n_steps': 208, 'batch_size_idx': 0, 'learning_rate': 0.000143810275580116, 'n_epochs': 9, 'gamma': 0.9244207884583322, 'clip_range': 0.17118233577249864, 'ent_coef': 7.204205755778339e-07, 'vf_coef': 0.9865860217129554, 'max_grad_norm': 4.674866394055471, 'gae_lambda': 0.8150507804016321, 'n_layers': 1, 'layer_size': 166, 'activation_fn': 'elu'}. Best is trial 5 with value: 493.25398839203456.
Tuning PPO:  38%|████████████████████████████████████████████████████████▏                                                                                           | 19/50 [12:58:03<29:49:53, 3464.30s/it, best_value=493.25]Starting MATLAB engine...
Using device: cuda
Deleted temporary model file: C:\Users\benva\AppData\Local\Temp\PendCart_aa621053.slx
Deleted: C:\Users\benva\OneDrive\Documents\MATLAB\full_wrap\PendCart_aa621053.slxc
[I 2025-06-22 09:34:54,634] Trial 19 finished with value: 14.094515837582133 and parameters: {'n_steps': 199, 'batch_size_idx': 0, 'learning_rate': 0.00018255920786486995, 'n_epochs': 8, 'gamma': 0.9302299381779997, 'clip_range': 0.1826131198589085, 'ent_coef': 1.588407888776549e-06, 'vf_coef': 0.9891715275406825, 'max_grad_norm': 4.678215699055209, 'gae_lambda': 0.9964693067444721, 'n_layers': 1, 'layer_size': 153, 'activation_fn': 'elu'}. Best is trial 5 with value: 493.25398839203456.
Tuning PPO:  40%|███████████████████████████████████████████████████████████▏                                                                                        | 20/50 [13:14:21<22:38:46, 2717.56s/it, best_value=493.25]Starting MATLAB engine...
Using device: cuda
Deleted temporary model file: C:\Users\benva\AppData\Local\Temp\PendCart_178dfe22.slx
Deleted: C:\Users\benva\OneDrive\Documents\MATLAB\full_wrap\PendCart_178dfe22.slxc
