[I 2025-06-18 08:21:46,739] Trial 35 finished with value: 494.72324876174537 and parameters: {'learning_rate': 0.0005551420121226357, 'buffer_size': 165140, 'batch_size': 440, 'tau': 0.012033205357514377, 'gamma': 0.9539758142018389, 'ent_coef': 0.001, 'n_layers': 2, 'layer_size': 87, 'activation_fn': 'elu'}. Best is trial 19 with value: 496.3737265343487.
Starting MATLAB engine...
Using device: cuda
Deleted temporary model file: C:\Users\benva\AppData\Local\Temp\PendCart_2bfe388a.slx
Deleted: C:\Users\benva\OneDrive\Documents\MATLAB\full_wrap\PendCart_2bfe388a.slxc
[I 2025-06-18 09:42:42,406] Trial 36 finished with value: 494.393238006105 and parameters: {'learning_rate': 0.0005648949691923782, 'buffer_size': 161812, 'batch_size': 416, 'tau': 0.011880669489250418, 'gamma': 0.9811730180646615, 'ent_coef': 0.01, 'n_layers': 2, 'layer_size': 227, 'activation_fn': 'relu'}. Best is trial 19 with value: 496.3737265343487.
Starting MATLAB engine...
Using device: cuda
Deleted temporary model file: C:\Users\benva\AppData\Local\Temp\PendCart_e77eea04.slx
Deleted: C:\Users\benva\OneDrive\Documents\MATLAB\full_wrap\PendCart_e77eea04.slxc
[I 2025-06-18 09:50:09,473] Trial 37 finished with value: 475.35471337119196 and parameters: {'learning_rate': 0.0005906895694966814, 'buffer_size': 184966, 'batch_size': 434, 'tau': 0.00874999291554771, 'gamma': 0.9861704745441354, 'ent_coef': 0.01, 'n_layers': 2, 'layer_size': 223, 'activation_fn': 'relu'}. Best is trial 19 with value: 496.3737265343487.
Starting MATLAB engine...
Using device: cuda
Deleted temporary model file: C:\Users\benva\AppData\Local\Temp\PendCart_69dd425d.slx
Deleted: C:\Users\benva\OneDrive\Documents\MATLAB\full_wrap\PendCart_69dd425d.slxc
[I 2025-06-18 10:05:08,839] Trial 38 finished with value: 496.58817270056363 and parameters: {'learning_rate': 0.00026204739487281235, 'buffer_size': 185774, 'batch_size': 437, 'tau': 0.007548062404301567, 'gamma': 0.9645566858284886, 'ent_coef': 0.01, 'n_layers': 2, 'layer_size': 224, 'activation_fn': 'relu'}. Best is trial 38 with value: 496.58817270056363.
Starting MATLAB engine...
Using device: cuda
Deleted temporary model file: C:\Users\benva\AppData\Local\Temp\PendCart_c8463d96.slx
Deleted: C:\Users\benva\OneDrive\Documents\MATLAB\full_wrap\PendCart_c8463d96.slxc
[I 2025-06-18 10:29:25,626] Trial 40 finished with value: 447.5701530893449 and parameters: {'learning_rate': 0.0002571173679088708, 'buffer_size': 185523, 'batch_size': 371, 'tau': 0.017436087344457316, 'gamma': 0.9655087447302513, 'ent_coef': 0.01, 'n_layers': 2, 'layer_size': 228, 'activation_fn': 'relu'}. Best is trial 38 with value: 496.58817270056363.
Starting MATLAB engine...
Deleted temporary model file: C:\Users\benva\AppData\Local\Temp\PendCart_6f83d9d4.slx
Deleted: C:\Users\benva\OneDrive\Documents\MATLAB\full_wrap\PendCart_6f83d9d4.slxc
[I 2025-06-18 10:29:47,738] Trial 39 finished with value: 444.3886360643208 and parameters: {'learning_rate': 0.00024106087889346837, 'buffer_size': 187396, 'batch_size': 360, 'tau': 0.0173094354991968, 'gamma': 0.9651602841133277, 'ent_coef': 0.01, 'n_layers': 2, 'layer_size': 220, 'activation_fn': 'relu'}. Best is trial 38 with value: 496.58817270056363.
Starting MATLAB engine...
Using device: cuda
Using device: cuda
Deleted temporary model file: C:\Users\benva\AppData\Local\Temp\PendCart_c922e1bf.slx
Deleted: C:\Users\benva\OneDrive\Documents\MATLAB\full_wrap\PendCart_c922e1bf.slxc
[I 2025-06-18 10:41:16,443] Trial 41 finished with value: 448.7208106312023 and parameters: {'learning_rate': 0.0003099776047678176, 'buffer_size': 188223, 'batch_size': 367, 'tau': 0.017433290686833493, 'gamma': 0.9642917523158698, 'ent_coef': 0.01, 'n_layers': 1, 'layer_size': 236, 'activation_fn': 'relu'}. Best is trial 38 with value: 496.58817270056363.
Starting MATLAB engine...
Using device: cuda
Deleted temporary model file: C:\Users\benva\AppData\Local\Temp\PendCart_fa4f937c.slx
Deleted: C:\Users\benva\OneDrive\Documents\MATLAB\full_wrap\PendCart_fa4f937c.slxc
[I 2025-06-18 12:14:29,470] Trial 43 finished with value: 399.2277938265024 and parameters: {'learning_rate': 0.0002523164955518116, 'buffer_size': 129987, 'batch_size': 370, 'tau': 0.017472472767942025, 'gamma': 0.9654997843339354, 'ent_coef': 'auto', 'n_layers': 1, 'layer_size': 200, 'activation_fn': 'relu'}. Best is trial 38 with value: 496.58817270056363.
Starting MATLAB engine...
Using device: cuda
Deleted temporary model file: C:\Users\benva\AppData\Local\Temp\PendCart_6baea300.slx
Deleted: C:\Users\benva\OneDrive\Documents\MATLAB\full_wrap\PendCart_6baea300.slxc
[I 2025-06-18 12:16:06,747] Trial 42 finished with value: 474.89022457485027 and parameters: {'learning_rate': 0.0002666733495267179, 'buffer_size': 189131, 'batch_size': 353, 'tau': 0.014406304486825032, 'gamma': 0.9662494281346289, 'ent_coef': 'auto', 'n_layers': 1, 'layer_size': 210, 'activation_fn': 'relu'}. Best is trial 38 with value: 496.58817270056363.
Starting MATLAB engine...
Using device: cuda
Deleted temporary model file: C:\Users\benva\AppData\Local\Temp\PendCart_0b1ebe39.slx
Deleted: C:\Users\benva\OneDrive\Documents\MATLAB\full_wrap\PendCart_0b1ebe39.slxc
[I 2025-06-18 12:30:59,987] Trial 45 finished with value: 145.2137057156533 and parameters: {'learning_rate': 0.00028481117518639593, 'buffer_size': 172659, 'batch_size': 305, 'tau': 0.007097288232785796, 'gamma': 0.9710188189049714, 'ent_coef': 'auto', 'n_layers': 2, 'layer_size': 207, 'activation_fn': 'relu'}. Best is trial 38 with value: 496.58817270056363.
Deleted temporary model file: C:\Users\benva\AppData\Local\Temp\PendCart_674d7067.slx
Deleted: C:\Users\benva\OneDrive\Documents\MATLAB\full_wrap\PendCart_674d7067.slxc
[I 2025-06-18 12:32:00,749] Trial 44 finished with value: 397.6382403042636 and parameters: {'learning_rate': 0.00024898059689451487, 'buffer_size': 172175, 'batch_size': 67, 'tau': 0.017420376610683908, 'gamma': 0.9639550374580916, 'ent_coef': 'auto', 'n_layers': 3, 'layer_size': 211, 'activation_fn': 'tanh'}. Best is trial 38 with value: 496.58817270056363.
Deleted temporary model file: C:\Users\benva\AppData\Local\Temp\PendCart_295627b2.slx
Deleted: C:\Users\benva\OneDrive\Documents\MATLAB\full_wrap\PendCart_295627b2.slxc
[I 2025-06-18 12:44:29,762] Trial 46 finished with value: 306.89043150931957 and parameters: {'learning_rate': 0.00027391317960164446, 'buffer_size': 172429, 'batch_size': 308, 'tau': 0.007145119642453137, 'gamma': 0.9702272757118439, 'ent_coef': 'auto', 'n_layers': 2, 'layer_size': 59, 'activation_fn': 'relu'}. Best is trial 38 with value: 496.58817270056363.
Deleted temporary model file: C:\Users\benva\AppData\Local\Temp\PendCart_dba452f6.slx
Deleted: C:\Users\benva\OneDrive\Documents\MATLAB\full_wrap\PendCart_dba452f6.slxc
[I 2025-06-18 13:05:39,370] Trial 47 finished with value: 494.9440970018227 and parameters: {'learning_rate': 0.0009836358915010217, 'buffer_size': 172746, 'batch_size': 67, 'tau': 0.007000802349170963, 'gamma': 0.9708954955341426, 'ent_coef': 'auto', 'n_layers': 2, 'layer_size': 53, 'activation_fn': 'relu'}. Best is trial 38 with value: 496.58817270056363.
Deleted temporary model file: C:\Users\benva\AppData\Local\Temp\PendCart_7596173a.slx
Deleted: C:\Users\benva\OneDrive\Documents\MATLAB\full_wrap\PendCart_7596173a.slxc
[I 2025-06-18 13:50:40,184] Trial 48 finished with value: 11.768943642069212 and parameters: {'learning_rate': 0.00014269647868036105, 'buffer_size': 167957, 'batch_size': 304, 'tau': 0.010459971447147038, 'gamma': 0.9710677013909634, 'ent_coef': 'auto', 'n_layers': 2, 'layer_size': 55, 'activation_fn': 'tanh'}. Best is trial 38 with value: 496.58817270056363.
Deleted temporary model file: C:\Users\benva\AppData\Local\Temp\PendCart_48330bb9.slx
Deleted: C:\Users\benva\OneDrive\Documents\MATLAB\full_wrap\PendCart_48330bb9.slxc
[I 2025-06-18 14:09:42,617] Trial 49 finished with value: 421.136288579937 and parameters: {'learning_rate': 0.00017508670394327774, 'buffer_size': 174054, 'batch_size': 74, 'tau': 0.00712953800110608, 'gamma': 0.9707001857292512, 'ent_coef': 0.01, 'n_layers': 3, 'layer_size': 60, 'activation_fn': 'tanh'}. Best is trial 38 with value: 496.58817270056363.

Best parameters for sac:
Best value: 496.58817270056363
  learning_rate: 0.00026204739487281235
  buffer_size: 185774
  batch_size: 437
  tau: 0.007548062404301567
  gamma: 0.9645566858284886
  ent_coef: 0.01
  n_layers: 2
  layer_size: 224
  activation_fn: relu
  net_arch: [224, 224]
  activation_fn: relu
(myenv) PS C:\Users\benva\OneDrive\Documents\MATLAB\full_wrap> 0