(myenv) PS C:\Users\benva\OneDrive\Documents\MATLAB\full_wrap> python .\ip_jax_hp.py 
Tuning PPO on JAX env with SB3...
[I 2025-07-15 16:22:28,238] A new study created in RDB with name: jax_ppo_tuning
Tuning PPO:   0%|                                                                                                                                                                                    | 0/50 [00:00<?, ?it/s][I 2025-07-15 16:22:29,043] Trial 2 pruned. 
Tuning PPO:   2%|███▏                                                                                                                                                            | 1/50 [00:00<00:39,  1.25it/s, best_val=–]C:\Users\benva\OneDrive\Documents\MATLAB\myenv\Lib\site-packages\stable_baselines3\common\on_policy_algorithm.py:150: UserWarning: You are trying to run PPO on the GPU, but it is primarily intended to run on the CPU when not using a CNN policy (you are using ActorCriticPolicy which should be a MlpPolicy). See https://github.com/DLR-RM/stable-baselines3/issues/1245 for more info. You can pass `device='cpu'` or `export CUDA_VISIBLE_DEVICES=` to force using the CPU.Note: The model will train, but the GPU utilization will be poor and the training might take longer than on CPU.
  warnings.warn(
[I 2025-07-15 16:25:45,387] Trial 0 pruned. 
Tuning PPO:   4%|██████▎                                                                                                                                                      | 2/50 [03:17<1:32:39, 115.83s/it, best_val=–][I 2025-07-15 16:28:36,768] Trial 5 pruned. 
Tuning PPO:   6%|█████████▍                                                                                                                                                   | 3/50 [06:08<1:50:36, 141.19s/it, best_val=–][I 2025-07-15 16:29:19,914] Trial 3 pruned. 
Tuning PPO:   8%|████████████▌                                                                                                                                                | 4/50 [06:51<1:18:34, 102.49s/it, best_val=–][I 2025-07-15 16:30:12,276] Trial 1 finished with value: 200.14404296875 and parameters: {'n_steps': 512, 'batch_size': 256, 'learning_rate': 0.0012199861357446234, 'n_epochs': 17, 'gamma': 0.9192400323778684, 'clip_range': 0.28269860047948303, 'ent_coef': 0.01888581779278226, 'vf_coef': 0.8153754173066448, 'max_grad_norm': 4.113465008094007, 'gae_lambda': 0.9177330134586039, 'layer_size': 108, 'n_layers': 2, 'activation_fn': 'relu'}. Best is trial 1 with value: 200.14404296875.
Tuning PPO:  10%|███████████████▍                                                                                                                                          | 5/50 [07:44<1:03:18, 84.41s/it, best_val=200.1][I 2025-07-15 16:30:12,336] Trial 8 pruned. 
Tuning PPO:  12%|██████████████████▍                                                                                                                                       | 6/50 [07:44<1:01:54, 84.41s/it, best_val=200.1][I 2025-07-15 16:30:50,733] Trial 4 finished with value: 488.125244140625 and parameters: {'n_steps': 128, 'batch_size': 128, 'learning_rate': 0.0008071590586408081, 'n_epochs': 18, 'gamma': 0.957679292187906, 'clip_range': 0.11587352591931034, 'ent_coef': 0.041244889857443776, 'vf_coef': 0.9080448887085969, 'max_grad_norm': 1.6054702770656428, 'gae_lambda': 0.8251678850789558, 'layer_size': 95, 'n_layers': 1, 'activation_fn': 'tanh'}. Best is trial 4 with value: 488.125244140625.
Tuning PPO:  14%|█████████████████████▊                                                                                                                                      | 7/50 [08:22<36:47, 51.33s/it, best_val=488.1][I 2025-07-15 16:31:46,763] Trial 6 pruned. 
Tuning PPO:  16%|████████████████████████▉                                                                                                                                   | 8/50 [09:18<36:48, 52.58s/it, best_val=488.1][I 2025-07-15 16:32:17,741] Trial 7 pruned. 
Tuning PPO:  18%|████████████████████████████                                                                                                                                | 9/50 [09:49<31:51, 46.63s/it, best_val=488.1][I 2025-07-15 16:33:53,289] Trial 9 pruned. 
Tuning PPO:  20%|███████████████████████████████                                                                                                                            | 10/50 [11:25<40:17, 60.44s/it, best_val=488.1][I 2025-07-15 16:33:53,348] Trial 13 pruned. 
Tuning PPO:  22%|██████████████████████████████████                                                                                                                         | 11/50 [11:25<39:17, 60.44s/it, best_val=488.1][I 2025-07-15 16:34:00,067] Trial 11 pruned. 
Tuning PPO:  24%|█████████████████████████████████████▏                                                                                                                     | 12/50 [11:31<22:08, 34.97s/it, best_val=488.1][I 2025-07-15 16:37:23,482] Trial 10 pruned. 
Tuning PPO:  26%|████████████████████████████████████████▎                                                                                                                  | 13/50 [14:55<46:40, 75.70s/it, best_val=488.1][I 2025-07-15 16:37:48,168] Trial 12 pruned. 
Tuning PPO:  28%|███████████████████████████████████████████▍                                                                                                               | 14/50 [15:19<37:33, 62.60s/it, best_val=488.1][I 2025-07-15 16:44:47,316] Trial 14 finished with value: 438.10748291015625 and parameters: {'n_steps': 512, 'batch_size': 64, 'learning_rate': 0.0016766321609430128, 'n_epochs': 20, 'gamma': 0.9750176917715065, 'clip_range': 0.29972741596445507, 'ent_coef': 0.06498172996545244, 'vf_coef': 0.9773872600128846, 'max_grad_norm': 4.637365098206766, 'gae_lambda': 0.9618895904415639, 'layer_size': 32, 'n_layers': 1, 'activation_fn': 'tanh'}. Best is trial 4 with value: 488.125244140625.
Tuning PPO:  30%|█████████████████████████████████████████████▌                                                                                                          | 15/50 [22:19<1:32:19, 158.28s/it, best_val=488.1][I 2025-07-15 16:45:11,360] Trial 15 finished with value: 496.3753967285156 and parameters: {'n_steps': 512, 'batch_size': 64, 'learning_rate': 0.0013453041622806, 'n_epochs': 20, 'gamma': 0.9718161254580119, 'clip_range': 0.31442044580352285, 'ent_coef': 0.07936793081671406, 'vf_coef': 0.9693044620283072, 'max_grad_norm': 4.867747367081336, 'gae_lambda': 0.9809878775727259, 'layer_size': 53, 'n_layers': 1, 'activation_fn': 'tanh'}. Best is trial 15 with value: 496.3753967285156.
Tuning PPO:  32%|████████████████████████████████████████████████▋                                                                                                       | 16/50 [22:43<1:08:36, 121.08s/it, best_val=496.4][I 2025-07-15 16:45:55,118] Trial 16 pruned. 
Tuning PPO:  34%|████████████████████████████████████████████████████▋                                                                                                      | 17/50 [23:26<54:32, 99.15s/it, best_val=496.4][I 2025-07-15 16:46:02,549] Trial 17 pruned. 
Tuning PPO:  36%|███████████████████████████████████████████████████████▊                                                                                                   | 18/50 [23:34<38:46, 72.71s/it, best_val=496.4][I 2025-07-15 16:46:02,603] Trial 21 pruned. 
Tuning PPO:  38%|██████████████████████████████████████████████████████████▉                                                                                                | 19/50 [23:34<37:33, 72.71s/it, best_val=496.4][I 2025-07-15 16:48:38,825] Trial 18 pruned. 
Tuning PPO:  40%|██████████████████████████████████████████████████████████████                                                                                             | 20/50 [26:10<37:34, 75.16s/it, best_val=496.4][I 2025-07-15 16:51:24,638] Trial 20 pruned.
Tuning PPO:  42%|█████████████████████████████████████████████████████████████████                                                                                          | 21/50 [28:56<47:00, 97.27s/it, best_val=496.4][I 2025-07-15 16:53:22,253] Trial 19 pruned.
Tuning PPO:  44%|███████████████████████████████████████████████████████████████████▊                                                                                      | 22/50 [30:54<47:50, 102.53s/it, best_val=496.4][I 2025-07-15 16:53:24,230] Trial 22 pruned.
Tuning PPO:  46%|███████████████████████████████████████████████████████████████████████▎                                                                                   | 23/50 [30:55<33:56, 75.42s/it, best_val=496.4][I 2025-07-15 16:54:51,428] Trial 24 pruned.
Tuning PPO:  48%|██████████████████████████████████████████████████████████████████████████▍                                                                                | 24/50 [32:23<34:06, 78.69s/it, best_val=496.4][I 2025-07-15 16:55:52,082] Trial 23 pruned.
Tuning PPO:  50%|█████████████████████████████████████████████████████████████████████████████▌                                                                             | 25/50 [33:23<30:39, 73.56s/it, best_val=496.4][I 2025-07-15 16:57:01,703] Trial 26 pruned.
Tuning PPO:  52%|████████████████████████████████████████████████████████████████████████████████▌                                                                          | 26/50 [34:33<28:58, 72.43s/it, best_val=496.4][I 2025-07-15 16:57:07,884] Trial 25 pruned.
Tuning PPO:  54%|███████████████████████████████████████████████████████████████████████████████████▋                                                                       | 27/50 [34:39<20:20, 53.08s/it, best_val=496.4][I 2025-07-15 16:58:36,518] Trial 28 pruned.
Tuning PPO:  56%|██████████████████████████████████████████████████████████████████████████████████████▊                                                                    | 28/50 [36:08<23:17, 63.54s/it, best_val=496.4][I 2025-07-15 16:59:42,269] Trial 29 pruned.
Tuning PPO:  58%|█████████████████████████████████████████████████████████████████████████████████████████▉                                                                 | 29/50 [37:14<22:28, 64.20s/it, best_val=496.4][I 2025-07-15 16:59:59,257] Trial 30 pruned.
Tuning PPO:  60%|█████████████████████████████████████████████████████████████████████████████████████████████                                                              | 30/50 [37:31<16:43, 50.17s/it, best_val=496.4][I 2025-07-15 17:02:59,508] Trial 27 pruned.
Tuning PPO:  62%|████████████████████████████████████████████████████████████████████████████████████████████████                                                           | 31/50 [40:31<28:09, 88.94s/it, best_val=496.4][I 2025-07-15 17:02:59,570] Trial 34 pruned.
Tuning PPO:  64%|███████████████████████████████████████████████████████████████████████████████████████████████████▏                                                       | 32/50 [40:31<26:40, 88.94s/it, best_val=496.4][I 2025-07-15 17:05:34,517] Trial 31 pruned.
Tuning PPO:  66%|██████████████████████████████████████████████████████████████████████████████████████████████████████▎                                                    | 33/50 [43:06<23:42, 83.68s/it, best_val=496.4][I 2025-07-15 17:05:38,764] Trial 35 pruned.
Tuning PPO:  68%|█████████████████████████████████████████████████████████████████████████████████████████████████████████▍                                                 | 34/50 [43:10<17:04, 64.04s/it, best_val=496.4][I 2025-07-15 17:07:01,983] Trial 32 pruned.
Tuning PPO:  70%|████████████████████████████████████████████████████████████████████████████████████████████████████████████▌                                              | 35/50 [44:33<17:15, 69.05s/it, best_val=496.4][I 2025-07-15 17:08:03,510] Trial 37 pruned.
Tuning PPO:  72%|███████████████████████████████████████████████████████████████████████████████████████████████████████████████▌                                           | 36/50 [45:35<15:38, 67.00s/it, best_val=496.4][I 2025-07-15 17:08:09,986] Trial 36 pruned.
Tuning PPO:  74%|██████████████████████████████████████████████████████████████████████████████████████████████████████████████████▋                                        | 37/50 [45:41<10:51, 50.08s/it, best_val=496.4][I 2025-07-15 17:08:57,533] Trial 33 finished with value: 493.714599609375 and parameters: {'n_steps': 128, 'batch_size': 128, 'learning_rate': 0.0007079417251072156, 'n_epochs': 19, 'gamma': 0.9469925154902193, 'clip_range': 0.2657425609165338, 'ent_coef': 0.09589948168720173, 'vf_coef': 0.7437431335176007, 'max_grad_norm': 3.6006066960444714, 'gae_lambda': 0.9085422791819773, 'layer_size': 97, 'n_layers': 1, 'activation_fn': 'tanh'}. Best is trial 15 with value: 496.3753967285156.
Tuning PPO:  76%|█████████████████████████████████████████████████████████████████████████████████████████████████████████████████████▊                                     | 38/50 [46:29<09:52, 49.36s/it, best_val=496.4][I 2025-07-15 17:09:56,620] Trial 38 pruned.
Tuning PPO:  78%|████████████████████████████████████████████████████████████████████████████████████████████████████████████████████████▉                                  | 39/50 [47:28<09:33, 52.18s/it, best_val=496.4][I 2025-07-15 17:13:58,875] Trial 39 pruned.
Tuning PPO:  80%|███████████████████████████████████████████████████████████████████████████████████████████████████████████████████████████▏                              | 40/50 [51:30<17:58, 107.80s/it, best_val=496.4][I 2025-07-15 17:15:39,503] Trial 41 pruned.
Tuning PPO:  82%|██████████████████████████████████████████████████████████████████████████████████████████████████████████████████████████████▎                           | 41/50 [53:11<15:51, 105.69s/it, best_val=496.4][I 2025-07-15 17:15:44,261] Trial 42 pruned.
Tuning PPO:  84%|██████████████████████████████████████████████████████████████████████████████████████████████████████████████████████████████████▏                        | 42/50 [53:16<10:06, 75.78s/it, best_val=496.4][I 2025-07-15 17:16:24,425] Trial 43 pruned.
Tuning PPO:  86%|█████████████████████████████████████████████████████████████████████████████████████████████████████████████████████████████████████▎                     | 43/50 [53:56<07:36, 65.18s/it, best_val=496.4][I 2025-07-15 17:16:59,769] Trial 40 finished with value: 499.2447204589844 and parameters: {'n_steps': 512, 'batch_size': 128, 'learning_rate': 0.0011479997356035098, 'n_epochs': 16, 'gamma': 0.9719210212211565, 'clip_range': 0.3049488734225133, 'ent_coef': 0.09323072742768768, 'vf_coef': 0.6167162885603097, 'max_grad_norm': 1.7817038078711125, 'gae_lambda': 0.8114783291254902, 'layer_size': 253, 'n_layers': 3, 'activation_fn': 'relu'}. Best is trial 40 with value: 499.2447204589844.
Tuning PPO:  88%|████████████████████████████████████████████████████████████████████████████████████████████████████████████████████████████████████████▍                  | 44/50 [54:31<05:37, 56.29s/it, best_val=499.2][I 2025-07-15 17:18:35,202] Trial 44 pruned.
Tuning PPO:  90%|███████████████████████████████████████████████████████████████████████████████████████████████████████████████████████████████████████████▌               | 45/50 [56:06<05:39, 67.98s/it, best_val=499.2][I 2025-07-15 17:19:19,418] Trial 45 pruned.
Tuning PPO:  92%|██████████████████████████████████████████████████████████████████████████████████████████████████████████████████████████████████████████████▌            | 46/50 [56:51<04:03, 60.87s/it, best_val=499.2][I 2025-07-15 17:21:09,573] Trial 47 pruned.
Tuning PPO:  94%|█████████████████████████████████████████████████████████████████████████████████████████████████████████████████████████████████████████████████▋         | 47/50 [58:41<03:46, 75.63s/it, best_val=499.2][I 2025-07-15 17:21:47,337] Trial 46 pruned.
Tuning PPO:  96%|████████████████████████████████████████████████████████████████████████████████████████████████████████████████████████████████████████████████████▊      | 48/50 [59:19<02:08, 64.28s/it, best_val=499.2][I 2025-07-15 17:24:49,769] Trial 48 pruned.
Tuning PPO:  98%|█████████████████████████████████████████████████████████████████████████████████████████████████████████████████████████████████████████████████████▉   | 49/50 [1:02:21<01:39, 99.69s/it, best_val=499.2][I 2025-07-15 17:27:04,122] Trial 49 finished with value: 316.3321838378906 and parameters: {'n_steps': 128, 'batch_size': 32, 'learning_rate': 0.0014632119454557372, 'n_epochs': 15, 'gamma': 0.9881658456608418, 'clip_range': 0.307314834824272, 'ent_coef': 0.03904039898589161, 'vf_coef': 0.5093275209766593, 'max_grad_norm': 2.8760661169741053, 'gae_lambda': 0.8655819990087962, 'layer_size': 297, 'n_layers': 3, 'activation_fn': 'relu'}. Best is trial 40 with value: 499.2447204589844.
Tuning PPO: 100%|█████████████████████████████████████████████████████████████████████████████████████████████████████████████████████████████████████████████████████████| 50/50 [1:04:35<00:00, 77.52s/it, best_val=499.2]
Best reward: 499.24
  n_steps: 512
  batch_size: 128
  learning_rate: 0.0011479997356035098
  n_epochs: 16
  gamma: 0.9719210212211565
  clip_range: 0.3049488734225133
  ent_coef: 0.09323072742768768
  vf_coef: 0.6167162885603097
  max_grad_norm: 1.7817038078711125
  gae_lambda: 0.8114783291254902
  layer_size: 253
  n_layers: 3
  activation_fn: relu
Tuning A2C on JAX env with SB3...